"name","phoneNumber","address","rating","reviews","services"
"LaundroKart - Indiranagar - Laundry & Dry Cleaning Services","078991 72075","LaundroKart, 463, 9th Main Rd, near Indiranagar Club, HAL 2nd Stage, Indiranagar, Bengaluru, Karnataka 560038","2.8","73","Services: Quilt cleaning,Clothes pressing,Ironing,Laundry wash and fold,Carpet and rug cleaning,Couches/sofas,Coat & jacket alterations,Special care fabric cleaning,Leather and suede cleaning,Jackets,Delivery,Online dry cleaner booking,Dry cleaning,General bedding cleaning,Laundry pick-up,Commercial service,Bed Linen Cleaning,Carpet Cleaning Services,Cleaning Services,Curtain Care,Curtain Cleaning,Deep Cleaning,Dry Cleaning,Home Clean,Laundry Services,Laundry Solution,Online Laundry Service,Pet Care,Quilt Cleaning,Shoe Laundry,Stain Removal,Steam Pressing,Washing And Dry,Washing Clothes"
"The Laundry Basket, Kumaraswamy Layout","080 4218 1111","Vyasaraya Ballal Rd, below Polar Bear/ Lenskart, 1st Stage, Kumaraswamy Layout, Bengaluru, Karnataka 560078","3.8","145","Services: Ironing,Laundry wash and fold,Self-service laundry,Dry cleaning,Laundry Services"
"Spins and dry laundry","078296 66611","F 606, E W College Main Rd, above stop n joy, Bel Layout I Phase, 1st stage, Bharat Nagar, Bengaluru, Karnataka 560091","5.0","60","Services: Laundry wash and fold,Special care fabric cleaning,General Wash, dry and fold clothes"
"Laundrology - Laundry, Dry Clean, Shoe & Bag repairs","099161 32132","4th B Cross Rd, Varsova Layout, Kaggadasapura, Bengaluru, Karnataka 560093","4.6","306","Services: Quilt cleaning,Ironing,General clothes drying,Laundry wash and fold,Special care fabric cleaning,Self-service laundry,Leather and suede cleaning,Dry cleaning,Drapery & window cover cleaning,General bedding cleaning,Laundry pick-up,Wedding gown preservation,Bag Cleaning,Bag Repairs,Bag Spa,Bed Linen,Blanket Cleaning,Blanket/Quilt Cleaning,Blazer Dry Cleaning,Car Seat Cover Dry Clean,Carpet & Rug Cleaning,Carpet Cleaning,Carpet Dry Clean,Classic Wash,Classic Wash & Fold,Classic Wash & Ironing,Clothes Cleaning,Coat Dry Clean,Curtain Cleaning,Customer Support,Designer Clothes,Dry Clean Laundrology,Dry Cleaners,Dry Cleaning Pickup,Dry Cleaning Service Near,Dry Cleaning Wash,Express Service,Fabric Softeners,Home Linen,Home Services,Just Steam Press,Laundry & Dry Cleaning,Laundry Detergent,Laundry Pickup,Leather Cleaning,Leather Cleaning & Conditioning,Leather Jacket Dry Clean,Leather Shoes Dry Clean,Leather Spa,Pickup & Delivery Service,Pickup And Delivery,Pillow Dry Clean,Premium Dry Cleaner,Premium Steam Iron,Premium Steam Press,Premium Wash,Prime Wash,Prime Wash Laundrology,Regular Wash,Sanitization Service,Saree Roll Press & Polish,Saree Roll Press & Polishing,School Bag,School Bags,Shoe Cleaning,Shoe Cleaning & Conditioning,Shoe Repairs,Shoe Repairs & Cobbler Services,Shoe Shining,Shoe/Bag Cleaning & Repairs,Sneaker Cleaning,Special Care,Stain Removal,Stain Treatment,Star Laundry,Steam Press,Suit Cleaning,Suitcase & Bags Cleaning & Repairs,Suitcase Repairs,Toys Cleaning,Trolley Repair,Wash & Dry Cleaning,Wash And Fold,Wash And Iron,Wedding Dress Dry Cleaning"
"You Laundry Bangalore - Free Pickup & Drop Service | Best Laundry & Dry Cleaning Service","098342 45757","slv grand excutive, Spice Garden Layout, Lakshminarayana Pura, AECS Layout, Marathahalli, Bengaluru, Karnataka 560037","4.9","99","Services: Delivery,Drapery & window cover cleaning,Dry cleaning,General clothes drying,Ironing,Laundry pick-up,Laundry wash and fold,Leather and suede cleaning,Quilt cleaning,Self-service laundry,Special care fabric cleaning,1 BHK,2 BHK,Hostel & PG Service,Washing Cloths,Antiseptic Wash,Bag Cleaning,Clothing Clean,College Bags,Commercial Laundry,Drapery Cleaning,Fabric Conditioner,Fabric Softener,Home Cleaning,Laundry Clothes,Leather Shoes,Normal Wash,Normal Clothes,Premium Wash Service,Regular Wash,Shoe Spa,Shoes Cleaning,Shoes Laundry,Sofa Cleaning,Sports Shoes,Stain Removal,Traveling Bags,Wash and Iron,Blanket Cleaning,Shoes Dry cleaning,best laundry in banaglore for dry cleaning,best shoe cleaning laundry banaglore,best window curtains laundry,shoe cleaning,carpet cleaning"
"Tumbledry Dry Clean & Laundry Service","076772 50250","238/607, Ground Floor, near KPC Layout, Kasavanahalli, Bengaluru, Karnataka 560035","4.3","113","Services: Laundry wash and fold,Leather and suede cleaning,Delivery,Dry cleaning,Laundry pick-up,Art Dry Cleaning,Bag Cleaning,Blanket & Quilt Dry Cleaning,Canvas Shoes Dry Cleaning,Carpet Cleaning,Carpet Dry Cleaning,Coat & Blazer Dry Cleaning,Color Enhancement After Dry Cleaning,Curtain & Blinds Dry Cleaning,Curtain Dry Cleaning Service,Curtain Ring Replacement,Customized Treatment,Damaged Collar Replacement,Darning,Deep Cleaning,Dry Cleaning & Laundry,Dry Cleaning Facility,Free Pickup,Handbag Dry Cleaning,Haute Couture Dry Cleaning,Heel Replacement,Inner Lining Replacement,Inner Sole Replacement,Jacket Dry Cleaning,Laces Replacement,Leather & Suede,Leather & Suede Shoes Dry Cleaning,Leather Bag Dry Cleaning,Leather Dry Cleaning,Lehenga & Bridal Wear Dry Cleaning,Packing,Re Coloring,Saree Dry Cleaning,Silk Sarees,Soft Toys Dry Cleaning,Sole Pasting,Sorting & Inspection,Sports Shoes Dry Cleaning,Stain Removal,Stain Treatment,Steam Iron,Steam Ironing,Whitening After Dry Cleaning,Women Kurta & Salwar Dry Cleaning,Woolen & Shawl Dry Cleaning,Woolen Garments,Woolens Dry Cleaning,Premium Laundry,Wash & Steam Ironing,Wash & fold service"
"Shiva Dry Cleaners","085532 81463","#247,opp Sri Sai English High School, 2nd Main, 2nd Cross, Audugodi, Nanjappa Layout, Adugodi, Bengaluru, Karnataka 560030","4.5","22","N/A"
"PERILO LAUNDROMAT (Before Wash Buddy Pai Layout)","096110 97867","25-9, 2nd Cross Rd, Sakshi Nagar, Pai Layout, Mahadevapura, Bengaluru, Karnataka 560016","3.5","131","Services: Ironing,Laundry wash and fold,Special care fabric cleaning,Delivery,Dry cleaning,Laundry pick-up,Wedding gown preservation,Bags Cleaning,Express Service,Home Cleaning,Normal Wash,Stain Removal,Wash & Iron,Commercial service"
"The Laundry Basket","089045 80903","Number 688, Ground Floor, 7th main, 2, 10th Cross Rd, above Sri Devi Bakery, Mico Layout, BTM 2nd Stage, Bengaluru, Karnataka 560076","5.0","32","Services: Quilt cleaning,Ironing,General clothes drying,Laundry wash and fold,Self-service laundry,Delivery,Dry cleaning,General bedding cleaning,Laundry pick-up,Bathroom Cleaning,Bulk Laundry,Car Cleaning,Cleaners Iron,Cleaning And Sanitization,Cleaning And Washing,Cleaning Procedures,Clothes Pressed,Commercial Cleaning,Corporate Laundry,Deep Cleaners,Deep House Cleaning,Door Step Pick Up,Dry Cleaning Services In Bangalore,Express Laundry,Exterior Cleaning,Fabric Laundry,Furniture Cleaning,Home Deep Cleaning,Home Laundry,Hotel Laundry Services,Housekeeping Services,Kitchen Cleaning,Laundry & Dry Cleaning Business,Laundry Pick-Up,Laundry Pickup,Laundry Service In Bangalore,Mattress Cleaning,Online Ironing,Online Laundry Service,Pick Up And Deliver,Pick Up And Delivery,Regular Laundry,Shoe Dry Cleaning,Shoe Laundry,Shoe Wash,Sofa Cleaning,Sofa Shampooing,Stain Removal,Standard Laundry,Wash & Steam Press,Wash Only,Wash Your,Wash, Dry, Fold,Washing And Iron,Washing Clothes,Wet Cleaning"
"Glow Dry Cleaners","099018 15686","1595/A, 27th Cross, 30th Main Rd, near DG Petrol Bunk, opp. to Maruti Suzuki showroom, Banashankari Stage II, Bengaluru, Karnataka 560070","4.8","36","Services: Carpet and rug cleaning,Delivery,Drapery & window cover cleaning,Dry cleaning,General bedding cleaning,Jackets,Laundry pick-up,Leather and suede cleaning"
"Bubbles Laundromat","098802 34800","3, 155, Tavarekere Main Rd, Tavarekere, Venkateshwara Layout, S.G. Palya, Bengaluru, Karnataka 560029","4.0","51","Services: Delivery,Dry cleaning"
"James Bond Dry Cleaners - Since 1970 | Dry Cleaning | Carpet Cleaning | Blanket Cleaning | Curtain Cleaning | Darning","096636 68007","Koramangala Club Swimming Pool, 81 F, 17th E Main Rd, opposite The, 6th Block, Koramangala, Bengaluru, Karnataka 560095","4.5","310","Services: Eco-friendly cleaning,Clothes pressing,Ironing,Carpet and rug cleaning,Self-service laundry,Delivery,Dry cleaning,Drapery & window cover cleaning,Alterations,General bedding cleaning,Bed Sheets,Carpet Cleaning,Cleaning And Ironing,Cleaning And Laundry,Cleaning Business,Clothes Dry Cleaning,Collection Service,Curtain Cleaning,Cushion Covers,Darning,Darning Services,Dropping Off,Dry Cleaning Linen,Dyeing,Fabric Care,Formal Wear,Garment Care,Home Linen,Home Pick Up,Jeans Pants,Laundry And Pressing,Laundry Pick-Up,Linen Cleaning,Mens Wear,Normal Cleaning,Pick And Drop,Regular Cleaning,Saree Dyeing,Saree Polishing,Saree Polishing1,Saree Printing,Shoe Dry Cleaning,Shoe Laundry,Silk Sarees,Silk Shirts,Sofa Cleaning,Specialized Cleaning,Sustainable Service,Tailoring Services,Upholstery Cleaning,Water Cleaning,Wedding Gowns,Clothes dyeing"
"James Bond Dry Cleaners - Since 1970 | Carpet Cleaning | Blanket Cleaning | Curtain Cleaning | Shoe Cleaning","096636 68007","8, 24th Main Rd, opposite to Empire Hotel, 5th Phase, Ayodya Nagar, J P Nagar Phase 5, J. P. Nagar, Bengaluru, Karnataka 560078","4.6","930","Services: Organic dry cleaning,Quilt cleaning,Clothes pressing,Carpet and rug cleaning,Coat & jacket alterations,Special care fabric cleaning,Leather and suede cleaning,Online dry cleaner booking,Dry cleaning,Drapery & window cover cleaning,Wedding gown preservation,Wedding dress cleaning,Bed Sheets,Carpet Cleaning,Cleaning And Ironing,Cleaning And Laundry,Cleaning Business,Clothes Dry Cleaning,Coat dry cleaning,Collection Service,Curtain Cleaning,Cushion Covers,Darning,Darning Services,Dropping Off,Dry Cleaning Linen,Dry cleaners in jp nagar,Fabric Care,Formal Wear,Garment Care,Home Linen,Home Pick Up,Jeans Pants,Laundry And Pressing,Laundry Pick-Up,Mens Wear,Normal Cleaning,Pick And Drop,Pick Up And Drop,Regular Cleaning,Saree Dyeing,Saree Polishing,Saree Printing,Shoe Dry Cleaning,Shoe Laundry,Silk Saree Dry cleaning,Silk Sarees,Silk Shirts,Sofa Cleaning,Specialized Cleaning,Steam pressing,Suit dry cleaning (Mens),Sustainable Service,Tailoring Services,Upholstery Cleaning,Water Cleaning,Wedding Gowns"
"Washify Laundry and Dry Cleaning services","063605 36997","Silver Springs Layout, Munnekollal, Bengaluru, Karnataka 560066","4.4","63","Services: General clothes drying,Laundry wash and fold,Leather and suede cleaning,Delivery,Dry cleaning,Laundry pick-up,Clean Service,Clean Your Clothes,Dry Clean Service,Dry Cleaning,Express Wash,Home Services,Laundry And Dry,Laundry And Dry Clean,Laundry And Dry cleaning,Laundry Care,Premium Laundry,Shoe  cleaning"
"Tumbledry Dry Clean & Laundry Service","076772 50250","204, Ground Floor, 15th Main Rd, opposite Chinmaya Vidyalaya, 4th Block, Koramangala, Bengaluru, Karnataka 560034","4.5","160","Services: Ironing,Laundry wash and fold,Delivery,Dry cleaning,Bag Cleaning & Restoration,Blanket & Quilt Dry Cleaning,Canvas Shoes Dry Cleaning,Carpet Cleaning,Carpet Dry Cleaning,Coat & Blazer Dry Cleaning,Color Enhancement After Dry Cleaning,Curtain & Blinds Dry Cleaning,Curtain Dry Cleaning,Damaged Collar Replacement,Darning,Deep Cleaning,Dry Cleaning & Laundry Service,Dry Cleaning Facility,Handbag Dry Cleaning,Haute Couture Dry Cleaning,Heel Replacement,Inner Lining Replacement,Inner Sole Replacement,Jacket Dry Cleaning,Laces Replacement,Leather & Suede,Leather & Suede Shoes Dry Cleaning,Leather Bag Dry Cleaning,Leather Dry Cleaning,Lehenga & Bridal Wear Dry Cleaning,Re Coloring,Saree Dry Cleaning,Silk Sarees,Soft Toys Dry Cleaning,Sole Pasting,Sports Shoes Dry Cleaning,Stain Removal,Steam Iron,Steam Ironing,Whitening After Dry Cleaning,Women Kurta & Salwar Dry Cleaning,Woolen & Shawl Dry Cleaning,Woolens Dry Cleaning,Premium Laundry,Wash & Steam Ironing,Wash & fold service"
"R The Shoe Laundry Services","096638 73791","1345/A, Kathriguppe Main Rd, Ashok Nagar, Banashankari 1st Stage, Basavanagudi, Bengaluru, Karnataka 560050","4.9","205","Services: Delivery,Laundry pick-up,Shoe repair"
"Fabrico Laundry & Dry Clean","0120 682 4455","11th, 1468, 38th Cross Rd, 4th T Block East, Pattabhirama Nagar, Jayanagar, Bengaluru, Karnataka 560041","4.6","56","Services: Quilt cleaning,Ironing,General clothes drying,Laundry wash and fold,Special care fabric cleaning,Self-service laundry,Leather and suede cleaning,Delivery,Dry cleaning,Drapery & window cover cleaning,General bedding cleaning,Laundry pick-up,Wedding gown preservation,Free Pickup,Garment Care,Kg Wash,Laundry & Dry Clean,Laundry Wash,Pick Up & Drop,Premium Laundry,Shoe Cleaning,Steam Press,Wash & Fold,Wash & Iron,Wash And Dry Cleaning"
"Prince Dry Cleaners","080 2310 7786","1023, 4th M Block, Gopalapura, Rajajinagar, Bengaluru, Karnataka 560010","4.3","51","Services: Carpet and rug cleaning,Dry cleaning,Ironing,Leather and suede cleaning,Wedding dress cleaning,Blanket,Cotton saree,Pant,Shirt,Silk Dhoti,Silk Saree,Silk shirt,Saree Softening Dry Clean,Conditioning/Perfume dry clean,Designer gown/ dresses dry clean,Quilts/blankets deep cleaning,Designer suits conditioning care"
"Drip Dry Co - The best laundry in your hood.","063604 52157","213, 1st main, 2nd Cross Rd, 7th Block, Koramangala, Bengaluru, Karnataka 560070","4.6","69","Services: General bedding cleaning,General clothes drying,Laundry pick-up,Laundry wash and fold,Laundry wash and Iron"
"The Metro Wash","063620 89009","No. 510, Basement Floor, 3rd C Main Rd, below Hush Puppies, HRBR Layout 3rd Block, HRBR Layout, Kalyan Nagar, Bengaluru, Karnataka 560043","4.5","90","Services: Delivery,Drapery & window cover cleaning,General bedding cleaning,General clothes drying,Ironing,Laundry pick-up,Laundry wash and fold,Self-service laundry,Laundry Service,Washing,Clothes washing,Wash & Fold,Wash & Iron,Instant Laundry,Quick Laundry,Fast Laundry,Express Laundry,Quilt cleaning,Shoe Laundry,Blanket Laundry,Quilt Laundry,Trolly Bag Laundry,Laundromat"
"Shuchi Laundry","088844 40337","Canara Bank Layout, Rajiv Gandhi Nagar, Kodigehalli, Bengaluru, Karnataka 560097","5.0","77","Services: Dry cleaning,Ironing,Laundry pick-up,Laundry wash and fold,wash And Iron"
"Wash Corner","099002 57722","Shop no 2, Balagere road, varthur, next to MMA KABAB, Bengaluru, Karnataka 560087","4.4","170","Services: General bedding cleaning,Carpet and rug cleaning,Clothes pressing,Laundry pick-up,Delivery,Dry cleaning,Ironing,Leather and suede cleaning,Online dry cleaner booking,Self-service laundry,Special care fabric cleaning,Laundry wash and fold,Wedding gown preservation,Dry Cleaning Services,Express Service,Home Linen,Kg Wash,Regular Garments,Shoe And Bag Laundry,Shoe Cleaning,Stain Removal,Steam Press,Shirt Service,Laundry Services,Deep clean,Mattress cleaning,Office and workplace cleaning,Standard cleaning,Sofa cleaning,Bathroom cleaning,Kitchen cleaning,General carpet cleaning,Drapes and curtain cleaning,Leather cleaning"
"Victory Dry Cleaners","098445 23864","Shop No. 40, Brigade Road, Shanthala Nagar, Bengaluru, Karnataka 560001","4.2","27","N/A"
"Quick laundry expert","099018 78862","8th Cross Road, #18/3, 1st Main Rd, DRC Post, Venkateshwara Layout, S.G. Palya, Bengaluru, Karnataka 560029","4.4","16","N/A"
"UClean Laundry| Dry Cleaning| Shoe Cleaning","099997 59911","Ground Floor, No 29, 4th Cross, next to Govt School, JP Nagar 7th Phase, Bengaluru, Karnataka 560078","4.6","73","Services: Ironing,General clothes drying,Laundry wash and fold,Special care fabric cleaning,Self-service laundry,Leather and suede cleaning,Delivery,Dry cleaning,Drapery & window cover cleaning,General bedding cleaning,Laundry pick-up,100% Sanitized Clothes,Bag Cleaning,Bulk Washing,Car Cleaning,Carpet Cleaning,Cleaning And Disinfecting,Cleaning Process,Cleaning Up,Clothes Cleaned,Curtain Cleaning,Custom Packaging Fold Or Hang,Doorstep Pick Up And Drop,Drapes Clean,Dry Cleaners,Emergency Service,Express Service,Green Certified Detergents,Home Cleaning Services,Ironing Clothes,Kg Wash,Laundry & Dry Cleaning,Laundry By Kg,Laundry By Kilo,Laundry Process,Laundry Wash And Fold,Laundry Wash And Iron,Live Laundry,Normal Cleaning,On Demand Service Also Available,Personalized Care,Pickup & Drop,Premium Laundry,Quick Service,Safe Service,Shoe Cleaning,Sofa Cleaning,Soft toy cleaning,Stain Removal,Stain Treatment,Steam Sterilization,Vacuum Steam Iron,Wash & iron service,Wash My Clothes,Washing Machine,Washing Process,Water Cleaning"
"Laundrology - Laundry, Dry Clean, Shoe & Bag repairs","099161 32132","Shop 1, Begur - Koppa Rd, opposite eco hyper market, Suraksha nagar, Yelenahalli, Akshayanagar, Bengaluru, Karnataka 560076","4.1","77","Services: Quilt cleaning,Clothes pressing,Ironing,Laundry wash and fold,Car wash,Carpet and rug cleaning,Special care fabric cleaning,Leather and suede cleaning,Jackets,Delivery,Online dry cleaner booking,Dry cleaning,Laundry pick-up,Wedding dress cleaning,Bag Spa,Bed Linen,Blanket/Quilt Cleaning,Blazer Dry Cleaning,Carpet & Rug Cleaning,Classic Wash,Clothes Cleaning,Curtain Cleaning,Designer Clothes,Dry Clean Laundrology,Dry Cleaning Wash,Home Linen,Laundry & Dry Cleaning,Laundry Detergent,Leather Cleaning & Conditioning,Leathers & Suede,Pickup & Delivery Service,Premium Steam Press,Prime Wash Laundrology,Saree Roll Press & Polishing,Shoe & Bag Repair,Shoe Cleaning & Conditioning,Shoe Cleaning & Repairs,Shoe Repairs & Cobbler Services,Sneaker Cleaning,Stain Treatment,Steam Iron,Suit Cleaning,Suitcase & Bags Cleaning & Repairs,Toys Cleaning,Trolley Repair,Wash And Fold,Wash And Iron,Wedding Dress Dry Cleaning,General clothes drying,Blanket Cleaning,Car Seat Cover Dry Clean,Carpet Dry Clean,Classic Wash & Fold,Classic Wash & Ironing,Coat Dry Clean,Customer Support,Dry Cleaning Pickup,Dry Cleaning Service Near,Express Service,Just Steam Press,Laundry Pickup,Leather Jacket Dry Clean,Leather Shoes Dry Clean,Leather Spa,Pickup And Delivery,Pillow Dry Clean,Premium Dry Cleaner,Premium Steam Iron,Premium Wash,Sanitization Service,Saree Roll Press & Polish,School Bag,Shoe Shining,Shoe/Bag Cleaning & Repairs,Stain Removal,Star Laundry,Wash & Dry Cleaning"
"Glaze Dry Cleaners","093412 58780","16th Cross Rd, Akshaya Nagar 2nd Block, Ramamurthy Nagar, Bengaluru, Karnataka 560016","4.8","331","Services: Ironing,Clothing alterations & repairs,Laundry wash and fold,Carpet and rug cleaning,Couches/sofas,Coat & jacket alterations,Special care fabric cleaning,Leather and suede cleaning,Jackets,Dry cleaning,Drapery & window cover cleaning,General bedding cleaning,Darning,Washing"
"THE SMART WASH","N/A","Near 2245/1, KR Road, 1, 23rd Cross Rd, opp. Lakme Salon, Banashankari Stage II, Bengaluru, Karnataka 560070","4.1","48","Services: Quilt cleaning,Ironing,General clothes drying,Laundry wash and fold,Delivery,Dry cleaning,Drapery & window cover cleaning,General bedding cleaning,Laundry pick-up"
"Laundry Champ Dry Clean & Laundry Service","099022 73911","Shop No 29/7, Thimmareddy Complex, RK Twp Rd, RK Twp, Yarandahalli, Bengaluru, Bommasandra, Karnataka 560105","5.0","33","Services: Ironing,General clothes drying,Laundry wash and fold,Special care fabric cleaning,Self-service laundry,Delivery,Dry cleaning,Laundry pick-up,Clean Your,Cleaning Agents,Commercial Laundry Services,Dry Clean & Laundry Service,Express Laundry Service,Express Service,Fabric Care,Laundry Pick-up & Delivery,Laundry Process,Laundry wash & iron,Non-wearable Laundry Service,Pickup & Delivery,Premium Laundry Service,Premium Service,Special Services,Stain Removal Services,Steam Iron,Steam Press Iron,Wash Dry Fold,Wash Dry Iron,Web and Mobile App based Service,Leather and suede cleaning,Bag Cleaning,Shoe Cleaning"
"A1 Shoe Laundry Dry Cleaners","072040 12945","No. 43, G.B, Prakash Building, Ejipura Main Rd, viveknagar post, Gowda Muniswamy Garden, Ejipura, Bengaluru, Karnataka 560047","4.6","70","Services: Heel repair,Sole repair,Stitching repair,Polishing,Clothing alterations & repairs,Dry cleaning,Laundry wash and fold,Leather and suede cleaning,Special care fabric cleaning,Dry Cleaning Ejipura,Shoe Dry cleaning service,General clothes drying,Shoe Cleaning Service Ejipura,Shoe Shining service in koramgala ejipura,Boot Cleaning in Ejipura Koramangala,Boot Polishing in Ejipura Koramangala,Shoe Restoration in Ejipura, Koramangala,Shoe Shine Services,Shoe Cleaning in Bangalore,Shoe Clean and shine service,Shine Shoes in Ejipura Koramangala,Shoe Dry Cleaning Service,Shoe Cleaning Service Ejipura,Shoe Shining service in Koramangala Ejipura,Shine Shoes in Ejipura Bangalore,Shoe Clean and shine service Ejipura,Leather Shoes Cleaning service in Koramangala,Shoe service in Ejipura Koramangala,Shoe Cleaning Ejipura,Shoe Cleaning,Stain Removal,Sneaker Cleaning,Boot Care and Cleaning,Luxury Shoe Shine,Shoe Care Services,Leather Shoes repair service in koramangala,shoe service in koramangala,Shoe repair service in ejipura koramangala"
"Expert Dry Cleaners","080 2336 4258","No:201, Link Rd, Seshadripuram, Bengaluru, Karnataka 560020","3.9","71","Services: Ironing,Laundry wash and fold,Carpet and rug cleaning,Couches/sofas,Coat & jacket alterations,Special care fabric cleaning,Jackets,Delivery,Online dry cleaner booking,Dry cleaning,Laundry pick-up,Commercial service,Wedding gown preservation,General carpet cleaning,Drapes and curtain cleaning"
"Laundry Wallah","063612 89767","704, 13th Main Rd, Mico Layout, Hongasandra, Bengaluru, Karnataka 560068","3.9","67","Services: Quilt cleaning,Ironing,General clothes drying,Laundry wash and fold,Special care fabric cleaning,Self-service laundry,Leather and suede cleaning,Delivery,Dry cleaning,Laundry pick-up,Wedding gown preservation,Any Type to Stain Removing,Blanket Washing,Carpet Cleaning,Clean/Wash/Iron,Curtain Cleaning,Curtons Dry Cleaning,Deep Cleaning,Dry Cleaning,Drycleaners near me services,Free Pickup & Drop,Laundry near me service,Online Laundry Service,Premium Laundry,Same Day Delivery,Saree Roll Press And Polish,Saree drycleaning,Shoe Laundry,Stain Removing,Steam Ironing,Wedding Dress Dry Cleaning,cloth washing,laundry"
"Laundry Point","083107 75764","108, near Tulasi Luxury Ladies PG, near Olive Greens, Vyalikaval HBCS Layout, Nagavara, Bengaluru, Karnataka 560045","4.3","41","Services: Dry cleaning,Ironing,Laundry pick-up,Laundry wash and fold,Quilt cleaning,Special care fabric cleaning"
"Coin Laundromat (BTM Layout)","088807 67777","Maruthi Nagar Main Road, 2nd A Cross Rd, Madiwala, 1st Stage, BTM Layout, Bengaluru, Karnataka 560068","3.7","122","N/A"
"SPIN CYCLES - Dry Clean & Premium Laundry","093533 79806","National High School Road, next to Ganesh Chat, Vishweshwarapura, Basavanagudi, Bengaluru, Karnataka 560004","4.7","122","Services: Quilt cleaning,Clothes pressing,Ironing,Clothing alterations & repairs,Carpet and rug cleaning,Coat & jacket alterations,Special care fabric cleaning,Self-service laundry,Online dry cleaner booking,Alterations,Laundry pick-up,Bag Cleaning,Bag Repair,Blanket Cleaning,Carpet Dry Cleaning,Carpet Rug Cleaning,Commercial Laundry Services,Curtain Dry Cleaning,Doorstep Pickup And Drop,Dry Cleaning Wash,Laundry And Dry Clean,Leather Cleaning,Luxe Service,Pickup And Delivery,Premium Dry Cleaning,Premium Laundry Service,Premium Steam Iron,Quilt Dry Cleaning,Saree Roll Press & Polish,Shoe Cleaning,Shoe Laundry,Shoe Repair,Shoes Dry cleaning,Suit Cleaning,Suitecase Trolley Repair,Toy Cleaning,Wash & Fold Bag,Wash & Iron,Wedding Dress Dry Cleaning"
"Dry Cleaning 365","099450 35025","No. 1433, 6th Cross, Leela Palace Rd, HAL 3rd Stage, Kodihalli, Bengaluru, Karnataka 560008","4.8","40","N/A"
"SPIN CYCLES - Dry Clean & Premium Laundry","088800 04880","CPS HOUSE, 23/2, Ulsoor Rd, next to Vidyadeep college, Yellappa Garden, Yellappa Chetty Layout, Sivanchetti Gardens, Bengaluru, Karnataka 560042","4.4","126","Services: Laundry wash and fold,Carpet and rug cleaning,Leather and suede cleaning,Delivery,Online dry cleaner booking,Dry cleaning,Bag Cleaning,Bag Repair,Blanket Cleaning,Carpet Dry Cleaning,Carpet Rug Cleaning,Commercial Laundry Services,Curtain Dry Cleaning,Doorstep Pickup And Drop,Dry Cleaning Wash,Laundry And Dry Clean,Leather Cleaning,Luxe Service,Pickup And Delivery,Premium Dry Cleaning,Premium Laundry Service,Premium Steam Iron,Quilt Dry Cleaning,Saree Roll Press & Polish,Shoe Cleaning,Shoe Laundry,Shoe Repair,Suit Cleaning,Suitecase Trolley Repair,Toy Cleaning,Wash & Fold Bag,Wash & Iron,Wedding Dress Dry Cleaning"
"The Fairy Land Fabricare, Laundry & Dry cleaning","098458 05366","Electonic City, Naidu Layout, Shanthi Pura, Phase 2, Electronic City, Bengaluru, Karnataka 560100","4.9","59","Services: Quilt cleaning,Ironing,Laundry wash and fold,Special care fabric cleaning,Self-service laundry,Leather and suede cleaning,Delivery,Dry cleaning,Drapery & window cover cleaning,Laundry pick-up,Wedding gown preservation"
"SAN Spinners Laundry service","097317 56762","Shiva Parvathy Kalyana Mantap, 3rd E main road, Road, OMBR Layout, Banaswadi, Bengaluru, Karnataka 560043","4.2","51","Services: General bedding cleaning,Laundry pick-up,Quilt cleaning,Delivery,Dry cleaning,General clothes drying,Ironing,Self-service laundry,Special care fabric cleaning,Laundry wash and fold,IRON,Laundry,sofa cleaning"
"Fabrico Laundry & Dry Clean Service","0120 682 4455","OA Towers, 5th Cross Rd, KHB Colony, 5th Block, Koramangala, Bengaluru, Karnataka 560095","4.0","112","Services: Delivery,Drapery & window cover cleaning,Dry cleaning,General bedding cleaning,General clothes drying,Ironing,Laundry pick-up,Laundry wash and fold,Leather and suede cleaning,Quilt cleaning,Self-service laundry,Special care fabric cleaning,Wedding gown preservation,Shoe Cleaning,Laundry,premium Laundry,Premium Steam Press,Steam press,Wash & Fold,Wash & Iron,Starching,Premium Dry Clean,Free Pickup,Garment Care,Kg Wash,Laundry & Dryclean"
