"name","phoneNumber","address","rating","reviews","services"
"Tumbledry Dry Clean & Laundry Service","076772 50250","Gem Wellington, 127-7/GF, HAL Old Airport Rd, Murugeshpalya, Bengaluru, Karnataka 560017","3.9","99","Services: Laundry wash and fold,Carpet and rug cleaning,Leather and suede cleaning,Dry cleaning,Art Dry Cleaning,Bag Cleaning,Blanket & Quilt Dry Cleaning,Canvas Shoes Dry Cleaning,Carpet Cleaning,Carpet Dry Cleaning,Coat & Blazer Dry Cleaning,Color Enhancement After Dry Cleaning,Curtain & Blinds Dry Cleaning,Curtain Dry Cleaning Service,Curtain Ring Replacement,Customized Treatment,Damaged Collar Replacement,Darning,Deep Cleaning,Dry Cleaning & Laundry,Dry Cleaning Facility,Free Pickup,Handbag Dry Cleaning,Haute Couture Dry Cleaning,Heel Replacement,Inner Lining Replacement,Inner Sole Replacement,Jacket Dry Cleaning,Laces Replacement,Leather & Suede,Leather & Suede Shoes Dry Cleaning,Leather Bag Dry Cleaning,Leather Dry Cleaning,Lehenga & Bridal Wear Dry Cleaning,Packing,Re Coloring,Saree Dry Cleaning,Silk Sarees,Soft Toys Dry Cleaning,Sole Pasting,Sorting & Inspection,Sports Shoes Dry Cleaning,Stain Removal,Stain Treatment,Steam Iron,Steam Ironing,Whitening After Dry Cleaning,Women Kurta & Salwar Dry Cleaning,Woolen & Shawl Dry Cleaning,Woolen Garments,Woolens Dry Cleaning,Self-service laundry,Premium Laundry,Wash & Steam Ironing,Wash & fold service"
"Western Popular Dry Cleaners","096862 68075","#1/1,1st cross, 2nd main, near St flowers English school chbs layout, 3rd, stage, chandra layout, Bengaluru, Karnataka 560040","4.6","25","N/A"
"GOPI LAUNDRY SHOP","099457 51777","16th, c Main, 2nd Cross Rd, Indiranagar, Bengaluru, Karnataka 560008","4.7","31","N/A"
"Fabricspa","080 4664 4664","Old No 29/1, New, 48, Railway Parallel Rd, Kumara Park West, Bengaluru, Karnataka 560020","3.4","33","Services: Clothes pressing,Ironing,Clothing alterations & repairs,Laundry wash and fold,Car wash,Carpet and rug cleaning,Couches/sofas,Coat & jacket alterations,Special care fabric cleaning,Self-service laundry,Jackets,Delivery,Online dry cleaner booking,Dry cleaning,General bedding cleaning,Laundry pick-up,Commercial service,Wedding gown preservation,Bed Linen,Bed Sheets,Bleaching & Whitening,Clean Clothes,Clothing Laundry,Designer Wear Laundry,Dry Cleaning & Laundry,Fabric Care,Folding Services,Home Furnishing,Home Linen,Laundry Pick Up,Mens Wear,Pickup And Delivery,Roll Press,Shoe Repairs,Stain Removal,Upholstery Cleaning,Urgent Delivery,Wash Only,Wash Steam Press,Wet Wash,Womens Wear,General carpet cleaning,Drapes and curtain cleaning"
"Samitha laundry services","N/A","2nd Cross Rd, Krishna Reddy Layout, Amarjyoti Layout, Domlur, Bengaluru, Karnataka 560071","5.0","3","Services: Clothing alterations & repairs,Delivery,Drapery & window cover cleaning,Dry cleaning,General bedding cleaning,General clothes drying,Ironing"
"S R drycleaning","095919 99618","190/13,1st, main arekere mico layout,opp.bank of baroda Arekere gate brilgad millennium road opp. Bank of baroda Beside south india shopping mall, Bengaluru, Karnataka 560076","4.8","107","Services: Ironing,Clothing alterations & repairs,Laundry wash and fold,Carpet and rug cleaning,Couches/sofas,Coat & jacket alterations,Special care fabric cleaning,Self-service laundry,Leather and suede cleaning,Jackets,Delivery,Online dry cleaner booking,Dry cleaning,Drapery & window cover cleaning,Alterations,General bedding cleaning,Laundry pick-up,Commercial service,Wedding gown preservation,Silk sarees dryclening mat dryclening. We are doing all type of clothes dryclening . Free pick up and drop ."
"SUNSHINE LAUNDRY AND DRY CLEANING SERVICE","099809 00558","2nd main, 2nd Cross Rd, near govt school, Siddapura, Bengaluru, Karnataka 560066","4.5","76","Services: Delivery,Dry cleaning,Ironing,Laundry pick-up,Laundry wash and fold,Special care fabric cleaning"
"Vidyuth Laundry Services","N/A","XJ76+6X6, Masjid St, Yellagondanpalya, Victoria Layout, Bengaluru, Karnataka 560047","5.0","1","N/A"
"Laundrology - Laundry, Dry Clean, Shoe & Bag repairs","N/A","near Adishwar Electro World, 280, Varthur Main Rd, Ramagondanahalli, Bengaluru, Karnataka 560066","4.9","46","Services: Quilt cleaning,Clothes pressing,Ironing,Laundry wash and fold,Car wash,Delivery,Dry cleaning,Drapery & window cover cleaning,General bedding cleaning,Laundry pick-up,Wedding dress cleaning,Bag Spa,Bed Linen,Blanket/Quilt Cleaning,Blazer Dry Cleaning,Carpet & Rug Cleaning,Classic Wash,Clothes Cleaning,Curtain Cleaning,Designer Clothes,Doorstep Pickup,Dry Clean Laundrology,Dry Cleaning Wash,Express Service,Home Linen,Insole Replacement,Laundry & Dry Cleaning,Laundry Detergent,Leather Cleaning & Conditioning,Leather Shoes,Leathers & Suede,Pickup & Delivery Service,Premium Steam Press,Prime Wash Laundrology,Saree Roll Press & Polishing,Shoe & Bag Repair,Shoe & Bag Repairs,Shoe Cleaning & Conditioning,Shoe Cleaning & Repairs,Shoe Repairs & Cobbler Services,Shoelace Replacement,Sneaker Cleaning,Sole Replacement,Stain Treatment,Steam Iron,Suit Cleaning,Suitcase & Bags Cleaning & Repairs,Toys Cleaning,Wash And Fold,Wash And Iron,Wedding Dress Dry Cleaning,General clothes drying"
"LaundroKart - Arekere, JP Nagar - Laundry & Dry Cleaning Services","078991 72075","Nataraja Layout, Wilson Garden Society, JP Nagar 7th Phase, Arekere, Bengaluru, Karnataka 560078","3.9","37","Services: Ironing,Laundry wash and fold,Car wash,Carpet and rug cleaning,Couches/sofas,Coat & jacket alterations,Special care fabric cleaning,Self-service laundry,Leather and suede cleaning,Jackets,Delivery,Online dry cleaner booking,Dry cleaning,Laundry pick-up,Commercial service,Wedding gown preservation,Garment Laundry,Shoe Laundry,Steam Pressing,Wash And Iron,Washing Clothes,Drapes and curtain cleaning"
"Kenico Dry Cleaners","N/A","59 sampige East park road, 15th Cross Rd, opposite Beagles Basketball Club, Bengaluru, Karnataka 560003","4.8","6","N/A"
"LaundroKart - AECS Layout Marathahalli - Laundry & Dry Cleaning Services","078991 72075","60 Feet Rd, opp. Inolyst - Trademark Registration, AECS Layout - D Block, AECS Layout, Marathahalli, Bengaluru, Karnataka 560037","3.5","85","Services: Ironing,Laundry wash and fold,Car wash,Carpet and rug cleaning,Couches/sofas,Coat & jacket alterations,Special care fabric cleaning,Self-service laundry,Leather and suede cleaning,Jackets,Delivery,Online dry cleaner booking,Dry cleaning,Laundry pick-up,Commercial service,Wedding gown preservation,Garment Laundry,Shoe Laundry,Steam Pressing,Wash And Iron,Washing Clothes,Drapes and curtain cleaning"
"Tumbledry Dry Clean & Laundry Service","076772 50250","The Hive, 104/6, Basement Floor Byatarayanapura, 234 International , Sahakar NagarAirport Road, Sahakar Nagar, Bengaluru, Karnataka 560092","2.7","71","Services: Laundry wash and fold,Leather and suede cleaning,Dry cleaning,Art Dry Cleaning,Bag Cleaning,Blanket & Quilt Dry Cleaning,Canvas Shoes Dry Cleaning,Carpet Cleaning,Carpet Dry Cleaning,Coat & Blazer Dry Cleaning,Color Enhancement After Dry Cleaning,Curtain & Blinds Dry Cleaning,Curtain Dry Cleaning Service,Curtain Ring Replacement,Customized Treatment,Damaged Collar Replacement,Darning,Deep Cleaning,Dry Cleaning & Laundry,Dry Cleaning Facility,Free Pickup,Hand Bag Dry Cleaning,Haute Couture Dry Cleaning,Heel Replacement,Inner Lining Replacement,Inner Sole Replacement,Jacket Dry Cleaning,Laces Replacement,Leather & Suede,Leather & Suede Shoes Dry Cleaning,Leather Bag Dry Cleaning,Leather Dry Cleaning,Lehenga & Bridal Wear Dry Cleaning,Packing,Re Coloring,Saree Dry Cleaning,Silk Sarees,Soft Toys Dry Cleaning,Sole Pasting,Sorting & Inspection,Sport Shoes Dry Cleaning,Stain Removal,Stain Treatment,Steam Iron,Whitening After Dry Cleaning,Women Kurta & Salwar Dry Cleaning,Woolen & Shawl Dry Cleaning,Woolen Garments,Woolens Dry Cleaning,Steam Ironing,Wash & Fold,Wash & Steam Iron"
"PERILO LAUNDROMAT (Nagwara)","088845 44580","Murari Arcade, Philomena Hospital Rd, Chanakya Layout, Nagawara, Bengaluru, Karnataka 560016","4.2","13","Services: Quilt cleaning,Ironing,Laundry wash and fold,Special care fabric cleaning,Self-service laundry,Leather and suede cleaning,Delivery,Dry cleaning,General bedding cleaning,Laundry pick-up,Bag Cleaning,Bed Linens,Blanket Cleaning,Curtain Cleaning,Dry Cleaning Services,Express Services,Home Linen,Laundry And Dry,Laundry Pickup,Linen Cleaning,Luxe Service,Normal Service,Premium Laundry Service,Regular Wash,Saree Roll Press & Polish,Shoe Cleaning Services,Steam Iron,Wash & Fold Service,Wash & Iron Service,Wash and Fold Service,Wash and Iron Service"
"Tumbledry Dry Clean & Laundry Service","076772 50250","Shop No 471, Anand Arcade, Kanakapura Main Road Narayan Nagar 1st Block, Doddakallasandra, Doddakalsandra, Bengaluru, Karnataka 560062","4.6","45","Services: Laundry wash and fold,Self-service laundry,Premium Laundry,Wash & Steam Ironing,Wash & fold service,Carpet and rug cleaning,Leather and suede cleaning,Laundry pick-up,Art Dry Cleaning,Bag Cleaning,Blanket & Quilt Dry Cleaning,Canvas Shoes Dry Cleaning,Carpet Cleaning,Carpet Dry Cleaning,Coat & Blazer Dry Cleaning,Color Enhancement After Dry Cleaning,Curtain & Blinds Dry Cleaning,Curtain Dry Cleaning Service,Curtain Ring Replacement,Customized Treatment,Damaged Collar Replacement,Darning,Deep Cleaning,Dry Cleaning & Laundry,Dry Cleaning Facility,Free Pickup,Handbag Dry Cleaning,Haute Couture Dry Cleaning,Heel Replacement,Inner Lining Replacement,Inner Sole Replacement,Jacket Dry Cleaning,Laces Replacement,Leather & Suede,Leather & Suede Shoes Dry Cleaning,Leather Bag Dry Cleaning,Leather Dry Cleaning,Lehenga & Bridal Wear Dry Cleaning,Packing,Re Coloring,Saree Dry Cleaning,Silk Sarees,Soft Toys Dry Cleaning,Sole Pasting,Sorting & Inspection,Sports Shoes Dry Cleaning,Stain Removal,Stain Treatment,Steam Iron,Steam Ironing,Whitening After Dry Cleaning,Women Kurta & Salwar Dry Cleaning,Woolen & Shawl Dry Cleaning,Woolen Garments,Woolens Dry Cleaning"
"JP Laundry","089047 00456","No 22 Basement 4th cross, Wind Tunnel Rd, below SBI ATM, Murugeshpalya, Bengaluru, Karnataka 560017","4.3","22","Services: Quilt cleaning,Delivery,Drapery & window cover cleaning,Dry cleaning,General clothes drying,Laundrys on Kg basis,Wash and Iron, wash and fold, steam iron"
"Fabricspa","063616 65424","No 505, Ground Floor, Chinmaya Mission Hospital Rd, Indira Nagar 1st Stage, Bengaluru, Karnataka 560038","3.0","136","Services: Ironing,Clothing alterations & repairs,Laundry wash and fold,Car wash,Carpet and rug cleaning,Couches/sofas,Coat & jacket alterations,Special care fabric cleaning,Jackets,Delivery,Online dry cleaner booking,Dry cleaning,General bedding cleaning,Laundry pick-up,Commercial service,Wedding gown preservation,Bed Linen,Bed Sheets,Bleaching & Whitening,Clean Clothes,Clothing Laundry,Designer Wear Laundry,Dry Cleaning & Laundry,Fabric Care,Folding Services,Home Furnishing,Home Linen,Laundry Pick Up,Mens Wear,Pickup And Delivery,Roll Press,Shoe Repairs,Stain Removal,Upholstery Cleaning,Urgent Delivery,Wash Only,Wash Steam Press,Wet Wash,Womens Wear,General carpet cleaning,Drapes and curtain cleaning"
"BRIT & WHITE CLEANERS AND DRY CLEANERS","063621 75501","189,3rd Cross, Shirdi Sai Baba Mandir Rd, Halasuru, Cambridge Layout, Bengaluru, Karnataka 560008","5.0","6","Services: Quilt cleaning,Ironing,General clothes drying,Laundry wash and fold,Special care fabric cleaning,Leather and suede cleaning,Delivery,Dry cleaning,Drapery & window cover cleaning,General bedding cleaning,Laundry pick-up,Wedding gown preservation,Pre"
"Revive Laundry Services","077600 07736","1420, 11th Main, 37th B Cross Rd, Jayanagar, Bengaluru, Karnataka 560041","3.7","3","Services: Clothes pressing,Quilt cleaning,Commercial service,Delivery,Dry cleaning,Industrial laundry,Ironing,Jackets,Laundry pick-up,Laundry wash and fold,Leather and suede cleaning,Online dry cleaner booking,Organic dry cleaning,Special care fabric cleaning,Wedding dress cleaning,Wedding gown preservation"
"SVP DRY CLEANERS & LAUNDRY","091086 12650","ITI Employess Housing Colony, B Narayanapura, Mahadevapura, Bengaluru, Karnataka 560016","4.1","38","Services: Ironing,Quilt cleaning,Dry cleaning,Laundry pick-up,Laundry wash and fold,General clothes drying,General bedding cleaning,Special care fabric cleaning,Shree polishing"
"Asian dry cleaners","N/A","#337,, 2nd block, 3rd stage, near 88A bus stop, basaveshwarnagar, banglore-560079, banglore, Karnataka 560079","4.8","5","N/A"
"Wonder Wash Pvt Ltd","080 2356 6789","No.83/1, Soundarya Paramount Complex, 5th Cross Rd, Malleshwaram, Bengaluru, Karnataka 560003","3.7","29","Services: Ironing,Self-service laundry,Dry cleaning,Steam Pressing,Commercial service"
"Prince Dry Cleaners","080 4114 7786","Shop No-170, V.C.N.Complex, 1st Main Road, Seshadripuram, Seshadripuram Main Rd, Kumara Park West, Bengaluru, Karnataka 560020","3.8","22","N/A"
"LaundroKart - Hoodi - Laundry & Dry Cleaning Services","099169 58888","178/4, Shop 2, Hoodi Basvanna Nagar Road, post, Hoodi, Mahadevpura, Bengaluru, Karnataka 560048","4.0","119","Services: Organic dry cleaning,Quilt cleaning,Ironing,Laundry wash and fold,Carpet and rug cleaning,Couches/sofas,Coat & jacket alterations,Special care fabric cleaning,Self-service laundry,Leather and suede cleaning,Jackets,Delivery,Online dry cleaner booking,Dry cleaning,Drapery & window cover cleaning,General bedding cleaning,Laundry pick-up,Commercial service,Wedding gown preservation,Bed Linen Cleaning,Carpet Cleaning Services,Curtain Care,Curtain Cleaning,Deep Cleaning,Dry Cleaning,Garment Care,Home Clean,House Clothing,Online Laundry Service,Organic Cleaning,Pet Care,Quilt Cleaning,Shoe Laundry,Stain Removal,Steam Pressing,Wash & Iron,Washing And Dry,Washing Clothes"
"LaundroKart - Vignan Nagar - Laundry & Dry Cleaning Services","099169 58888","51, 4th Main Rd, Malleshpalya, Kaggadasapura, Bengaluru, Karnataka 560075","3.9","122","Services: Ironing,Laundry wash and fold,Car wash,Carpet and rug cleaning,Couches/sofas,Coat & jacket alterations,Special care fabric cleaning,Leather and suede cleaning,Jackets,Delivery,Online dry cleaner booking,Dry cleaning,General bedding cleaning,Laundry pick-up,Commercial service,Wedding gown preservation,Garment Laundry,Shoe Laundry,Steam Pressing,Wash And Iron,Washing Clothes,General carpet cleaning,Upholstery cleaning,Drapes and curtain cleaning,Pet stain and odour removal"
"RAKHA LAUNDRY & DRY CLEANING","N/A","WJJ5+69V, Tavarekere, Krishna Murthi Layout, S.G. Palya, Bengaluru, Karnataka 560029","4.7","134","N/A"
"SPIN CYCLES - Dry Clean & Premium Laundry","088800 04880","Kuvempu Nagar, Bikasipura, Bengaluru, Karnataka 560062","4.6","70","Services: Industrial laundry,Eco-friendly cleaning,Organic dry cleaning,Quilt cleaning,Clothes pressing,Ironing,Laundry wash and fold,Car wash,Carpet and rug cleaning,Special care fabric cleaning,Self-service laundry,Jackets,Hat cleaning,Delivery,Online dry cleaner booking,Dry cleaning,Drapery & window cover cleaning,General bedding cleaning,Laundry pick-up,Wedding gown preservation,Wedding dress cleaning,Bag Cleaning,Bag Cleaning & Bag Repair,Bag Repair,Bed Linens,Blanket Cleaning,Blanket Cleaning Quilt Cleaning,Carpet Dry Cleaning,Carpet Rug Cleaning,Clothes Wash & Iron,Commercial Laundry Services,Cotton Sarees,Curtain Dry Cleaning,Door Step Services,Doorstep Pickup,Drop Service,Dropping Off,Dry Cleaned Clothes,Dry Cleaning & Laundry,Dry Cleaning Wash,Duvet Cleaning,Free Pickup And Drop,Home Delivery,Home Linen,Home Pickup,Home Pickup And Delivery,Jacket Cleaning,Jeans Pants,Laundry And Dry Clean,Laundry Service Nearby,Leather Cleaning,Leather Cleaning Conditioning,Linen Cleaning,Long Dress,Lux Service,Luxe Service,Online Dry Cleaning Service,Online Laundry Services,Pattu Sarees Dry Cleaning,Pick Up And Delivery,Pick Up And Drop,Premium Dry Cleaning,Premium Laundry Service,Premium Steam Iron,Premium Wash,Quilt Dry Cleaning,Regular Wash,Saree Roll Press & Polish,Shoe Cleaning,Shoe Cleaning & Shoe Repair,Shoe Laundry,Shoe Repair,Shoe Wash Service,Silk Sarees,Stain Removal,Stains Removed,Steam Press,Suit Cleaning,Suitecase Trolley Repair,Toy Cleaning,Trolley Cleaning & Trolley Repair,Wash & Fold Bag,Wash & Fold Service,Wash & Iron,Wedding Dress Dry Cleaning"
"Washmart Laundry & Dryclean","072177 97548","22, 2nd Cross, 19th Cr, Road, near Apurva MakeOver Studio And Academy, MEI Layout, Bagalakunte, Bengaluru, Karnataka 560073","4.8","36","Services: Clothing alterations & repairs,General bedding cleaning,Carpet and rug cleaning,Clothes pressing,Laundry pick-up,Commercial service,Delivery,Drapery & window cover cleaning,Dry cleaning,Eco-friendly cleaning,Embroidery,Hat cleaning,Industrial laundry,Ironing,Jackets,Leather and suede cleaning,Online dry cleaner booking,Organic dry cleaning,Special care fabric cleaning,Laundry wash and fold,Wedding dress cleaning,Wedding gown preservation,Doorstep Pickup & Delivery,Home Cleaning,Pillow Cases,Shoe Cleaning,Stain Removal,Starching,Wash Dry Cleaning,Wash Ironing,Wash Laundry,Carpet Cleaning,Curtains Cleaning,Dry Cleaning Laundry,Eco Friendly Cleaning,Eco-Friendly Laundry,Folded Laundry,Garment Care,Mattress Cleaning,Monthly Cleaning,Pickup And Delivery,Regular Cleaning,Same Day Delivery,Sofa Cleaning,Specialized Cleaning,Wash And Fold Services,Wash And Iron,Washing And Drying,Clothes Washed,Free Pick Up And Delivery,Laundry Detergent,Laundry Facilities,Bag Cleaning,Cleaning Ironing,Clothes Cleaned,Dropping Off,Garments Washed,Kids Wear,Laundry & Dry Cleaning,Leather/Suede/Furs,Men's Wear,Online Laundry,Premium Laundry,Request Pickup,Shoes Cleaning,Steam Press,Wash & Fold,Wash & Iron,Wedding Gowns,Women's Wear,Woolen Laundry,Express Cleaning,Fabric Care,Garment Alterations,Laundry & Dryclean,Upholstery cleaning,Mattress cleaning,Standard cleaning,Carpet Cleaning"
"Laundrokart - Frazer Town - Laundry & Dry Cleaning Services","078991 72075","41, Buddha Vihara Rd, Pulikeshi Nagar, Bengaluru, Karnataka 560005","3.6","48","Services: Clothes pressing,Ironing,Laundry wash and fold,Car wash,Carpet and rug cleaning,Self-service laundry,Leather and suede cleaning,Delivery,Dry cleaning,Laundry pick-up,Wedding gown preservation,Curtain Cleaning,Garment Laundry,Shoe Laundry,Steam Pressing,Wash And Iron,Washing Clothes"
"SPIN CYCLES - Dry Clean & Premium Laundry","088800 04880","31, 19th A Cross Rd, Kaggadasapura, Bengaluru, Karnataka 560093","4.0","187","N/A"
"Glow dry cleanrs","080 2658 7787","2031, 9th Cross Rd, near tirumala venkateshwara temple, Marenahalli, 2nd Phase, J. P. Nagar, Bengaluru, Karnataka 560078","2.8","18","Services: Carpet and rug cleaning,Coat & jacket alterations,Drapery & window cover cleaning,Wedding gown preservation"
"Fabricspa","079757 39716","No 202, Vinayaka Enterprises, 17th E Main Rd, opposite Muthooth Finance, KHB Block Koramangala, 5th Block, Koramangala, Bengaluru, Karnataka 560095","3.5","45","Services: Clothes pressing,Ironing,Clothing alterations & repairs,Laundry wash and fold,Carpet and rug cleaning,Couches/sofas,Coat & jacket alterations,Special care fabric cleaning,Self-service laundry,Leather and suede cleaning,Jackets,Delivery,Online dry cleaner booking,Dry cleaning,General bedding cleaning,Laundry pick-up,Commercial service,Wedding gown preservation,Bed Linen,Bed Sheets,Clean Clothes,Clean Wet Wash,Clothing Laundry,Designer Wear Laundry,Dry Cleaning & Laundry,Fabric Care,Garment Dry Clean,Home Furnishing,Home Linen,Laundry Pick Up Service,Mens Wear,Pickup And Delivery,Roll Press,Shoe Repairs,Stain Removal,Upholstery Cleaning,Urgent Delivery,Wash Only,Wash Steam Press,Womens Wear,General carpet cleaning,Drapes and curtain cleaning"
"SPIN CYCLES - Dry Clean & Premium Laundry","088800 04880","3rd Cross, Vaastu pleasant, Sai Baba Temple Rd, Green Garden Layout, Silver Springs Layout, Munnekollal, Bengaluru, Karnataka 560037","4.1","199","Services: Quilt cleaning,Clothes pressing,Ironing,Clothing alterations & repairs,Laundry wash and fold,Car wash,Carpet and rug cleaning,Coat & jacket alterations,Self-service laundry,Leather and suede cleaning,Jackets,Delivery,Online dry cleaner booking,Dry cleaning,Drapery & window cover cleaning,General bedding cleaning,Laundry pick-up,Wedding dress cleaning,Bag Cleaning,Bag Repair,Blanket Cleaning,Carpet Dry Cleaning,Carpet Rug Cleaning,Commercial Laundry Services,Cotton Sarees,Curtain Dry Cleaning,Doorstep Pickup And Drop,Dry Cleaning Wash,Express Services,Free Pickup,Home Linen,Laundry And Dry Clean,Leather Cleaning,Luxe Service,Online Laundry Services,Patch Work,Pickup And Delivery,Premium Dry Cleaning,Premium Laundry Service,Premium Steam Iron,Premium Wash,Quilt Dry Cleaning,Regular Wash,Saree Polishing,Saree Roll Press,Saree Roll Press & Polish,Shoe Cleaning,Shoe Cleaning Services,Shoe Laundry,Shoe Repair,Shoe Wash Service,Silk Sarees,Stain Removal,Steam Press,Suit Cleaning,Suitecase Trolley Repair,Toy Cleaning,Trolley Repair,Wash & Fold Bag,Wash & Iron,Wash And Iron,Waste Removal,Water Treatment,Wedding Dress Dry Cleaning,Wet Cleaning,shirt,Drapes and curtain cleaning"
"BAND BOX CLEANERS & DYERS","080 2552 4059","No. Bengaluru, 203, 17th E Main Rd, KHB Block Koramangala, M.G. Railway Colony, Koramangala, Bengaluru, Karnataka 560095","3.3","26","Services: Car wash,Carpet and rug cleaning,Delivery,Dry cleaning,General bedding cleaning,Wedding dress cleaning,Blanket Cleaning Quilt Cleaning,Car Seat Cover Cleaning,Carpet Cleaning Home,Clean And Ironed,Cotton Saree,Curtain Cleaning,Darning,Double Blanket,Dry Cleaning Washing,Dyeing,Home Linen,Ladies Wear,Mens Wear,Pick Up And Deliver,Pickup And Delivery,Saree Polishing,Saree Printing,Scheduled Collection,Silk Dhoti,Silk Saree,Soft Toy/Pillow Cleaning,Stain Removal,Suit 2 Pc,T-Shirts,Wedding Gown"
"Agnes Iron & Dry Cleaning Shop","098867 04123","2, Ground Floor, Umbegoud Building, 5th Cross Rd, Vinayaka Layout, Whitefield, Bengaluru, Karnataka 560066","4.0","40","N/A"
"S.V.Dry Cleaners","N/A","No.34,80 Feet Road, End, R.T., Bangalore, HMT Layout, RT Nagar, Bengaluru, Karnataka 560032","5.0","2","N/A"
"Tumbledry Dry Clean & Laundry Service","076772 50250","LG Floor, No 4M, 414, 4th Main Rd, HBR Layout 2nd Block, Kalyan Nagar, Bengaluru, Karnataka 560043","2.6","38","Services: Ironing,Laundry wash and fold,Delivery,Laundry pick-up,Art Dry Cleaning,Bag Cleaning,Blanket & Quilt Dry Cleaning,Canvas Shoes Dry Cleaning,Carpet Cleaning,Carpet Dry Cleaning,Coat & Blazer Dry Cleaning,Color Enhancement After Dry Cleaning,Curtain & Blinds Dry Cleaning,Curtain Dry Cleaning Service,Curtain Ring Replacement,Customized Treatment,Damaged Collar Replacement,Darning,Deep Cleaning,Dry Cleaning & Laundry,Dry Cleaning Facility,Free Pickup,Handbag Dry Cleaning,Haute Couture Dry Cleaning,Heel Replacement,Inner Lining Replacement,Inner Sole Replacement,Jacket Dry Cleaning,Laces Replacement,Leather & Suede,Leather & Suede Shoes Dry Cleaning,Leather Bag Dry Cleaning,Leather Dry Cleaning,Lehenga & Bridal Wear Dry Cleaning,Packing,Re Coloring,Saree Dry Cleaning,Silk Sarees,Soft Toys Dry Cleaning,Sole Pasting,Sorting & Inspection,Sports Shoes Dry Cleaning,Stain Removal,Stain Treatment,Steam Iron,Steam Ironing,Whitening After Dry Cleaning,Women Kurta & Salwar Dry Cleaning,Woolen & Shawl Dry Cleaning,Woolen Garments,Woolens Dry Cleaning,Self-service laundry,Premium Laundry,Wash & Steam Ironing,Wash & fold service"
"Snoways Laundry and dry cleaning","080 2661 5025","17, 8th Cross Rd, CK Nagar, NR Colony, Basavanagudi, Bengaluru, Karnataka 560019","3.4","21","N/A"
"LaundroKart - Electronic City Phase 2 - Laundry & Dry Cleaning Services","N/A","Laundrokart, #1260, 1st Floor, Anantha Nagar Main Road Opposite: Agarwal Bhavan, 2, Electronic City, Bengaluru, Karnataka 560100","3.7","110","Services: Carpet and rug cleaning,Clothes pressing,Laundry pick-up,Coat & jacket alterations,Commercial service,Couches/sofas,Delivery,Dry cleaning,Industrial laundry,Ironing,Jackets,Leather and suede cleaning,Online dry cleaner booking,Special care fabric cleaning,Laundry wash and fold,Garment Laundry,Shoe Laundry,Steam Pressing,Wash And Iron,Washing Clothes,Drapes and curtain cleaning,Upholstery cleaning,Mattress cleaning,Pet stain and odour removal"
"Fabricspa","080 4095 2275","356, Upper Palace Orchards, No 1, Esteem Plaza, 20, 4th Main Rd, Sadashiva Nagar, Bengaluru, Karnataka 560080","3.1","35","Services: Clothes pressing,Ironing,Clothing alterations & repairs,Laundry wash and fold,Car wash,Carpet and rug cleaning,Couches/sofas,Coat & jacket alterations,Special care fabric cleaning,Self-service laundry,Jackets,Delivery,Online dry cleaner booking,Dry cleaning,General bedding cleaning,Laundry pick-up,Commercial service,Wedding gown preservation,Bed Linen,Bed Sheets,Bleaching & Whitening,Clean Clothes,Clothing Laundry,Designer Wear Laundry,Dry Cleaning & Laundry,Fabric Care,Folding Services,Home Furnishing,Home Linen,Laundry Pick Up,Mens Wear,Pickup And Delivery,Roll Press,Shoe Repairs,Stain Removal,Upholstery Cleaning,Urgent Delivery,Wash Only,Wash Steam Press,Wet Wash,Womens Wear,Upholstery cleaning"
"Fabricspa","080 4095 2275","356, Upper Palace Orchards, No 1, Esteem Plaza, 20, 4th Main Rd, Sadashiva Nagar, Bengaluru, Karnataka 560080","3.1","35","Services: Clothes pressing,Ironing,Clothing alterations & repairs,Laundry wash and fold,Car wash,Carpet and rug cleaning,Couches/sofas,Coat & jacket alterations,Special care fabric cleaning,Self-service laundry,Jackets,Delivery,Online dry cleaner booking,Dry cleaning,General bedding cleaning,Laundry pick-up,Commercial service,Wedding gown preservation,Bed Linen,Bed Sheets,Bleaching & Whitening,Clean Clothes,Clothing Laundry,Designer Wear Laundry,Dry Cleaning & Laundry,Fabric Care,Folding Services,Home Furnishing,Home Linen,Laundry Pick Up,Mens Wear,Pickup And Delivery,Roll Press,Shoe Repairs,Stain Removal,Upholstery Cleaning,Urgent Delivery,Wash Only,Wash Steam Press,Wet Wash,Womens Wear,Upholstery cleaning"
