"name","phoneNumber","address","rating","reviews","services"
"Sri Bhuvaneshwari Laundry And Dry Cleaning Services","090666 47559","Ashraya towers, 1B Main Rd, S T Bed Layout, Koramangala, Bengaluru, Karnataka 560034","4.8","319","Services: Quilt cleaning,Ironing,General clothes drying,Laundry wash and fold,Special care fabric cleaning,Self-service laundry,Leather and suede cleaning,Delivery,Dry cleaning,Drapery & window cover cleaning,Laundry pick-up,Wedding gown preservation,Cleaning Services,Door Step Pick Up,Dry Cleaning Services,Laundry And Dry,Pick Up,Pick Up And Delivery,Wash and iron"
"ClothCare Premium Laundry","070195 83898","6th Cross ITI Layout 10th Main, 6th Cross, Yellukunte Village, HSR Layout, Bengaluru, Karnataka 560068","4.8","572","Services: Quilt cleaning,Ironing,Clothing alterations & repairs,Laundry wash and fold,Special care fabric cleaning,Delivery,Dry cleaning,Laundry pick-up,Bedsheet Double,Cloth Care,Deliver Services,Double Quilt,Dry Cleaning Service,Express Laundry,Free Pickup & Delivery,Laundry,Normal Washing,Pick & Delivery,Premium Laundry Service,Premium Wash,Premium Washing,Saree Cotton,Shoe Laundry,Shop Laundry,Single Bedsheet,Sports shoes Care,Wash & Fold,Wash And Iron"
"SK Laundry and Dry cleaners","090823 00751","No.141, 1st floor, Omkar Hills Road, Basappa Layout, Pattanagere, Rajarajeshwari Nagar, Bengaluru, Karnataka 560098","4.8","805","Services: Carpet and rug cleaning,Clothes pressing,Coat & jacket alterations,Commercial service,Delivery,Drapery & window cover cleaning,Dry cleaning,Eco-friendly cleaning,General bedding cleaning,Ironing,Jackets,Laundry pick-up,Laundry wash and fold,Leather and suede cleaning,Online dry cleaner booking,Quilt cleaning,Special care fabric cleaning,Wedding gown preservation,Bed Linen,Blanket Cleaning,Cleaning Services,Curtains Cleaned,Customer services,Environmentally Conscious Cleaning,Free Pickup,Hand Wash,Laundry Services,Shoe Cleaning Services,Stain Removal,Steam Press,Steam Pressing,Suitcase Cleaning,Upholstery Cleaner,Wash & Iron,Wash And Iron,Bag Cleaning,Boots Cleaning,Bridal Wears,Carpet Rug Cleaning,Clothes Clean,Curtain Cleaning,Dry Cleaning & Laundry Services,Fabric Cleaners,Free Home Delivery,Free Pickup And Delivery,Garment Care,Home Cleaning,House Cleaning,Laundry And Dry Cleaners,Leather And Suede,Leather Bags,Leather Cleaning,Leather Goods,Leather Items,Leather Shoes,Minor Repairs,Personalized Service,Same Day Delivery,Sandals Cleaning,Shoe Laundry,Silk Sarees,Sneakers Cleaning,Soft Toys Cleaning,Specialized Cleaning,Sports Shoes Cleaning,Spot Treat,Stain Removing,Steam Ironing,Suit Cleaning,Wash And Dry Cleaning,Wash And Fold,Washing Clothes,Wedding Gown Cleaning And Preservation,Area rug cleaning,Drapes and curtain cleaning,General carpet cleaning,Upholstery cleaning"
"Laundry Station","081977 55774","1420, 11th main, 37th B Cross Rd, Jayanagar, Bengaluru, Karnataka 560041","4.8","200","Services: Ironing,Clothing alterations & repairs,Dry cleaning,Bath Robe,Bath Towel -L,Bed Cover Double,Bed Cover Single,Bed Sheet Double,Bed Sheet Single,Blanket Double,Blanket Single,Blazer/coat,Blouse/Top,Cardigan/Sweter,Commecial Service,Curtain L,Curtain M,Curtain S,Curtain XL,Cushion,Cushion Cover -L,Cushion Cover -M,Cushion Cover -S,Dhothi / Lungi/Turban,Door Curtain L,Door Curtain M,Dress,Dry Cleaner,Dry Wash,Dupatta,Free Pickup And Delivery,Frock,Frock With Work,Hand Towel,Handkercheif,Handkerchief,Hotels Laundry Services,Ironing Services,Jacket/Jerkin,Kurtha/Kurti/Kameez,Laundry & Dry Cleaning,Lehanga Set,Night Dress/Nighty,Over Coat,Petticoat/liner,Pick Up And Delivery,Pickup And Drop,Pillow,Pillow Cover,Premium Laundry,Salwar /Pyjama,Saree,Saree With Work,Sherwani,Shirt /T Shirt/Skirt,Shorts,Slip/Under Garment/Bra,Socks (pair),Special Care,Special Clothes,Stain Removing,Steam Ironing,Suit 2 Pcs,Swim Wear,Table Cloth,Table Mat,Tie,Toy/soft Toy L,Toy/soft Toy M,Toy/soft Toy S,Trousers/pants/Jeans,Waist Coat,Wash And Ironing,Wash Your,Wash Your Clothing,Washed Clothes,Wedding Gown,Wedding Gown With Work,Window Curtain L,Window Curtain M"
"Namma Dhobi Laundromat","076760 18864","36C, 3rd Cross Road, Hennur Main Road, Post, Kalyan Nagar, Bengaluru, Karnataka 560043","4.2","146","Services: Industrial laundry,Eco-friendly cleaning,Quilt cleaning,Clothes pressing,Ironing,Clothing alterations & repairs,Laundry wash and fold,Carpet and rug cleaning,Special care fabric cleaning,Leather and suede cleaning,Delivery,Online dry cleaner booking,Dry cleaning,Laundry pick-up,Commercial service,Wedding dress cleaning,Art Dry Cleaning,Bed Sheets,Blanket Double,Blanket Single,Clean Clothes,Cleaning And Pressing,Cleaning Garments,Cleaning Solutions,Clothing Alteration,Commercial Laundry,Commercial Laundry Services,Corporate Services,Doorstep Pick Up,Dry Clean Clothes,Dry Clean Item,Dry Cleaning Garments,Express Wash,Fabric Inspection,Hotel Laundry,Hotel Laundry Services,Hotel Linen,Laundry Dry Cleaning,Laundry Facility,Laundry Laundry,Laundry Pickup,Laundry Room,Laundry Solutions,Laundry Washing,Night Wear,Online Laundry Service,Party Wears,Personal Laundry,Pick Drop,Pick Up And Delivery,Pickup & Drop,Pickup And Delivery,Shirt Service,Shirt Trouser,Silk Dhoti,Silk Saree,Stain Removal,Steam Irons,Steam Pressing,Suits And Blazers,Wash & Fold Services,Wash & Iron,Wash And Dry,Wash And Press,Wash, Dry And Fold,Washer And Dryer,Wedding Dresses"
"The Best Laundry","096201 00368","156,Beml layout,7th stage, Global Village Rd, back gate, mylsandra, Bengaluru, Karnataka 560059","4.4","196","Services: Ironing,Laundry wash and fold,Delivery,Dry cleaning,Drapery & window cover cleaning,General bedding cleaning,Laundry pick-up"
"CLOTH SHOWER LAUNDRY","080884 72267","Shop No 3 1st Cross, Vinayaka Layout Rd, opp. Valley View Pu College, HV Residence, Krishnarajapuram, Bengaluru, Karnataka 560049","4.7","221","Services: Deep clean,Office and workplace cleaning,Moving-related cleaning,Standard cleaning,Ironing,Laundry wash and fold,Special care fabric cleaning,Leather and suede cleaning,Delivery,Dry cleaning,Drapery & window cover cleaning,Laundry pick-up,Wedding gown preservation,Blanket (Single),Inner Wear (Wash & Iron),Premium Laundry Service,Premium Washing,Shirt,W-Top,Wash & Iron,Carpet and rug cleaning,Coat & jacket alterations,Jackets,Online dry cleaner booking,Commercial service"
"The LaundroMart","099490 00244","Sri Vinayaka Theatre, 1st cross Thulasi Theatre Road, Opp Apollo pharmacy lane, Marathalli, Road, Marathahalli, Bengaluru, Karnataka 560037","4.5","184","Services: Delivery,Dry cleaning,Special care fabric cleaning"
"Wash n Wear - Laundry in 1 hour","092430 80984","22, Ground Floor, 7th cross, 1st A Main Rd, BTM 2nd Stage, Bengaluru, Karnataka 560076","4.6","331","Services: General clothes drying,Laundry wash and fold,Self-service laundry,Delivery,Dry cleaning,Laundry pick-up,Bulk Wash,Express Laundry,Pick & Drop,Wash And Dry,Washed Clothes"
"Laundry House","096117 00336","420, 20th Main Rd, 6th Block, Koramangala, Bengaluru, Karnataka 560095","4.5","178","Services: Quilt cleaning,Ironing,General clothes drying,Laundry wash and fold,Special care fabric cleaning,Delivery,Laundry pick-up,Clothes Laundry,Fabric Softeners,Normal Clothes,Pickup And Drop,Trusted Laundry Service"
"Smart Dhobi Express Laundry","070045 38727","#673, 9th Main Rd, Sector 7, HSR Layout, Bengaluru, Karnataka 560102","4.3","240","Services: Quilt cleaning,Ironing,Laundry wash and fold,Special care fabric cleaning,Self-service laundry,Delivery,Dry cleaning,General bedding cleaning,Laundry pick-up,Wedding gown preservation,Bulk Washing Services,Cleaning Process,Delivery Services,Dry Cleaning Services,Express Laundry,Fabric Conditioner,Individual Packing,Normal Cleaning,Normal Wash,Premium Laundry,Regular Wash,Spot Treatment,Stain Removal,Wash & Fold,Wash & Iron,Wash Your Clothes,premium laundry"
"Washho - Laundry | Dry clean & Home cleaning Services","062870 92973","Gate No 3, KP & MG Tower, Opposite Foyer Infinty Pattandur Agrahara Main Road, ITPL Main Rd, Whitefield, Bengaluru, Karnataka 560066","4.1","942","Services: Interior and exterior window cleaning,Deep clean,Office and workplace cleaning,Mattress cleaning,Moving-related cleaning,Standard cleaning,Appliance Cleaning,Balcony Cleaning,Bathroom Fittings,Bathroom Floor,Bathroom Floors,Bed Bugs Control,Body Polish,Brush Cleaning,Cabinets Cleaning,Car Cleaning,Car Cleaning Service,Car Wash,Ceiling Fans,Cleaning Car,Cleaning Interior,Cleaning Service In Chennai,Cleaning Solutions,Complete Cleaning,Corner Cleaning,Dashboard Polish,Dining Room,Exterior Cleaning,Exterior Painting,External Cleaning,Floor Scrubbing,Foam Wash,Fridge Cleaning,Fumigation & Sanitisation,General Cleaning,Home Cleaning Service In Mumbai,Home Furnishings,Home Painting,Industrial Washing,Interior Cleaning,Interior Painting,Kitchen Cleaning,Laundry & Dry Cleaning,Laundry And Dry Cleaning,Laundry And Ironing,Laundry Delivery,Light Fittings,Mattress Cleaning,Party Service,Party Services,Pest Control,Pest Control Treatment,Pest Removal,Pickup & Drop,Premium Dry Cleaning,Recurring Clean,Regular Cleaning,Roof Cleaning,Sanitisation Home,Sanitization Service,Scratches Removal,Sofa Shampooing,Sofa/Carpet Cleaning,Space Cleaning,Stain Removal,Steam Ironing,Termite Control,Urgent Service,Vaccum Cleaner,Vacuum Cleaner,Vacuum Cleaning,Wall Cleaning,Wall Painting,Wash & Fold,Wash & Iron,Washing Machine,Quilt cleaning,Ironing,General clothes drying,Laundry wash and fold,Special care fabric cleaning,Self-service laundry,Dry cleaning,Bathroom Cleaning,Business Laundry,Chemical Wash,Cleaning And Ironing,Cleaning Cleaning,Clothing Cleaning,Custom Cleaning,Customer Support,Dry Cleaners,Dry Cleaning Service In Bangalore,Dry Wash & Iron,Express Service,Full Home Deep Cleaning,Home/Office Cleaning,Home/Office Sanitisation,Ironing Clothes,Laundry & Dry Cleaning Service,Laundry Service In Bangalore,Online Laundry Service,Personalized Service,Premium Fabric Care,Regular Clothes,Regular Laundry Services,Sofa / Carpet Cleaning,Specialized Care,Standard Laundry,Wash My Clothes"
"Wash n Wear - Laundry in 1 hour","092430 80984","RK Avenue ,356, 14th B Cross, 6th Main Rd, Sector 6, HSR Layout, Bengaluru, Karnataka 560102","4.5","317","Services: General clothes drying,Laundry wash and fold,Self-service laundry,Delivery,Bulk Wash,Express Laundry Service,Others Clean,Wash,Washed Clothes"
"Anu Laundry Services","090662 40558","Silicon Town, Dhodnamangla, Bengaluru, Karnataka 560099","4.7","81","Services: Quilt cleaning,Delivery,Dry cleaning,Ironing,Laundry pick-up,Laundry wash and fold,Self-service laundry,Special care fabric cleaning"
"Wash n Wear - Laundry in 1 hour","092430 80984","S 9, 80 Feet Rd, near Wipro Park, 1st Block Koramangala, Koramangala, Bengaluru, Karnataka 560035","4.5","447","Services: Quilt cleaning,General clothes drying,Laundry wash and fold,Self-service laundry,Dry cleaning,Laundry pick-up,Bulk Wash,Bulk Washing Services,Express Laundry Service,Others Clean,Pick & Drop,Wash And Dry,Washed Clothes,Washing Services"
"Chamko Laundry","081973 78069","1/64, 5th Cross Road Achitnagar Soldevanhalli, Post office, near Achitnagar, Bengaluru, Karnataka 560107","4.7","276","Services: Laundry wash and fold,Self-service laundry,Delivery,Ironing Regular Wearables,Regular Wearables,Washing"
"Mummy's Laundry","095913 06330","ground floor, 202, 28th main, 7th Cross Rd, behind icici bank, 1st Sector, HSR Layout, Bengaluru, Karnataka 560102","4.6","292","Services: Quilt cleaning,Dry cleaning,Ironing,Laundry wash and fold"
"Laundry Guru","063628 50839","1554, 11th Cross Rd, 1st Stage, Kumaraswamy Layout, Bengaluru, Karnataka 560078","4.6","257","Services: Dry Clean,Blankets,Wash and Fold"
"THE LAUNDRY","N/A","Mahatma Gandhi Rd, Yellappa Garden, Yellappa Chetty Layout, Sivanchetti Gardens, Bengaluru, Karnataka 560042","4.7","63","Services: Delivery,Wedding gown preservation,Bath Towel,Bed sheet,Cardigan/Shawl,Coat/Jacket,Curtain L,Curtain M,Curtain S,Curtain XL,Dhoti,Dress,Dupatta/Scarf,Duvet/Blanket L,Duvet/Blanket S,Hand Towel,Handkerchief,Kurta/Kurti,Kurta/Kurti/Pyjama,Kurta/Pyjama,Night Suit,Pullover,Pyjama,Salwar Kameez,Salwar/Kameez,Saree,Saree Cotton,Saree Designer,Sherwani Set,Shirt/T Shirt,Shirt/T-Shirt,Shorts,Socks,Suit 2 Pcs,Tie,Top/Blouse,Trouser,Trouser/Jeans,Trousers/Jeans,Under Garments,Wedding Dress"
"The Urban Laundry - Dryclean-Rolling and Ironing","063625 91993","17, 388/17, 19th H Main Rd, 1st Block, 1st N Block, Rajajinagar, Bengaluru, Karnataka 560010","4.7","81","Services: Ironing,General clothes drying,Laundry wash and fold,Special care fabric cleaning,Self-service laundry,Delivery,Dry cleaning,Drapery & window cover cleaning,General bedding cleaning,Laundry pick-up,Wedding gown preservation,Blankets & Curtains,Cleaning Agents,Cleaning Cleaning,Cleaning Clothes,Cleaning Garments,Cleaning Process,Cleaning Products,Cleaning Wash & Iron,Clothes Clean,Collect & Deliver,Curtains Cleaning,Custom Packaging,Deep Clean,Dry Cleaners,Dry Cleaning & Laundry,Dry Cleaning Service,Dry Cleaning Services In Bangalore,Dry Cleaning Wash,Express Services,Fabric Care,Home Linens,Home Washing,Household Item Cleaning,Kg Wash,Laundry & Ironing,Laundry And Dry,Laundry Detergent,Laundry Pickup And Delivery,Laundry Service In Bangalore,Laundry Washing Wash,Online Laundry Services,Organic Laundry,Post Inspection,Premium Dry Cleaning,Saree Cleaning,Saree Rolling,Shirt Service,Shoe Laundry,Soft Toys Cleaning,Sorting & Inspection,Specialized Cleaning,Specialized Services,Spot Cleaning,Stain Removal,Stain Removal Services,Stain Treatment,Steam Ironing,Wash & Fold,Wash & Steam Iron,Wash Laundry Services,Wash N Fold,Washing Machines,Washing Our Clothes,Washing Your Clothes,Wedding Dress Cleaning"
"60 Minutes Wash & Dry","072598 45102","211, 6th Main Rd, KEB Colony, New Gurappana Palya, 1st Stage, BTM 1st Stage, Bengaluru, Karnataka 560029","4.4","85","Services: Ironing,Laundry wash and fold,Special care fabric cleaning,Delivery,General bedding cleaning,Laundry pick-up,Woolen Blankets, Quilts, Bedsheets, curtains, washing service. Clothes are washed, dried & fold in 60 Minutes"
"Chamko Laundry","081973 78069","1/64, 5th Cross Road Achitnagar Soldevanhalli, Post office, near Achitnagar, Bengaluru, Karnataka 560107","4.7","276","Services: Laundry wash and fold,Self-service laundry,Delivery,Ironing Regular Wearables,Regular Wearables,Washing"
"Laundry Guru","063628 50839","1554, 11th Cross Rd, 1st Stage, Kumaraswamy Layout, Bengaluru, Karnataka 560078","4.6","257","Services: Dry Clean,Blankets,Wash and Fold"
"Door To Door Laundry Service","073531 99213","3694, 9th Cross Rd, HAL 2nd Stage, Doopanahalli, Indiranagar, Bengaluru, Karnataka 560038","4.3","54","N/A"
"Smart Dhobi Express Laundry","070045 38727","#673, 9th Main Rd, Sector 7, HSR Layout, Bengaluru, Karnataka 560102","4.3","240","Services: Quilt cleaning,Ironing,Laundry wash and fold,Special care fabric cleaning,Self-service laundry,Delivery,Dry cleaning,General bedding cleaning,Laundry pick-up,Wedding gown preservation,Bulk Washing Services,Cleaning Process,Delivery Services,Dry Cleaning Services,Express Laundry,Fabric Conditioner,Individual Packing,Normal Cleaning,Normal Wash,Premium Laundry,Regular Wash,Spot Treatment,Stain Removal,Wash & Fold,Wash & Iron,Wash Your Clothes,premium laundry"
"CLOTH SHOWER LAUNDRY","080884 72267","Shop No 3 1st Cross, Vinayaka Layout Rd, opp. Valley View Pu College, HV Residence, Krishnarajapuram, Bengaluru, Karnataka 560049","4.7","221","Services: Deep clean,Office and workplace cleaning,Moving-related cleaning,Standard cleaning,Ironing,Laundry wash and fold,Special care fabric cleaning,Leather and suede cleaning,Delivery,Dry cleaning,Drapery & window cover cleaning,Laundry pick-up,Wedding gown preservation,Blanket (Single),Inner Wear (Wash & Iron),Premium Laundry Service,Premium Washing,Shirt,W-Top,Wash & Iron,Carpet and rug cleaning,Coat & jacket alterations,Jackets,Online dry cleaner booking,Commercial service"
"The LaundroMart","099490 00244","Sri Vinayaka Theatre, 1st cross Thulasi Theatre Road, Opp Apollo pharmacy lane, Marathalli, Road, Marathahalli, Bengaluru, Karnataka 560037","4.5","184","Services: Delivery,Dry cleaning,Special care fabric cleaning"
"James Bond Dry Cleaners - Since 1970 | Carpet Cleaning | Blanket Cleaning | Curtain Cleaning | Darning | Dyeing","096636 68007","202 E/2, 27th Cross, 3rd Block Jayanagar, Opp. Sapna Book House, Bengaluru, Karnataka 560011","4.7","554","Services: Eco-friendly cleaning,Carpet and rug cleaning,Delivery,Dry cleaning,Drapery & window cover cleaning,Alterations,General bedding cleaning,Bed Sheets,Carpet Cleaning,Cleaning And Ironing,Cleaning And Laundry,Cleaning Business,Cleaning Services,Clothes Dry Cleaning,Collection Service,Curtain Cleaning,Cushion Covers,Darning,Darning Services,Dropping Off,Dry Cleaning Linen,Dyeing,Fabric Care,Formal Wear,Garment Care,Home Linen,Home Pick Up,Jeans Pants,Laundry And Pressing,Laundry Pick-Up,Linen Cleaning,Mens Wear,Normal Cleaning,Pick And Drop,Pick Up And Drop,Regular Cleaning,Saree Dyeing,Saree Polishing,Saree Printing,Shoe Dry Cleaning,Shoe Laundry,Silk Sarees,Silk Shirts,Sofa Cleaning,Specialized Cleaning,Sustainable Service,Tailoring Services,Upholstery Cleaning,Water Cleaning,Wedding Gowns,Drapes and curtain cleaning"
"Snoways Laundry & Dry Cleaners","080 4206 6280","No18, 1, Andree Rd, near Axis Bank, Bheemanna Garden, Shanti Nagar, Bengaluru, Karnataka 560027","3.9","28","N/A"
"Cleanovo - Dry cleaning & laundry, Residency Road","080 4160 4547","Shop No. B8, Devatha Plaza, Residency Road Near Bangalore Club, Bengaluru, Karnataka 560025","3.2","60","Services: Clothes pressing,Carpet and rug cleaning,Coat & jacket alterations,Delivery,Drapery & window cover cleaning,Alterations,Laundry pick-up,Wedding dress cleaning,Alteration,Bag Cleaning,Bed Linen,Bridal Dress,Cleaning & Ironing,Cotton Saree,Delivery Service,Designer Wear,Dry Clean & Laundry Service,Dry Cleaned Clothes,Home Linen,Home Washing,Laundry Pick Up,Laundry Room,Leather Bags,Online Laundry Service,Pick Up Call,Regular Cleaning,Roll Press,Shoes Cleaning,Silk Saree,Sofa Cleaning,Stain Removing,Steam Press,Washing Clothes,Washing Machines,Wet Cleaning,Woollen Garments"
"The Urban Laundry - Dryclean-Rolling and Ironing","063625 91993","17, 388/17, 19th H Main Rd, 1st Block, 1st N Block, Rajajinagar, Bengaluru, Karnataka 560010","4.7","81","Services: Ironing,General clothes drying,Laundry wash and fold,Special care fabric cleaning,Self-service laundry,Delivery,Dry cleaning,Drapery & window cover cleaning,General bedding cleaning,Laundry pick-up,Wedding gown preservation,Blankets & Curtains,Cleaning Agents,Cleaning Cleaning,Cleaning Clothes,Cleaning Garments,Cleaning Process,Cleaning Products,Cleaning Wash & Iron,Clothes Clean,Collect & Deliver,Curtains Cleaning,Custom Packaging,Deep Clean,Dry Cleaners,Dry Cleaning & Laundry,Dry Cleaning Service,Dry Cleaning Services In Bangalore,Dry Cleaning Wash,Express Services,Fabric Care,Home Linens,Home Washing,Household Item Cleaning,Kg Wash,Laundry & Ironing,Laundry And Dry,Laundry Detergent,Laundry Pickup And Delivery,Laundry Service In Bangalore,Laundry Washing Wash,Online Laundry Services,Organic Laundry,Post Inspection,Premium Dry Cleaning,Saree Cleaning,Saree Rolling,Shirt Service,Shoe Laundry,Soft Toys Cleaning,Sorting & Inspection,Specialized Cleaning,Specialized Services,Spot Cleaning,Stain Removal,Stain Removal Services,Stain Treatment,Steam Ironing,Wash & Fold,Wash & Steam Iron,Wash Laundry Services,Wash N Fold,Washing Machines,Washing Our Clothes,Washing Your Clothes,Wedding Dress Cleaning"
"LAUNDROSWITCH","N/A","275, 6th main, 100 Feet Rd, Indiranagar, Bengaluru, Karnataka 560038","4.6","145","Services: Industrial laundry,Eco-friendly cleaning,Organic dry cleaning,Quilt cleaning,Embroidery,Clothes pressing,Ironing,Laundry wash and fold,Carpet and rug cleaning,Special care fabric cleaning,Jackets,Delivery,Online dry cleaner booking,Dry cleaning,Laundry pick-up,Commercial service,Wedding gown preservation,Blouse stitching,Computarised Embroidery Blouse Designs,Dry-Cleaning,Laundry Service,Pick Up And Delivery,Premium Laundry,Saree Tassels,Saree fall & Zigzac,Stain Removal,Steam Ironing,Wash & Fold,Wash & Iron,Premium Laundry,Stain Removal,Wash and iron Kg basis"
"Mummy's Laundry","095913 06330","ground floor, 202, 28th main, 7th Cross Rd, behind icici bank, 1st Sector, HSR Layout, Bengaluru, Karnataka 560102","4.6","292","Services: Quilt cleaning,Dry cleaning,Ironing,Laundry wash and fold"
"Tumbledry Dry Clean & Laundry Service","076772 50250","Shop 137, Lower Ground Floor, 11th Cross Rd, Swimming Pool Extension, Kodandarampura, Malleshwaram, Bengaluru, Karnataka 560003","4.5","70","Services: Ironing,Laundry wash and fold,Carpet and rug cleaning,Self-service laundry,Delivery,Dry cleaning,Bag Cleaning,Blanket & Quilt Dry Cleaning,Canvas Shoes Dry Cleaning,Carpet Cleaning,Carpet Dry Cleaning,Coat & Blazer Dry Cleaning,Color Enhancement After Dry Cleaning,Curtain & Blinds Dry Cleaning,Curtain Dry Cleaning,Damaged Collar Replacement,Darning,Deep Cleaning,Dry Cleaning & Laundry,Garment Care,Handbag Dry Cleaning,Haute Couture Dry Cleaning,Heel Replacement,Inner Lining Replacement,Inner Sole Replacement,Jacket Dry Cleaning,Laces Replacement,Leather & Suede,Leather & Suede Shoes Dry Cleaning,Leather Bag Dry Cleaning,Leather Dry Cleaning,Lehenga & Bridal Wear Dry Cleaning,Packing,Re Coloring,Saree Dry Cleaning,Shoe Cleaning,Shoe Laundry,Shoes/Bag Cleaning & Restoration,Silk Sarees,Soft Toys Dry Cleaning,Sole Pasting,Sorting & Inspection,Sports Shoes Dry Cleaning,Stain Removal,Stain Removing,Stain Treatment,Steam Iron,Steam Ironing,Wash & Steam Iron,Whitening After Dry Cleaning,Women Kurta & Salwar Dry Cleaning,Woolen & Shawl Dry Cleaning,Premium Laundry,Wash & Steam Ironing,Wash & fold service"
"Washho - Laundry | Dry clean & Home cleaning Services","062870 92973","Gate No 3, KP & MG Tower, Opposite Foyer Infinty Pattandur Agrahara Main Road, ITPL Main Rd, Whitefield, Bengaluru, Karnataka 560066","4.1","942","Services: Interior and exterior window cleaning,Deep clean,Office and workplace cleaning,Mattress cleaning,Moving-related cleaning,Standard cleaning,Appliance Cleaning,Balcony Cleaning,Bathroom Fittings,Bathroom Floor,Bathroom Floors,Bed Bugs Control,Body Polish,Brush Cleaning,Cabinets Cleaning,Car Cleaning,Car Cleaning Service,Car Wash,Ceiling Fans,Cleaning Car,Cleaning Interior,Cleaning Service In Chennai,Cleaning Solutions,Complete Cleaning,Corner Cleaning,Dashboard Polish,Dining Room,Exterior Cleaning,Exterior Painting,External Cleaning,Floor Scrubbing,Foam Wash,Fridge Cleaning,Fumigation & Sanitisation,General Cleaning,Home Cleaning Service In Mumbai,Home Furnishings,Home Painting,Industrial Washing,Interior Cleaning,Interior Painting,Kitchen Cleaning,Laundry & Dry Cleaning,Laundry And Dry Cleaning,Laundry And Ironing,Laundry Delivery,Light Fittings,Mattress Cleaning,Party Service,Party Services,Pest Control,Pest Control Treatment,Pest Removal,Pickup & Drop,Premium Dry Cleaning,Recurring Clean,Regular Cleaning,Roof Cleaning,Sanitisation Home,Sanitization Service,Scratches Removal,Sofa Shampooing,Sofa/Carpet Cleaning,Space Cleaning,Stain Removal,Steam Ironing,Termite Control,Urgent Service,Vaccum Cleaner,Vacuum Cleaner,Vacuum Cleaning,Wall Cleaning,Wall Painting,Wash & Fold,Wash & Iron,Washing Machine,Quilt cleaning,Ironing,General clothes drying,Laundry wash and fold,Special care fabric cleaning,Self-service laundry,Dry cleaning,Bathroom Cleaning,Business Laundry,Chemical Wash,Cleaning And Ironing,Cleaning Cleaning,Clothing Cleaning,Custom Cleaning,Customer Support,Dry Cleaners,Dry Cleaning Service In Bangalore,Dry Wash & Iron,Express Service,Full Home Deep Cleaning,Home/Office Cleaning,Home/Office Sanitisation,Ironing Clothes,Laundry & Dry Cleaning Service,Laundry Service In Bangalore,Online Laundry Service,Personalized Service,Premium Fabric Care,Regular Clothes,Regular Laundry Services,Sofa / Carpet Cleaning,Specialized Care,Standard Laundry,Wash My Clothes"
"Anu Laundry Services","090662 40558","Silicon Town, Dhodnamangla, Bengaluru, Karnataka 560099","4.7","81","Services: Quilt cleaning,Delivery,Dry cleaning,Ironing,Laundry pick-up,Laundry wash and fold,Self-service laundry,Special care fabric cleaning"
"Aniket Dry Cleaners","095355 02945","No 323, 1, Ejipura Main Rd, Gowda Muniswamy Garden, Ejipura, Bengaluru, Karnataka 560047","4.2","136","Services: Clothes pressing,Ironing,Laundry wash and fold,Carpet and rug cleaning,Couches/sofas,Coat & jacket alterations,Special care fabric cleaning,Self-service laundry,Leather and suede cleaning,Jackets,Delivery,Online dry cleaner booking,Dry cleaning,Alterations,General bedding cleaning,Laundry pick-up,Wedding gown preservation,Bath Robe,Bath Towel,Bed Cover,Bed Sheet,Blanket Cleaning,Blanket Double,Blanket Single,Car Seat Cover,Cotton Saree,Curtain Large,Curtain Small,Door Mat,Drycleaning Pickup,Hand Towel,Home Linen,Laundry Pickup,Long Frock,Pillow Cover,Quilt Double,Quilt Single,Regular Garments,Saree Polishing,Saree Roll Press,Silk Saree,Sofa Cover,Steam Iron,T Shirt,Toy Medium,Track Pant,Wash And Iron,steem press"
