"name","phoneNumber","address","rating","reviews","services"
"Tumbledry Dry Clean & Laundry Service","076772 50250","972/1, Ground Floor, 13th Cross, 16th Main Rd, Banashankari Stage II, Bengaluru, Karnataka 560070","4.3","62","Services: Ironing,Laundry wash and fold,Delivery,Dry cleaning,Art Dry Cleaning,Bag Cleaning,Blanket & Quilt Dry Cleaning,Canvas Shoes Dry Cleaning,Carpet Cleaning,Carpet Dry Cleaning,Coat & Blazer Dry Cleaning,Color Enhancement After Dry Cleaning,Curtain & Blinds Dry Cleaning,Curtain Dry Cleaning Service,Curtain Ring Replacement,Customized Treatment,Damaged Collar Replacement,Darning,Deep Cleaning,Dry Cleaning & Laundry,Dry Cleaning Facility,Free Pickup,Handbag Dry Cleaning,Haute Couture Dry Cleaning,Heel Replacement,Inner Lining Replacement,Inner Sole Replacement,Jacket Dry Cleaning,Laces Replacement,Leather & Suede,Leather & Suede Shoes Dry Cleaning,Leather Bag Dry Cleaning,Leather Dry Cleaning,Lehenga & Bridal Wear Dry Cleaning,Packing,Re Coloring,Saree Dry Cleaning,Silk Sarees,Soft Toys Dry Cleaning,Sole Pasting,Sorting & Inspection,Sports Shoes Dry Cleaning,Stain Removal,Stain Treatment,Steam Iron,Steam Ironing,Whitening After Dry Cleaning,Women Kurta & Salwar Dry Cleaning,Woolen & Shawl Dry Cleaning,Woolen Garments,Woolens Dry Cleaning,Self-service laundry,Premium Laundry,Wash & Steam Ironing,Wash & fold service"
"Tumbledry Dry Clean & Laundry Service","076772 50250","Shop No 613, SK Complex, 100 Feet Ring Rd, opposite State Bank Of India, Corporation Colony, Kuvempu Nagar, BTM 2nd Stage, BTM Layout, Bengaluru, Karnataka 560068","4.5","190","Services: Ironing,Laundry wash and fold,Self-service laundry,Leather and suede cleaning,Delivery,Dry cleaning,Laundry pick-up,Blanket & Quilt Dry Cleaning,Canvas Shoes Dry Cleaning,Carpet Cleaning,Carpet Dry Cleaning,Coat & Blazer Dry Cleaning,Color Enhancement After Dry Cleaning,Curtain & Blinds Dry Cleaning,Curtain Dry Cleaning,Damaged Collar Replacement,Darning,Deep Cleaning,Dry Cleaning & Laundry,Handbag Dry Cleaning,Haute Couture Dry Cleaning,Heel Replacement,Inner Lining Replacement,Inner Sole Replacement,Jacket Dry Cleaning,Laces Replacement,Leather & Suede,Leather & Suede Shoes Dry Cleaning,Leather Bag Dry Cleaning,Leather Dry Cleaning,Lehenga & Bridal Wear Dry Cleaning,Packing,Re Coloring,Saree Dry Cleaning,Shoes/Bag Cleaning & Restoration,Silk Sarees,Soft Toys Dry Cleaning,Sole Pasting,Sorting & Inspection,Sports Shoes Dry Cleaning,Stain Removal,Stain Treatment,Steam Iron,Steam Ironing,Whitening After Dry Cleaning,Women Kurta & Salwar Dry Cleaning,Woolen & Shawl Dry Cleaning,Premium Laundry,Wash & Steam Ironing,Wash & fold service"
"Fabrico Laundry & Dry Clean Service","0120 682 4455","Shop No 645, 18th Main Road, South, 24th Cross Rd, near BDA Shopping Complex, opposite Devagiri Hospital, Banashankari Stage II, Bengaluru, Karnataka 560070","4.7","12","N/A"
"INSTA LAUNDROMAT","096323 91003","building no 8, Doraisanipalya, 1, Bannerghatta Rd, opp. IIM, Panduranga Nagar, Bengaluru, Karnataka 560076","4.7","35","Services: Quilt cleaning,Ironing,General clothes drying,Laundry wash and fold,Self-service laundry,Leather and suede cleaning,Dry cleaning,Laundry pick-up,Cleaning Clothes,Clothes Dry,Coin Laundry,Dry Cleaning Company,Express Laundry,Free Pickup And Delivery,Home Services,Iron Clothes,Laundry & Dry Cleaning Service,Laundry Clothes,Laundry Service In Bangalore,Online Laundry,Premium Wash,Roll Polishing,Stain Removals,Starch Wash,Super Wash,Wash Clothes,Wet Wash"
"Shudh Dhobi Dry clean and laundry services","080733 73494","# 1, North Rd, Da Costa Square, St Thomas Town, Bangalore-84, Bengaluru, Karnataka 560084","3.0","3","Services: Quilt cleaning,Ironing,Clothing alterations & repairs,Laundry wash and fold,Carpet and rug cleaning,Couches/sofas,Coat & jacket alterations,Special care fabric cleaning,Self-service laundry,Leather and suede cleaning,Jackets,Delivery,Online dry cleaner booking,Dry cleaning,Drapery & window cover cleaning,General bedding cleaning,Laundry pick-up,Commercial service,Wedding gown preservation,Bathroom cleaning/Acid wash,Bed sheets and pillow covers wash/ Dry clean and ironing,Chair Shampooing,Deep cleaning,Flat cleaning,House cleaning,Marbel cleaning,Marble polishing,Mattress shampooing,Quilt Washing,Rasai wash and dry clean,Sofa Shampooing,Steam Ironing,Swimming pool cleaning,Wall Shampooing"
"LYONDRY","063642 48484","#301, Lyon Square, Ground Floor, 14th B cross, 7th Main Rd, 6th sector, HSR Layout, Bengaluru, Karnataka 560102","3.2","51","Services: Ironing,Clothing alterations & repairs,Laundry wash and fold,Leather and suede cleaning,Dry cleaning,Laundry pick-up,Wedding gown preservation,Area Rug Cleaning,Dry Cleaning Services,Laundry,Laundry Services,Linen, Upholstery, & Area Rug Cleaning,Pillow Refurbishing,Rug Cleaning,Shoe Care,Tailoring & Alterations,Wedding Gown Cleaning & Preservation"
"Quick Wash Laundry Care*","063611 82184","bus stop, Basement Dwarka nagar, Bagalur Main Rd, opposite to Maruti medical, Exactly, Bengaluru, Karnataka 560063","4.2","85","Services: Ironing,Laundry wash and fold,Delivery,Dry cleaning,General bedding cleaning,Laundry pick-up,All types of dry cleaning,Carpet Cleaning,Dry Cleaning,Dry cleaning,Laundry & Dry Cleaners,Laundry Care,Pickup & Delivery,Shoe Laundry,Steam Ironing,Wash And Fold,Wash And Iron,Wash Laundry,wash and fold,washing"
"Firdose Laundromat","099163 00007","#4, 9th Cross, 5th Main Rd, Jayamahal Extension, Bengaluru, Karnataka 560046","4.4","5","Services: Ironing,Laundry wash and fold,Carpet and rug cleaning,Couches/sofas,Coat & jacket alterations,Jackets,Delivery,Online dry cleaner booking,Dry cleaning,General bedding cleaning,Laundry pick-up,Commercial service,Wedding gown preservation"
"UClean Laundry |Dry Cleaning |Shoe Cleaning","099997 59911","No. 6,1st Floor, Nanda Ashirwad Complex, 2nd Main Rd, near Skyline City Apts, 2nd Block, Govindaraja Nagar Ward, Canara Bank Colony, Chandra Layout, Bengaluru, Karnataka 560072","4.7","18","Services: Quilt cleaning,Ironing,General clothes drying,Laundry wash and fold,Special care fabric cleaning,Self-service laundry,Leather and suede cleaning,Delivery,Dry cleaning,Drapery & window cover cleaning,General bedding cleaning,Laundry pick-up,Wedding gown preservation,100% Sanitized Clothes,Bag Cleaning,Bulk Washing,Car Cleaning,Carpet Cleaning,Cleaning And Disinfecting,Cleaning Process,Cleaning Up,Clothes Cleaned,Curtain Cleaning,Custom Packaging Fold Or Hang,Doorstep Pick Up And Drop,Drapes Clean,Dry Cleaners,Emergency Service,Express Service,Green Certified Detergents,Home Cleaning Services,Ironing Clothes,Kg Wash,Laundry & Dry Cleaning,Laundry By Kg,Laundry By Kilo,Laundry Process,Laundry Wash And Fold,Laundry Wash And Iron,Live Laundry,Normal Cleaning,On Demand Service Also Available,Personalized Care,Pickup & Drop,Premium Laundry,Quick Service,Safe Service,Shoe Cleaning,Sofa Cleaning,Stain Removal,Stain Treatment,Steam Sterilization,Vacuum Steam Iron,Wash My Clothes,Washing Machine,Washing Process,Water Cleaning"
"The Laundry Basket, AECS Layout, Marathahalli","080 4170 5151","Near, No. 38/ B1, Kunaj Arcade, LN Pura Main Road, ITPL Main Rd, AECS Layout, Bengaluru, Karnataka 560037","4.0","165","N/A"
"Let's wash laundry Hennur","080 4302 3682","No.34/9 A, ground floor, shop no.2 , opp. To Nike Factory outlet Near Hennur flyover, Hennur Main Rd, Bengaluru, Karnataka 560043","4.0","70","Services: Quilt cleaning,Ironing,General clothes drying,Laundry wash and fold,Special care fabric cleaning,Leather and suede cleaning,Delivery,Dry cleaning,Drapery & window cover cleaning,General bedding cleaning,Laundry pick-up,Wedding gown preservation,Bag Wash,Bags Laundry,Double Bedsheet,Dry Cleaners,Dry Cleaning,Express Service,Home Cleaning,Home Linen,Laundry Pickup,Online Laundry Service,Shoes And Bags,Wash & Fold,Wash & Iron,Washing Machine,blanket wash,quilt dry cleaning,wash & iron"
"Laundry warehouse","093805 73217","707, 4th Cross Rd, behind Balamuri Ganesh temple, 4th Phase, Yelahanka New Town, Bengaluru, Karnataka 560064","4.2","76","Services: Ironing,Laundry wash and fold,Self-service laundry,Delivery,Dry cleaning,Drapery & window cover cleaning,Laundry pick-up,Blanket dry clean,Commercial Laundry,Express Services,Hotel Laundry Services,Only Wash,Stain Removal,Wash & Iron,Wash and iron,carpet cleaning"
"Laundrology - Laundry & Dry Clean","097318 55764","45, 2nd Cross Rd, Kamakshipalya, Bengaluru, Karnataka 560079","4.8","23","Services: Ironing,Clothing alterations & repairs,Laundry wash and fold,Leather and suede cleaning,Delivery,Dry cleaning,Baby clothes cleaning,General bedding cleaning,Bag Cleaning,Bag Repairs,Blanket/Quilt Cleaning,Carpet & Rug Cleaning,Classic Wash,Cleaning Wash,Curtain Cleaning,Express Service,Home Linen,Laundry & Dry Cleaning,Leather Cleaning & Conditioning,Pickup And Delivery,Premium Dry Cleaner,Premium Steam Iron,Premium Steam Press,Prime Wash,Regular Washing,Saree Roll Press & Polishing,Shoe Cleaning,Shoe Repairs,Sneaker Cleaning,Stain Removal,Suit Cleaning,Suitcase Repairs,TATTOO BODY ARTS,Toys Cleaning,Wash And Fold,Wash And Iron,Washing Machine,Tattoo design,Tattoo finishing,Tattoo removal,Sleeve tattoos,Memorial tattoos"
"SPIN CYCLES - Dry Clean & Premium Laundry","088800 04880","L-8, L-8, Jeevan Bima Nagar Main Rd, LIC Colony, HAL 3rd Stage, Sector 10 New, New Tippasandra, Bengaluru, Karnataka 560075","4.1","197","N/A"
"Laundrology Laundry, Dry Clean and Cobbler Services","N/A","1st Main Rd, 3rd Stage 4th Block, Stage 4, Basaveshwar Nagar, Bengaluru, Karnataka 560079","4.4","17","Services: Clothes pressing,Ironing,Car wash,Carpet and rug cleaning,Coat & jacket alterations,Leather and suede cleaning,Jackets,Delivery,Online dry cleaner booking,Dry cleaning,Drapery & window cover cleaning,General bedding cleaning,Laundry pick-up,Wedding dress cleaning,Bag Cleaning,Bag Repairs,Bag Spa,Blanket/Quilt Cleaning,Carpet & Rug Cleaning,Classic Wash,Curtain Cleaning,Doorstep Pickup,Dry Cleaning Wash,Home Linen,Laundry & Dry Cleaning,Leather Bags,Leather Cleaning & Conditioning,Leather Coats,Leather Items,Leather Jackets,Leathers & Suede,Linen Cleaning,Pickup & Delivery Service,Premium Steam Iron,Premium Steam Press,Prime Wash,Quilt Dry Cleaning,Regular Washing,Saree Roll Press & Polishing,Sarees Silk,Shoe Cleaning,Shoe Repairs,Sneaker Cleaning,Stain Removal,Stain Treatment,Suit Cleaning,Suitcase Repairs,Toys Cleaning,Trolley Repair,Wash And Fold,Wash And Iron,Wedding Dress Dry Cleaning"
"UClean Laundry | Dry Cleaning| Shoe Cleaning.","099997 59911","16, 1st Main Rd, Nataraja Layout, Santrupthi Nagar, 7th Phase, J. P. Nagar, Bengaluru, Karnataka 560078","4.8","38","Services: Quilt cleaning,Ironing,General clothes drying,Laundry wash and fold,Special care fabric cleaning,Self-service laundry,Leather and suede cleaning,Delivery,Dry cleaning,Drapery & window cover cleaning,General bedding cleaning,Laundry pick-up,Wedding gown preservation,100% Sanitized Clothes,Bag Cleaning,Bulk Washing,Car Cleaning,Carpet Cleaning,Cleaning And Disinfecting,Cleaning Process,Cleaning Up,Clothes Cleaned,Curtain Cleaning,Custom Packaging Fold Or Hang,Doorstep Pick Up And Drop,Drapes Clean,Dry Cleaners,Emergency Service,Express Service,Green Certified Detergents,Home Cleaning Services,Ironing Clothes,Kg Wash,Laundry & Dry Cleaning,Laundry By Kg,Laundry By Kilo,Laundry Process,Laundry Wash And Fold,Laundry Wash And Iron,Live Laundry,Normal Cleaning,On Demand Service Also Available,Personalized Care,Pickup & Drop,Premium Laundry,Quick Service,Safe Service,Shoe Cleaning,Sofa Cleaning,Stain Removal,Stain Treatment,Steam Sterilization,Vacuum Steam Iron,Wash My Clothes,Washing Machine,Washing Process,Water Cleaning"
"My Laundry Room","N/A","J' block, Above Pragya's Beauty Care, #15 8th Main Road, 5th Cross Rd, 3rd Block, Koramangala, Bengaluru, Karnataka 560034","3.8","36","N/A"
"Vashkleen Laundry Services Private Limited, HO","080 2851 2634","20, Old Madras Rd, Guru Swamy Layout, Bangalore Corporation Industrial Estate, Krishnarajapuram, Bengaluru, Karnataka 560016","4.4","22","N/A"
"R J Dry Cleaners","096869 68739","160 Sri Krishna Temple Road, SR Naidu Layout, Bengaluru, Karnataka 560068","4.8","16","N/A"
"R J Dry Cleaners","096869 68739","160 Sri Krishna Temple Road, SR Naidu Layout, Bengaluru, Karnataka 560068","4.8","16","N/A"
"Max Clean Dry Cleaner & Laundry Services - Benson Town","099003 18000","11/1 61, VP Deenadayalu Naidu Rd, opp. to Indian Bank, Nandi Durga Road Extension, Benson Town, Bengaluru, Karnataka 560046","4.0","8","Services: Eco-friendly cleaning,Organic dry cleaning,Quilt cleaning,Clothes pressing,Ironing,Laundry wash and fold,Carpet and rug cleaning,Self-service laundry,Leather and suede cleaning,Jackets,Hat cleaning,Delivery,Online dry cleaner booking,Dry cleaning,General bedding cleaning,Laundry pick-up,Commercial service,Wedding gown preservation,Wedding dress cleaning,Blanket Dry Cleaning,Carpet Dry Clean,Clean Laundry,Curtains Dry Clean,Pick Up,Pickup Delivery,Premium Laundry Services,Sanitized Kg Laundry,Saree Dry Cleaning,Saree Polishing,Shoe Dry Clean,Shoe Laundry,Steam Press,Suit Dry Clean"
"Ministre of Laundry","063640 56479","404, Ground Floor, 17th C Main Rd, KHB Colony, 5th Block, Koramangala, Bengaluru, Karnataka 560095","4.9","15","Services: Ironing,General clothes drying,Laundry wash and fold,Special care fabric cleaning,Self-service laundry,Express Laundry service,Vacuum steam Ironing"
"Wash Buddy Laundromats","095388 74253","Fit U, SGR Dental College Rd, Kasavanahalli Village, Marathahalli, Bengaluru, Karnataka 560037","4.0","65","Services: Laundry wash and fold,Self-service laundry,Dry cleaning,Bags Cleaning,Commercial Laundry,Express Service,Home Cleaning,Normal Wash,Stain Removal,Wash & Iron"
"UClean Laundry | Dry Cleaning| Shoe Cleaning","086600 90600","Address- No 19/8, MG Residency, Hennur Main Rd, HBR Layout 2nd Block, Stage 1, Kacharakanahalli, Bengaluru, Karnataka 560048","4.9","14","Services: Ironing,General clothes drying,Laundry wash and fold,Self-service laundry,Leather and suede cleaning,Dry cleaning,Drapery & window cover cleaning,100% Sanitized Clothes,Bag Cleaning,Bulk Washing,Car Cleaning,Carpet Cleaning,Cleaning And Disinfecting,Cleaning Process,Cleaning Up,Clothes Cleaned,Curtain Cleaning,Custom Packaging Fold Or Hang,Doorstep Pick Up And Drop,Drapes Clean,Dry Cleaners,Emergency Service,Express Service,Green Certified Detergents,Home Cleaning Services,Ironing Clothes,Kg Wash,Laundry & Dry Cleaning,Laundry By Kg,Laundry By Kilo,Laundry Process,Laundry Wash And Fold,Laundry Wash And Iron,Live Laundry,Normal Cleaning,On Demand Service Also Available,Personalized Care,Pickup & Drop,Premium Laundry,Quick Service,Safe Service,Shoe Cleaning,Sofa Cleaning,Stain Removal,Stain Treatment,Steam Sterilization,Vacuum Steam Iron,Wash My Clothes,Washing Machine,Washing Process,Water Cleaning"
"Black & White Laundry","075103 60501","23 Sr Arcade, Manipal County Rd, Singasandra, Bengaluru, Karnataka 560068","3.9","46","Services: Ironing,Clothing alterations & repairs,Laundry wash and fold,Special care fabric cleaning,Leather and suede cleaning,Delivery,Dry cleaning,Drapery & window cover cleaning,General bedding cleaning,Laundry pick-up,Wedding gown preservation"
"WASHOHOLIC LIVE LAUNDRY","088843 50505","Shop Site Layout, 42, 1st Cross Rd, Girinagar, II Phase, Banashankari 3rd Stage, Banashankari, Bengaluru, Karnataka 560085","4.6","12","N/A"
"Vibha LAUNDRY","090196 47546","No. 58, MKR Plaza, Sarakki Main Rd, near IG Circle, SBI Colony, 1st Phase, J. P. Nagar, Bengaluru, Karnataka 560078","4.5","15","Services: Ironing,Laundry wash and fold,Self-service laundry,Delivery,Dry cleaning,Laundry pick-up,Dry Cleaning Laundry,Laundry By Kg,Only Steam Iron,Pickup And Delivery,Premium Laundry,Wash & Fold,Wash And Steam Iron"
"LaundroKart - Banaswadi - Laundry & Dry Cleaning Services","078991 72075","10/34, Dodda Banaswadi Main Road Banaswadi, Layout, Jaibharath Nagar, Sathya Nagar, Maruthi Sevanagar, Bengaluru, Karnataka 560033","3.3","25","Services: Quilt cleaning,Ironing,General clothes drying,Laundry wash and fold,Special care fabric cleaning,Self-service laundry,Delivery,Dry cleaning,Drapery & window cover cleaning,General bedding cleaning,Laundry pick-up,Bed Linen Cleaning,Carpet Cleaning,Carpet Cleaning Services,Carpets And Rugs,Cleaning Services,Curtain Care,Curtain Cleaning,Deep Cleaning,Dry Cleaning,Home Clean,On Demand Services,Online Laundry Service,Personalized Services,Quilt Cleaning,Shoe Laundry,Stain Removal,Steam Pressing,Vacuum Cleaners,Washing And Dry,Washing Clothes"
"SPIN CYCLES - Dry Clean & Premium Laundry","088800 04880","Margosa Road, Between 16th &, 17th Cross Rd, opp. professional courier services, Malleshwaram, Bengaluru, Karnataka 560003","4.2","128","Services: Quilt cleaning,Ironing,Clothing alterations & repairs,Laundry wash and fold,Car wash,Self-service laundry,Delivery,Dry cleaning,General bedding cleaning,Wedding dress cleaning,Bag Cleaning,Bag Repair,Blanket Cleaning,Carpet Dry Cleaning,Carpet Rug Cleaning,Commercial Laundry Services,Cotton Sarees,Curtain Dry Cleaning,Doorstep Pickup And Drop,Dry Cleaning Wash,Express Services,Free Pickup,Home Linen,Laundry And Dry Clean,Leather Cleaning,Luxe Service,Online Laundry Services,Patch Work,Pickup And Delivery,Premium Dry Cleaning,Premium Laundry Service,Premium Steam Iron,Premium Wash,Quilt Dry Cleaning,Regular Wash,Saree Roll Press,Saree Roll Press & Polish,Shirt,Shoe Cleaning,Shoe Cleaning Services,Shoe Laundry,Shoe Repair,Shoe Wash Service,Shoe leather,Silk Sarees,Stain Removal,Steam Press,Suit Cleaning,Suitecase Trolley Repair,Toy Cleaning,Trolley Repair,Wash & Fold Bag,Wash & Iron,Wash And Iron,Waste Removal,Water Treatment,Wedding Dress Dry Cleaning,Wet Cleaning,blanket single,saree"
"Just Wash Laundry","099860 00014","Parijatha Ave, opp. to Sai Baba Temple, Green Glen Layout, Bellandur, Bengaluru, Karnataka 560103","4.1","104","Services: Ironing,Laundry wash and fold,Leather and suede cleaning,Dry cleaning,Laundry pick-up,Bed Spreads /Curtains - Upto 4 kg,Normal clothes Wash | Dry | Fold - Upto 3 kg,Normal clothes Wash | Dry | Fold - Upto 7 Kg,Only dry up to 7 kgs,Pick up and delivery,Quilts / Comforters Per piece,School Bags and Travel Bags,Shoes - Leather,Steam Iron"
"LaundroKart - Malleshwaram - Laundry & Dry Cleaning Services","078991 72075","6th Main Rd, M V Block, Lower Palace Orchards, Guttahalli, Bengaluru, Karnataka 560003","3.4","25","Services: Ironing,Laundry wash and fold,Special care fabric cleaning,Leather and suede cleaning,Dry cleaning,Drapery & window cover cleaning,General bedding cleaning,Laundry pick-up,5-Star Dry Cleaning,Carpet Cleaning,Curtain Care,Darning,Dyeing,Pet Care,Shoe Laundry,Steam ironing,Wash and Iron"
"Faabrocare Laundry & Dry Cleaning","096067 97775","No.18, 17/1, Ambalipura Bellandur Gate, Opp. Springsfield Apartments, Sarjapur - Marathahalli Rd, near HDFC Bank, Bengaluru, Karnataka 560102","4.6","199","Services: Ironing,Laundry wash and fold,Carpet and rug cleaning,Coat & jacket alterations,Special care fabric cleaning,Leather and suede cleaning,Jackets,Delivery,Online dry cleaner booking,Dry cleaning,Laundry pick-up,Wedding gown preservation,Curtain Cleaning,Dry Cleaning Home,Home Linen,Laundry & Dry Cleaning,Leather Treatment,Premium Laundry & Dry,Premium Washing,Regular Washing,Saree Roll Polishing,Saree Silk,Shoe Laundry,Stain Removal,Steam Ironing,Wash Dry Cleaning"
"Laundrology - Laundry, Dry Clean, Shoe & Bag repairs","099161 32132","6th main, opp. more megastore, 3rd Block, Ayyappa Nagar, Ayyappanagarppanagar, Bengaluru, Karnataka 560036","4.3","118","Services: Ironing,Clothing alterations & repairs,Laundry wash and fold,Special care fabric cleaning,Self-service laundry,Leather and suede cleaning,Delivery,Dry cleaning,Laundry pick-up,Bag Cleaning,Bag Repairs,Bag Spa,Blanket/Quilt Cleaning,Carpet & Rug Cleaning,Classic Wash,Curtain Cleaning,Dry Cleaning Wash,Express Service,Home Services,Laundry & Dry Cleaning,Leather Cleaning & Conditioning,Pickup & Delivery Service,Premium Dry Cleaner,Premium Steam Iron,Premium Steam Press,Prime Wash,Saree Roll Press & Polishing,School Bags,Shoe Cleaning,Shoe Repairs,Sneaker Cleaning,Special Care,Star Laundry,Suit Cleaning,Suitcase Repairs,Toys Cleaning,Trolley Repair,Wash And Fold,Wash And Iron,Wedding Dress Dry Cleaning"
"A1 Laundry","084314 75183","#122,1st Floor, Bagalur Main Rd, Baba Nagar, Yelahanka, Bengaluru, Karnataka 560063","4.5","210","Services: Ironing,Laundry wash and fold,Car wash,Carpet and rug cleaning,Coat & jacket alterations,Special care fabric cleaning,Leather and suede cleaning,Jackets,Delivery,Online dry cleaner booking,Dry cleaning,General bedding cleaning,Laundry pick-up,Commercial service,Wedding gown preservation,Comforters & Bedding,Curtains,Dry Cleaning Laundry,Express Ironing,Home Pick Up,Kg Wash,Laundry & Press Services,Leather Cleaning,Online Laundry Service,Pick Up And Delivery,Rug Cleaning,Saree Polishing,Shoe Spa,Sofa Cleaning,Soft Cleaning,Wash & Clean,Wash And Fold,Wash And Iron,Washing Clothes,Wedding Gown & Suits"
"UClean Laundry| Dry Cleaning| Shoe Cleaning","099027 71676","Basement, Muniswamy, Naidu Layout, Police Station, No 31 SSB Complex, Uttarahalli Main Rd, next to Subramanyapura, Bengaluru, Karnataka 560061","4.8","27","Services: Quilt cleaning,Ironing,General clothes drying,Laundry wash and fold,Special care fabric cleaning,Self-service laundry,Leather and suede cleaning,Delivery,Dry cleaning,Drapery & window cover cleaning,General bedding cleaning,Laundry pick-up,Wedding gown preservation,100% Sanitized Clothes,Bag Cleaning,Bulk Washing,Car Cleaning,Carpet Cleaning,Cleaning And Disinfecting,Cleaning Process,Cleaning Up,Clothes Cleaned,Curtain Cleaning,Custom Packaging Fold Or Hang,Doorstep Pick Up And Drop,Drapes Clean,Dry Cleaners,Emergency Service,Express Service,Green Certified Detergents,Home Cleaning Services,Ironing Clothes,Kg Wash,Laundry & Dry Cleaning,Laundry By Kg,Laundry By Kilo,Laundry Process,Laundry Wash And Fold,Laundry Wash And Iron,Live Laundry,Normal Cleaning,On Demand Service Also Available,Personalized Care,Pickup & Drop,Premium Laundry,Quick Service,Safe Service,Shoe Cleaning,Sofa Cleaning,Stain Removal,Stain Treatment,Steam Sterilization,Vacuum Steam Iron,Wash My Clothes,Washing Machine,Washing Process,Water Cleaning"
"Coin Laundromat ( Marathahalli )","088807 67777","Behind Kalamandir, Anand Nagar, Aswath Nagar, Marathahalli, Bengaluru, Karnataka 560037","3.5","111","N/A"
"Crown Dry Cleaners","097310 30425","1st Block, Dasarhalli, Banashankari 1st Stage, Banashankari, Bengaluru, Karnataka 560050","4.1","19","Services: Ironing,Laundry wash and fold,Carpet and rug cleaning,Couches/sofas,Coat & jacket alterations,Special care fabric cleaning,Leather and suede cleaning,Jackets,Online dry cleaner booking,Dry cleaning,Drapery & window cover cleaning,Laundry pick-up,Wedding gown preservation,Darning,Dyeing"
"SPIN CYCLES - Dry Clean & Premium Laundry","088800 04880","Vajarahalli Village, Bangalore City Municipal Corporation Layout, Bengaluru, Vajarahalli, Karnataka 560062","4.5","249","Services: Quilt cleaning,Clothes pressing,Ironing,Laundry wash and fold,Car wash,Carpet and rug cleaning,Coat & jacket alterations,Special care fabric cleaning,Self-service laundry,Leather and suede cleaning,Jackets,Online dry cleaner booking,Dry cleaning,Laundry pick-up,Wedding gown preservation,Wedding dress cleaning,Bag And Shoe,Bag Cleaning,Bag Cleaning & Bag Repair,Bag Repair,Bed Linens,Bed Sheet,Blanket Cleaning,Boots Cleaning,Carpet Dry Cleaning,Carpet Rug Cleaning,Commercial Laundry Services,Cotton Sarees,Curtain Dry Cleaning,Designer Wears,Door Step Services,Doorstep Pickup And Drop,Dry Cleaning Wash,Home Linen,Laundry And Dry Clean,Leather Cleaning,Linen Cleaning,Luxe Service,Online Laundry Services,Pickup And Delivery,Premium Dry Cleaning,Premium Laundry Service,Premium Steam Iron,Quilt Dry Cleaning,Reduce & Reuse,Regular Wash,Saree Roll Press & Polish,Shoe Cleaning,Shoe Cleaning & Shoe Repair,Shoe Laundry,Shoe Repair,Shoe Wash Service,Silk Sarees,Stain Removing,Steam Press,Suit Cleaning,Suitecase Trolley Repair,Toy Cleaning,Trolley Cleaning & Trolley Repair,Wash & Fold Bag,Wash & Iron,Wedding Dress Dry Cleaning,Wedding Outfits,Wet Cleaning"
"Cleanovo - Dry cleaning & laundry, Indiranagar","080 4098 4545","275, 100 Feet Rd, HAL 2nd Stage, Stage 3, Indiranagar, Bengaluru, Karnataka 560038","3.3","149","Services: Industrial laundry,Ironing,Clothing alterations & repairs,Laundry wash and fold,Carpet and rug cleaning,Couches/sofas,Coat & jacket alterations,Special care fabric cleaning,Self-service laundry,Leather and suede cleaning,Jackets,Delivery,Online dry cleaner booking,Dry cleaning,Drapery & window cover cleaning,Alterations,General bedding cleaning,Laundry pick-up,Commercial service,Wedding gown preservation,Alteration,Bag Cleaning,Bed Linen,Cleaning & Ironing,Cotton Saree,Designer Wear,Dry Clean & Laundry Service,Flaunting Your Shoes,Free Pick Up & Delivery,Home Linen,Home Washing,Laundry Pick Up,Laundry Room,Leather Bags,Online Laundry Service,Regular Cleaning,Roll Press,Silk Saree,Stain Removing,Steam Press,Washing Clothes,Washing Machines,Wet Clean,Wet Cleaning"
