"name","phoneNumber","address","rating","reviews","services"
"Tumbledry Dry Clean & Laundry Service","076772 50250","Shop No 02, Amrapali, Station Rd, near Railway Station, Godrej Colony, Pirojshanagar, Vikhroli, Mumbai, Maharashtra 400079","4.7","59","Services: Ironing,Laundry wash and fold,Special care fabric cleaning,Leather and suede cleaning,Delivery,Dry cleaning,Laundry pick-up,Carpet Cleaning,Curtain Dry Cleaning,Damaged Collar Replacement,Deep Cleaning,Dry Cleaning & Laundry,Haute Couture Dry Cleaning,Heel Replacement,Inner Lining Replacement,Inner Sole Replacement,Laces Replacement,Leather & Suede,Leather Dry Cleaning,Packing,Re Coloring,Shoes/Bag Cleaning & Restoration,Silk Sarees,Sole Pasting,Sorting & Inspection,Stain Removal,Stain Treatment,Steam Iron"
"Sadhana Power Laundry","075065 13365","Shop no 3, Shreeji Krupa Building, Rajawadi Rd Number 4, Rajawadi Colony, Ghatkopar East, Mumbai, Maharashtra 400077","4.7","42","Services: Ironing,Clothing alterations & repairs,Special care fabric cleaning,Leather and suede cleaning,Dry cleaning,Drapery & window cover cleaning,General bedding cleaning,Wedding gown preservation,Shoes cleaning,Soft toys cleaning"
"Tumbledry Dry Clean & Laundry Service","076772 50250","Shop No 3, Shreeji Urban Society, Ali Yavar Jung Marg, opposite Bank Of Maharashtra, Gandhi Nagar, Bandra East, Mumbai, Maharashtra 400051","4.6","53","Services: Ironing,Laundry wash and fold,Special care fabric cleaning,Self-service laundry,Delivery,Online dry cleaner booking,Dry cleaning,Laundry pick-up,Art Dry Cleaning,Bag Cleaning,Blanket & Quilt Dry Cleaning,Canvas Shoes Dry Cleaning,Carpet Cleaning,Carpet Dry Cleaning,Coat & Blazer Dry Cleaning,Color Enhancement After Dry Cleaning,Curtain & Blinds Dry Cleaning,Curtain Dry Cleaning Service,Curtain Ring Replacement,Customized Treatment,Damaged Collar Replacement,Darning,Deep Cleaning,Dry Cleaning & Laundry,Dry Cleaning Facility,Free Pickup,Handbag Dry Cleaning,Haute Couture Dry Cleaning,Heel Replacement,Inner Lining Replacement,Inner Sole Replacement,Jacket Dry Cleaning,Laces Replacement,Leather & Suede,Leather & Suede Shoes Dry Cleaning,Leather Bag Dry Cleaning,Leather Dry Cleaning,Lehenga & Bridal Wear Dry Cleaning,Packing,Re Coloring,Saree Dry Cleaning,Silk Sarees,Soft Toys Dry Cleaning,Sole Pasting,Sorting & Inspection,Sports Shoes Dry Cleaning,Stain Removal,Stain Treatment,Steam Iron,Steam Ironing,Whitening After Dry Cleaning,Women Kurta & Salwar Dry Cleaning,Woolen & Shawl Dry Cleaning,Woolen Garments,Woolens Dry Cleaning,Premium Laundry,Wash & Steam Ironing,Wash & fold service"
"Spintub Laundry","082687 78883","Haqqani Estate, CST Road, near National Laundry, near Royal Sweets, Ambedkar Nagar, Kurla West, Kurla, Mumbai, Maharashtra 400070","3.7","26","Services: Ironing,Clothing alterations & repairs,Laundry wash and fold,Special care fabric cleaning,Self-service laundry,Leather and suede cleaning,Delivery,Dry cleaning,Drapery & window cover cleaning,General bedding cleaning,Laundry pick-up,Wedding gown preservation,Cleaning Services,Deep cleaning,Online Laundry Service,Shoe Cleaning,Specialist Cleaning Service,Wash & Iron,Carpet and rug cleaning"
"N/A","N/A","N/A","N/A","N/A","N/A"
"Laundromania - Best Dry Cleaning & Laundry Services in Malabar Hill/Tardeo/Grant Road","093726 85866","Shop no. 21, Guide Building, 16, LD Ruparel Marg, Malabar Hill, Mumbai, Maharashtra 400006","4.9","26","Services: Ironing,Clothing alterations & repairs,Laundry wash and fold,Carpet and rug cleaning,Couches/sofas,Coat & jacket alterations,Special care fabric cleaning,Self-service laundry,Leather and suede cleaning,Delivery,Online dry cleaner booking,Dry cleaning,Drapery & window cover cleaning,Alterations,General bedding cleaning,Laundry pick-up,Wedding gown preservation,Alteration,Bag Cleaning,Bag cleaning,Customized Care,Darning,Express Dry,Fabric Washing,Free Pick Up,Free Pickup & Delivery,Free Pickup & Drop,Garments, Home Linen & Upholstery,Ironing Services,Laundry,Laundry & Dry Cleaning,Leather Cleaning Services,Shoe Cleaning Services,Shoe cleaning,Shoes, Bags And Leather,Stain Removal,Steam Pressing,Steam press,Sustainable Packing"
"UClean Laundry | Dry Cleaning| Shoe Cleaning.","099997 59911","Shop No. 1, Thapar Suburbia, N.G. Acharya Marg, Govandi East, Chembur, Mumbai, Maharashtra 400088","4.6","83","Services: Quilt cleaning,Ironing,General clothes drying,Laundry wash and fold,Special care fabric cleaning,Self-service laundry,Leather and suede cleaning,Delivery,Dry cleaning,Drapery & window cover cleaning,General bedding cleaning,Laundry pick-up,Wedding gown preservation,100% Sanitized Clothes,Bag Cleaning,Before Washing,Bulk Washing,Car Cleaning,Carpet Cleaning,Cleaning And Disinfecting,Cleaning Process,Cleaning Up,Clothes Cleaned,Curtain Cleaning,Custom Packaging Fold Or Hang,Doorstep Pick Up And Drop,Drapes Clean,Dry Cleaners,Emergency Service,Express Service,Green Certified Detergents,Home Cleaning,Ironing Clothes,Kg Wash,Laundry & Dry Cleaning,Laundry By Kg,Laundry By Kilo,Laundry Wash And Fold,Laundry Wash And Iron,Live Laundry,Normal Cleaning,On Demand Service Also Available,Personalized Care,Pickup & Drop,Premium Laundry Laundry,Quick Service,Shoe Cleaning,Sofa Cleaning,Special Cleaning,Stain Removal,Stain Treatment,Steam Sterilization,Vacuum Steam Iron,Wash My Clothes,Wash Your,Washing Machine"
"The French Laundry - 360 - (Chandivali)","N/A","Nahar Shopping plaza, B-2, Nahar Amrit Shakti, MHADA Colony, Chandivali, Andheri East, Mumbai, Maharashtra 400072","4.4","26","Services: Quilt cleaning,Ironing,General clothes drying,Clothing alterations & repairs,Laundry wash and fold,Special care fabric cleaning,Self-service laundry,Leather and suede cleaning,Delivery,Dry cleaning,Drapery & window cover cleaning,General bedding cleaning,Laundry pick-up,Wedding gown preservation,Bridal Wear,Carpet Cleaning,Clean And Wash,Cleaning Out,Cleaning Up,Darning / Alteration,Doorstep Pickup,Dry Clean & Laundry,Dry Cleaners,Express Service,Fabric Care,Finishing,Free Pick Up And Delivery,Garment Dyeing,German Eco Friendly Cleaning Solutions,Home Service,Pickup And Deliver,Premium Laundry,Processing,Residential Wash,Ro Treated Water,Roll Press,Shoe Laundry,Shoes Cleaning,Sofa Cleaning,Sorting & Inspection,Stain Removing,Stain Treatment,Steam Ironing,Steam Press,Upholstery Cleaning,Urgent Services,Vacuum Packing,Wash ,Dry, Fold,Wash Your Clothes,Washing Laundry,Wet Washing"
"Tumbledry Dry Clean & Laundry Service","076772 50250","Shop No 6, Police Chowky, 4, Jijamata Rd, near Pump House, Aghadi Nagar, Andheri East, Mumbai, Maharashtra 400093","4.8","30","Services: Ironing,Laundry wash and fold,Carpet and rug cleaning,Coat & jacket alterations,Self-service laundry,Leather and suede cleaning,Dry cleaning,Art Dry Cleaning,Bag Cleaning,Bag Cleaning & Restoration,Blanket & Quilt Dry Cleaning,Canvas Shoes Dry Cleaning,Carpet Cleaning,Carpet Dry Cleaning,Coat & Blazer Dry Cleaning,Coat Washing,Color Enhancement After Dry Cleaning,Curtain & Blinds Dry Cleaning,Curtain Dry Cleaning,Curtain Dry Cleaning Service,Curtain Ring Replacement,Customized Treatment,Damaged Collar Replacement,Darning,Deep Cleaning,Dry Cleaning & Laundry,Dry Cleaning & Laundry Service,Dry Cleaning Facility,Free Pickup,Handbag Dry Cleaning,Haute Couture Dry Cleaning,Heel Replacement,Inner Lining Replacement,Inner Sole Replacement,Jacket Dry Cleaning,Laces Replacement,Leather & Suede,Leather & Suede Shoes Dry Cleaning,Leather Bag Dry Cleaning,Leather Dry Cleaning,Lehenga & Bridal Wear Dry Cleaning,Packing,Re Coloring,Saree Dry Cleaning,Silk Sarees,Soft Toys Dry Cleaning,Sole Pasting,Sorting & Inspection,Sports Shoes Dry Cleaning,Stain Removal,Stain Treatment,Steam Iron,Steam Ironing,Whitening After Dry Cleaning,Women Kurta & Salwar Dry Cleaning,Woolen & Shawl Dry Cleaning,Woolen Garments,Woolens Dry Cleaning,Premium Laundry,Wash & Steam Ironing,Wash & fold service"
"SPIN N SHINE LAUNDRY","077189 54194","Shop no.001, D, Wing Navbharat co-op society, Western Express Hwy, near Oberoi Woods, Yashodham, Goregaon, Mumbai, Maharashtra 400063","4.8","13","Services: Ironing,Laundry wash and fold,Special care fabric cleaning,Self-service laundry,Leather and suede cleaning,Delivery,Dry cleaning,Drapery & window cover cleaning,Laundry pick-up,Wedding gown preservation,Clean Laundry Service,Corporate Laundry,Dry Cleaning Services,Home Delivery Laundry Services,Laundry And Dry,Laundry Services For Factory,Laundry Services For Hospitals,Laundry Services For Hotel,Pickup And Drop,Steam Ironing,Trusted Laundry Services"
"Tumbledry Dry Clean & Laundry Service","076772 50250","Shop No 2, Ground Floor, ACME COMPLEX, Mulund - Goregaon Link Rd, opposite BMC Garden, Prem Nagar, Goregaon West, Mumbai, Maharashtra 400104","4.8","29","Services: Laundry wash and fold,Carpet and rug cleaning,Leather and suede cleaning,Art Dry Cleaning,Bag Cleaning,Blanket & Quilt Dry Cleaning,Canvas Shoes Dry Cleaning,Carpet Cleaning,Carpet Dry Cleaning,Coat & Blazer Dry Cleaning,Color Enhancement After Dry Cleaning,Curtain & Blinds Dry Cleaning,Curtain Dry Cleaning Service,Curtain Ring Replacement,Customized Treatment,Damaged Collar Replacement,Darning,Deep Cleaning,Dry Cleaning & Laundry,Dry Cleaning Facility,Free Pickup,Handbag Dry Cleaning,Haute Couture Dry Cleaning,Heel Replacement,Inner Lining Replacement,Inner Sole Replacement,Jacket Dry Cleaning,Laces Replacement,Leather & Suede,Leather & Suede Shoes Dry Cleaning,Leather Bag Dry Cleaning,Leather Dry Cleaning,Lehenga & Bridal Wear Dry Cleaning,Packing,Re Coloring,Saree Dry Cleaning,Silk Sarees,Soft Toys Dry Cleaning,Sole Pasting,Sorting & Inspection,Sports Shoes Dry Cleaning,Stain Removal,Stain Treatment,Steam Iron,Steam Ironing,Whitening After Dry Cleaning,Women Kurta & Salwar Dry Cleaning,Woolen & Shawl Dry Cleaning,Woolen Garments,Woolens Dry Cleaning,Self-service laundry,Premium Laundry,Wash & Steam Ironing,Wash & fold service"
"Star Laundry","072084 60166","Shiv Sai, Vaikunthlal Mehta Rd, Flying Club Shanty Town, Airport Area, Juhu, Mumbai, Maharashtra 400056","4.8","283","Services: Ironing,General clothes drying,Clothing alterations & repairs,Laundry wash and fold,Clothes dyeing,Special care fabric cleaning,Self-service laundry,Leather and suede cleaning,Delivery,Dry cleaning,Drapery & window cover cleaning,Party dress cleaning,Baby clothes cleaning,General bedding cleaning,Laundry pick-up,Wedding gown preservation,All types of CLOTHES, Curtains, pillow covers, Sofa cover, Cushions,Saree and Many more"
"New Beauty Art | Best Laundry Service | Laundry Cleaning Near Me | Laundry Shop | Laundry Cleaners In Andheri West","098922 22669","Shop No. 1, Swati Apts, Off Link Rd, near Meera Tower, Andheri (W, Mumbai, Maharashtra 400053","4.8","24","N/A"
"Laundry Cafe","098670 22131","Shop no 3, Deepali chs, Veera Desai Rd, Azad Nagar 2, Mumbai, Maharashtra 400053","4.8","28","Services: Ironing,Laundry wash and fold,Delivery,Dry cleaning,Laundry pick-up,Car Seat Covers Cleaning,Carpet Cleaning,Curtains Dry cleaning,Darning and Dye,Laundry by Killos,Shoes Cleaning Service,Sofa Cleaning,Soft Toys Cleaning,Steam Press"
"KANOJIYA DRY CLEANERS - Laundry Services and Dry Cleaning Services - Mumbai","083569 99252","Shop No 2, Sunni Usmaniya Takiya Masjid, Near, Parel Post Office Ln, next to Bank of Baroda, Parel East, Parel, Mumbai, Maharashtra 400012","4.7","37","Services: Organic dry cleaning,Quilt cleaning,Clothes pressing,Ironing,Laundry wash and fold,Carpet and rug cleaning,Special care fabric cleaning,Leather and suede cleaning,Jackets,Hat cleaning,Delivery,Online dry cleaner booking,Dry cleaning,General bedding cleaning,Laundry pick-up,Wedding gown preservation,Wedding dress cleaning"
"Ooasis Dry Cleaners","099199 19725","Shop No.03, Greenland SOC, B2 Wing, Shriniwas Bagarka Rd, S B Singh Colony, J B Nagar, Andheri (E, Mumbai, Maharashtra 400059","5.0","33","Services: Clothing alterations & repairs,Quilt cleaning,Delivery,Drapery & window cover cleaning,Dry cleaning,General clothes drying,Ironing,Laundry pick-up,Leather and suede cleaning,Special care fabric cleaning,Wedding gown preservation,Quilt Cleaning,Laundry,Bulk Laundry Services,Garment Laundry,Hotel Laundry Services,Steam Ironing,Stain Removal,car,Free Pickup & Drop Services,Shoe Cleaning,Bag Cleaning,Home Pick up,Roll Pressing,Premium Washing,Suit Dry Cleaning,Wash & Iron,Express Service,Clothes Dyeing,Curtain Washing,c"
"N/A","N/A","N/A","N/A","N/A","N/A"
"Laundry Near Me","N/A","12/1 Vijay Prakash Chawl, GD Ambekar Marg, Ambewadi, Kalachowki, Mumbai, Maharashtra 400033","3.6","60","N/A"
"Tumbledry Dry Clean & Laundry Service","076772 50250","Shop No 10, Hill-Crest, Co-Operative Housing Society Ltd, 16th Rd, Bandra West, Mumbai, Maharashtra 400050","4.4","58","Services: Ironing,Carpet and rug cleaning,Leather and suede cleaning,Dry cleaning,Art Dry Cleaning,Bag Cleaning,Blanket & Quilt Dry Cleaning,Canvas Shoes Dry Cleaning,Carpet Cleaning,Carpet Dry Cleaning,Coat & Blazer Dry Cleaning,Color Enhancement After Dry Cleaning,Curtain & Blinds Dry Cleaning,Curtain Dry Cleaning Service,Curtain Ring Replacement,Customized Treatment,Damaged Collar Replacement,Darning,Deep Cleaning,Dry Cleaning & Laundry,Dry Cleaning Facility,Free Pickup,Handbag Dry Cleaning,Haute Couture Dry Cleaning,Heel Replacement,Inner Lining Replacement,Inner Sole Replacement,Jacket Dry Cleaning,Laces Replacement,Leather & Suede,Leather & Suede Shoes Dry Cleaning,Leather Bag Dry Cleaning,Leather Dry Cleaning,Lehenga & Bridal Wear Dry Cleaning,Packing,Re Coloring,Saree Dry Cleaning,Silk Sarees,Soft Toys Dry Cleaning,Sole Pasting,Sorting & Inspection,Sports Shoes Dry Cleaning,Stain Removal,Stain Treatment,Steam Iron,Steam Ironing,Whitening After Dry Cleaning,Women Kurta & Salwar Dry Cleaning,Woolen & Shawl Dry Cleaning,Woolen Garments,Woolens Dry Cleaning,Premium Laundry,Wash & Steam Ironing,Wash & fold service"
"Cleanux - Dry Cleaning & Laundry Services","N/A","Shop No: 4, Aarohi Society Opp Ivy Center, Patel Estate Road, Station ( Harbour Line, near Jogeshwari, Jogeshwari West, Mumbai, Maharashtra 400102","4.6","22","Services: Ironing,Laundry wash and fold,Special care fabric cleaning,Leather and suede cleaning,Delivery,Dry cleaning,Laundry pick-up,Wedding gown preservation"
"Tumbledry Dry Clean & Laundry Service","076772 50250","Shop No 1, AB Nair Rd, near Kalumal Estate, Jukarwadi, Juhu, Mumbai, Maharashtra 400049","4.3","111","Services: Ironing,Laundry wash and fold,Carpet and rug cleaning,Special care fabric cleaning,Self-service laundry,Leather and suede cleaning,Dry cleaning,Laundry pick-up,Art Dry Cleaning,Bag Cleaning,Blanket & Quilt Dry Cleaning,Canvas Shoes Dry Cleaning,Carpet Cleaning,Carpet Dry Cleaning,Coat & Blazer Dry Cleaning,Color Enhancement After Dry Cleaning,Curtain & Blinds Dry Cleaning,Curtain Dry Cleaning Service,Curtain Ring Replacement,Customized Treatment,Damaged Collar Replacement,Darning,Deep Cleaning,Dry Cleaning & Laundry,Dry Cleaning Facility,Free Pickup,Garment Care,Handbag Dry Cleaning,Haute Couture Dry Cleaning,Heel Replacement,Inner Lining Replacement,Inner Sole Replacement,Jacket Dry Cleaning,Laces Replacement,Leather & Suede,Leather & Suede Shoes Dry Cleaning,Leather Bag Dry Cleaning,Leather Dry Cleaning,Lehenga & Bridal Wear Dry Cleaning,Packing,Re Coloring,Saree Dry Cleaning,Shoe Cleaning,Shoe Laundry,Silk Sarees,Soft Toys Dry Cleaning,Sole Pasting,Sorting & Inspection,Sports Shoes Dry Cleaning,Stain Removal,Stain Removing,Stain Treatment,Steam Iron,Steam Ironing,Wash & Steam Iron,Whitening After Dry Cleaning,Women Kurta & Salwar Dry Cleaning,Woolen & Shawl Dry Cleaning,Woolen Garments,Woolens Dry Cleaning,Premium Laundry,Wash & Steam Ironing,Wash & fold service"
"SpinNWash Laundry","099300 91400","SpinNWash Laundry, Janata Colony, Adarsh Nagar, Worli, Mumbai, Maharashtra 400030","5.0","119","Services: Alterations,Clothing alterations & repairs,Carpet and rug cleaning,Clothes pressing,Laundry pick-up,Quilt cleaning,Delivery,Dry cleaning,Eco-friendly cleaning,Industrial laundry,Ironing,Jackets,Leather and suede cleaning,Online dry cleaner booking,Special care fabric cleaning,Laundry wash and fold,Wedding dress cleaning,Wedding gown preservation,Cleaning Solutions,Darning,Dyeing,Eco Friendly Cleaning,Laundry & Dry Cleaning,On Time Delivery,Shoe Cleaning,Stain Removal,Steam Ironing,Steam Press,Wash Laundry,Curtain and carpet cleaning"
"KANOJIYA DRY CLEANERS - Laundry Services and Dry cleaning Services - Mumbai","083569 99252","400015 Plot No.1, Shop No.1, Prabodhankar Thackeray Road, Sakharam Lanjekar Marg, opposite to fatima High school, Shivaji Nagar, Sewri, Mumbai, Maharashtra 400015","5.0","17","N/A"
"CLEAN MART LAUNDRY SERVICES","093218 52018","VASANT SAGAR, Shop no.23, Saraswati, opp. D, Thakur Village, Kandivali East, Mumbai, Maharashtra 400101","4.3","38","Services: Ironing,Clothing alterations & repairs,Laundry wash and fold,Special care fabric cleaning,Self-service laundry,Leather and suede cleaning,Delivery,Dry cleaning,Drapery & window cover cleaning,General bedding cleaning,Laundry pick-up,Wedding gown preservation"
"Modern Laundry","022 2889 2866","WING D, WING D, Chinchowali Rd, Malad, Chincholi Phatak, Malad West, Mumbai, Maharashtra 400064","4.6","38","N/A"
"The French Laundry - 360 (Khar)","081081 02261","Shop No. 95, 3, Dr Ambedkar Rd, opp. Ambedkar Statue, Khar, Ambedkar Nagar, Khar West, Mumbai, Maharashtra 400052","4.8","71","Services: Ironing,General clothes drying,Clothing alterations & repairs,Laundry wash and fold,Clothes dyeing,Special care fabric cleaning,Self-service laundry,Leather and suede cleaning,Dry cleaning,Drapery & window cover cleaning,Party dress cleaning,Baby clothes cleaning,General bedding cleaning,Laundry pick-up,Wedding gown preservation,Bag cleaning,Curtian cleaning,shoe cleaning"
"Laundry Craft","090750 75755","Gokuldham Shopping Centre, Shop no 9, Goregaon - Mulund Link Rd, Yashodham, Goregaon, Mumbai, Maharashtra 400063","4.6","29","Services: Ironing,Laundry wash and fold,Self-service laundry,Leather and suede cleaning,Delivery,Dry cleaning,Laundry pick-up,Wedding gown preservation,Carpet Cleaning,Cleaned Clothes,Cleaning Services,Curtain Cleaning,Customized Washing,Dry Cleaning Service For Cleaning,Eco Friendly Laundry,Ironed Clothes,Kg Wash,Next Day Delivery,Pickup And Delivery,Premium Washing,Sofa Cleaning,Steam Press,Wash And Fold,Wash And Iron,Washing And Dry Cleaning,Wet Cleaning"
"Lucky Dry Cleaners","091361 81238","Shop No.26, Plot No.18, Zenith Housing Society, beside Javed Habib, Bhavani Nagar, Marol, Andheri East, Mumbai, Maharashtra 400059","4.4","49","Services: Clothing alterations & repairs,Coat & jacket alterations,Alterations,General bedding cleaning,Laundry pick-up"
"UClean Laundry| Dry Cleaning| Shoe Cleaning","098331 21300","Shop 10, Mulchand jhaverchand CSH, Near Bhakti Bhavan Kumbharwada, VN Purav Marg, Chembur, Mumbai, Maharashtra 400071","4.7","61","Services: Ironing,General clothes drying,Laundry wash and fold,Self-service laundry,Leather and suede cleaning,Dry cleaning,Drapery & window cover cleaning,100% Sanitized Clothes,Bag Cleaning,Bulk Washing,Car Cleaning,Carpet Cleaning,Cleaning And Disinfecting,Cleaning Process,Cleaning Up,Clothes Cleaned,Curtain Cleaning,Custom Packaging Fold Or Hang,Doorstep Pick Up And Drop,Drapes Clean,Dry Cleaners,Emergency Service,Express Service,Green Certified Detergents,Home Cleaning Services,Ironing Clothes,Kg Wash,Laundry & Dry Cleaning,Laundry By Kg,Laundry By Kilo,Laundry Process,Laundry Wash And Fold,Laundry Wash And Iron,Live Laundry,Normal Cleaning,On Demand Service Also Available,Personalized Care,Pickup & Drop,Premium Laundry,Quick Service,Safe Service,Shoe Cleaning,Sofa Cleaning,Stain Removal,Stain Treatment,Steam Sterilization,Vacuum Steam Iron,Wash My Clothes,Washing Machine,Washing Process,Water Cleaning"
"Soft Clean - Laundry and Dry Cleaning Service Mumbai","088808 27000","Shop 4, D-wing, Vibhavari CHS, Sangeetkar N Dutta Marg, Gharkul Society, Indira Nagar, Four Bungalows, Andheri West, Mumbai, Maharashtra 400053","4.8","12","Services: Ironing,General clothes drying,Clothing alterations & repairs,Laundry wash and fold,Special care fabric cleaning,Self-service laundry,Leather and suede cleaning,Delivery,Dry cleaning,General bedding cleaning,Canvas Shoes cleaning,Care Facilities,Carpet Cleaning,Cleaning Companies,Cleaning Items,Clothes Clean,Commercial Laundry,Commercial Washing Machine,Corporate Laundry,Curtain,Cut and loop carpets,Darning,Deep Cleaning,Double Bedsheet,Duvet Cover,Dyeing,Express Laundry Service,Fabric Softener,Fragrance Finish,Garment Care,Guest Laundry,Hair Salon,Hand Towels,House Cleaning,Janitorial Supplies,Kg Wash,Kids Clothes,Natural fibre carpets,Online Laundry Service,Party Wear,Party/Winter Wear,Personal Laundry,Premium Laundry Service,Premium Laundry Service - 1kg,Premium Wash,Quick Laundry,Regular,Regular Laundry Service - 1kg,Regular Size Clothes,Regular Wash,Shirts Washed,Shoe Repairs,Shoes Cleaning,Silk Sarees,Silk/Velvet/Designer/Embroidery,Single Bedsheet,Sofa Cleaning,Sofa Cover Cleaning in Mumbai,Sports and Casual Shoes cleaning,Stain Removal,Standard Wash,Steam Iron,T-Shirt,To Wash Your Clothes,Upholstery Cleaning,Wash & Iron,Wash Your,Washing Machines"
"Om Prakash Laundry(1983)-BEST LAUNDRY SERVICE IN BHANDUP &KANJUR","N/A","Shop No-5, Sanjay Apartment, Udayshree Rd, near kns bank, Saidham Society, Friends Colony, Bhandup East, Mumbai, Maharashtra 400042","4.9","92","Services: Quilt cleaning,Ironing,Clothing alterations & repairs,Laundry wash and fold,Special care fabric cleaning,Leather and suede cleaning,Delivery,Dry cleaning,General bedding cleaning,Laundry pick-up,Wedding gown preservation,Bedsheets single nd double,Blanket cleaning single nd Double,Blouse Dryclean,Coat / blazers,Darning,Dyeing,Kurta/zebha,Rollpress,Saree Dryclean,Shoe cleaning,Sofa cleaning,Steam press,Top/Paizama/Duppata,Wash in kilos,Wash nd fold,Wash nd fold bedsheet,Wash nd iron"
"UClean Laundry| Dry Cleaning| Shoe Cleaning","099997 59911","Shop 1, Viceroy Court, Kandivali, Dattani Park, Thakur Village, Kandivali ( E, Mumbai, Maharashtra 400101","4.5","61","Services: Quilt cleaning,Ironing,General clothes drying,Laundry wash and fold,Special care fabric cleaning,Self-service laundry,Leather and suede cleaning,Delivery,Dry cleaning,Drapery & window cover cleaning,Laundry pick-up,100% Sanitized Clothes,Bag Cleaning,Before Washing,Bulk Washing,Car Cleaning,Carpet Cleaning,Cleaning And Disinfecting,Cleaning Process,Cleaning Up,Clothes Cleaned,Curtain Cleaning,Custom Packaging Fold Or Hang,Doorstep Pick Up And Drop,Drapes Clean,Dry Cleaners,Emergency Service,Express Service,Green Certified Detergents,Home Cleaning,Ironing Clothes,Kg Wash,Laundry & Dry Cleaning,Laundry By Kg,Laundry By Kilo,Laundry Wash And Fold,Laundry Wash And Iron,Live Laundry,Normal Cleaning,On Demand Service Also Available,Personalized Care,Pickup & Drop,Premium Laundry Laundry,Quick Service,Shoe Cleaning,Sofa Cleaning,Special Cleaning,Stain Removal,Stain Treatment,Steam Sterilization,Vacuum Steam Iron,Wash My Clothes,Wash Your,Washing Machine"
"Tumbledry Dry Clean & Laundry Service","076772 50250","Shop No 14, Ground Floor, Eastern Court, Parleshwar Rd, Navpada, Vile Parle East, Vile Parle, Mumbai, Maharashtra 400057","4.9","41","Services: Ironing,Laundry wash and fold,Leather and suede cleaning,Delivery,Online dry cleaner booking,Dry cleaning,Art Dry Cleaning,Bag Cleaning,Blanket & Quilt Dry Cleaning,Canvas Shoes Dry Cleaning,Carpet Cleaning,Carpet Dry Cleaning,Coat & Blazer Dry Cleaning,Color Enhancement After Dry Cleaning,Curtain & Blinds Dry Cleaning,Curtain Dry Cleaning Service,Curtain Ring Replacement,Customized Treatment,Damaged Collar Replacement,Darning,Deep Cleaning,Dry Cleaning & Laundry,Dry Cleaning Facility,Free Pickup,Handbag Dry Cleaning,Haute Couture Dry Cleaning,Heel Replacement,Inner Lining Replacement,Inner Sole Replacement,Jacket Dry Cleaning,Laces Replacement,Leather & Suede,Leather & Suede Shoes Dry Cleaning,Leather Bag Dry Cleaning,Leather Dry Cleaning,Lehenga & Bridal Wear Dry Cleaning,Packing,Re Coloring,Saree Dry Cleaning,Silk Sarees,Soft Toys Dry Cleaning,Sole Pasting,Sorting & Inspection,Sports Shoes Dry Cleaning,Stain Removal,Stain Treatment,Steam Iron,Steam Ironing,Whitening After Dry Cleaning,Women Kurta & Salwar Dry Cleaning,Woolen & Shawl Dry Cleaning,Woolen Garments,Woolens Dry Cleaning,Premium Laundry,Wash & Steam Ironing,Wash & fold service"
"Cleanovo - Dry cleaning & laundry,Yashodham Shopping Center, Goregoan(E)","099305 56355","Gokuldham Shopping Centre, Dindoshi Depo, 37 & 38, near Oberoi Mall, Yashodham, Goregaon, Mumbai, Maharashtra 400063","4.3","137","Services: Industrial laundry,Eco-friendly cleaning,Quilt cleaning,Ironing,Clothing alterations & repairs,Laundry wash and fold,Carpet and rug cleaning,Couches/sofas,Coat & jacket alterations,Special care fabric cleaning,Self-service laundry,Leather and suede cleaning,Jackets,Delivery,Online dry cleaner booking,Dry cleaning,Drapery & window cover cleaning,Alterations,General bedding cleaning,Laundry pick-up,Wedding gown preservation,App based dry cleaner,Bag Cleaning,Bed Linen,Cotton Saree,Designer Wear,Handbag Cleaning,Home Linen,Home Washing,KG laundry,Laundry,Leather Bags,Leather jacket cleaning,Online Laundry Service,Regular Cleaning,Roll Press,Shoe Cleaning,Shoes cleaning,Silk Saree,Sports shoe cleaning,Stain Removal,Steam Press,Washing Clothes,Washing Machines,Wet Cleaning,kilo laundry"
