"name","phoneNumber","address","rating","reviews","services"
"Tumbledry Dry Clean & Laundry Service","076772 50250","Shop No 2, Ground Floor, ACME COMPLEX, Mulund - Goregaon Link Rd, opposite BMC Garden, Prem Nagar, Goregaon West, Mumbai, Maharashtra 400104","4.8","29","Services: Laundry wash and fold,Carpet and rug cleaning,Leather and suede cleaning,Art Dry Cleaning,Bag Cleaning,Blanket & Quilt Dry Cleaning,Canvas Shoes Dry Cleaning,Carpet Cleaning,Carpet Dry Cleaning,Coat & Blazer Dry Cleaning,Color Enhancement After Dry Cleaning,Curtain & Blinds Dry Cleaning,Curtain Dry Cleaning Service,Curtain Ring Replacement,Customized Treatment,Damaged Collar Replacement,Darning,Deep Cleaning,Dry Cleaning & Laundry,Dry Cleaning Facility,Free Pickup,Handbag Dry Cleaning,Haute Couture Dry Cleaning,Heel Replacement,Inner Lining Replacement,Inner Sole Replacement,Jacket Dry Cleaning,Laces Replacement,Leather & Suede,Leather & Suede Shoes Dry Cleaning,Leather Bag Dry Cleaning,Leather Dry Cleaning,Lehenga & Bridal Wear Dry Cleaning,Packing,Re Coloring,Saree Dry Cleaning,Silk Sarees,Soft Toys Dry Cleaning,Sole Pasting,Sorting & Inspection,Sports Shoes Dry Cleaning,Stain Removal,Stain Treatment,Steam Iron,Steam Ironing,Whitening After Dry Cleaning,Women Kurta & Salwar Dry Cleaning,Woolen & Shawl Dry Cleaning,Woolen Garments,Woolens Dry Cleaning,Self-service laundry,Premium Laundry,Wash & Steam Ironing,Wash & fold service"
"Cleanux - Dry Cleaning & Laundry Services","N/A","Shop No: 4, Aarohi Society Opp Ivy Center, Patel Estate Road, Station ( Harbour Line, near Jogeshwari, Jogeshwari West, Mumbai, Maharashtra 400102","4.6","22","Services: Ironing,Laundry wash and fold,Special care fabric cleaning,Leather and suede cleaning,Delivery,Dry cleaning,Laundry pick-up,Wedding gown preservation"
"Soot Boot Wala Dhobi .com","098337 17975","Lohana Colony, Andheri West, Mumbai, Maharashtra 400058","4.9","73","Services: General repairs,Glasses repair,Glasses fitting,Polishing,Heel repair,Buckle and hardware replacement,Ironing,General clothes drying,Clothing alterations & repairs,Laundry wash and fold,Special care fabric cleaning,Self-service laundry,Leather and suede cleaning,Delivery,Dry cleaning,General bedding cleaning,Laundry pick-up,Bag Repair,Coat Pant,Contracted Services,Data Analysis,Dry Cleaning,Gown Alteration,Home Delivery,Laundry Pick Up,Online Laundry Service,Optics,Shoe Cleaning,Shoe Polishing,Steam Iron Press,Tailoring,Tailoring / Altration,Tailoring, optician , watch services,The Laundry Process,Vacuum Steam Iron,Washing Clothes,Watch Repairing,Car key copying,Car lockouts,New key fob creation,Lock rekeying,Door lock and bolt hardware installation,Building key copying,Building lockouts,Window locks,Security door locks,Safe lock mechanism installation, opening and repairs,Stone setting,Artificial gold polishing/ silver polishing/ size adjustment /,Bag repair / trolly repair / zip repair / wheel replacement etc,Coat pant / bride & groom dress / sherwani / Amrodary / stitching / rafu / alteration/ size adjustment /,House hold Itames / washroom itames / kitchens itames / china itames / innovative itames /"
"Spintub Laundry","082687 78883","Haqqani Estate, CST Road, near National Laundry, near Royal Sweets, Ambedkar Nagar, Kurla West, Kurla, Mumbai, Maharashtra 400070","3.7","26","Services: Ironing,Clothing alterations & repairs,Laundry wash and fold,Special care fabric cleaning,Self-service laundry,Leather and suede cleaning,Delivery,Dry cleaning,Drapery & window cover cleaning,General bedding cleaning,Laundry pick-up,Wedding gown preservation,Cleaning Services,Deep cleaning,Online Laundry Service,Shoe Cleaning,Specialist Cleaning Service,Wash & Iron,Carpet and rug cleaning"
"Tumbledry Dry Clean & Laundry Service","076772 50250","Shop No 10, Neelkanth Sadan, Vegetable Market, Hingwala Ln, Pant Nagar, Ghatkopar East, Mumbai, Maharashtra 400077","4.4","54","Services: Laundry wash and fold,Dry cleaning,Art Dry Cleaning,Bag Cleaning,Blanket & Quilt Dry Cleaning,Canvas Shoes Dry Cleaning,Carpet Cleaning,Carpet Dry Cleaning,Coat & Blazer Dry Cleaning,Color Enhancement After Dry Cleaning,Curtain & Blinds Dry Cleaning,Curtain Dry Cleaning Service,Curtain Ring Replacement,Customized Treatment,Damaged Collar Replacement,Darning,Deep Cleaning,Dry Cleaning & Laundry,Dry Cleaning Facility,Free Pickup,Handbag Dry Cleaning,Haute Couture Dry Cleaning,Heel Replacement,Inner Lining Replacement,Inner Sole Replacement,Jacket Dry Cleaning,Laces Replacement,Leather & Suede,Leather & Suede Shoes Dry Cleaning,Leather Bag Dry Cleaning,Leather Dry Cleaning,Lehenga & Bridal Wear Dry Cleaning,Packing,Re Coloring,Saree Dry Cleaning,Silk Sarees,Soft Toys Dry Cleaning,Sole Pasting,Sorting & Inspection,Sports Shoes Dry Cleaning,Stain Removal,Stain Treatment,Steam Iron,Steam Ironing,Whitening After Dry Cleaning,Women Kurta & Salwar Dry Cleaning,Woolen & Shawl Dry Cleaning,Woolen Garments,Woolens Dry Cleaning,Self-service laundry,Premium Laundry,Wash & Steam Ironing,Wash & fold service"
"CLEAN MART LAUNDRY SERVICES","093218 52018","VASANT SAGAR, Shop no.23, Saraswati, opp. D, Thakur Village, Kandivali East, Mumbai, Maharashtra 400101","4.3","38","Services: Ironing,Clothing alterations & repairs,Laundry wash and fold,Special care fabric cleaning,Self-service laundry,Leather and suede cleaning,Delivery,Dry cleaning,Drapery & window cover cleaning,General bedding cleaning,Laundry pick-up,Wedding gown preservation"
"Lucky Dry Cleaners","091361 81238","Shop No.26, Plot No.18, Zenith Housing Society, beside Javed Habib, Bhavani Nagar, Marol, Andheri East, Mumbai, Maharashtra 400059","4.4","49","Services: Clothing alterations & repairs,Coat & jacket alterations,Alterations,General bedding cleaning,Laundry pick-up"
"Tumbledry Dry Clean & Laundry Service","076772 50250","Shop No 10, Hill-Crest, Co-Operative Housing Society Ltd, 16th Rd, Bandra West, Mumbai, Maharashtra 400050","4.4","58","Services: Ironing,Carpet and rug cleaning,Leather and suede cleaning,Dry cleaning,Art Dry Cleaning,Bag Cleaning,Blanket & Quilt Dry Cleaning,Canvas Shoes Dry Cleaning,Carpet Cleaning,Carpet Dry Cleaning,Coat & Blazer Dry Cleaning,Color Enhancement After Dry Cleaning,Curtain & Blinds Dry Cleaning,Curtain Dry Cleaning Service,Curtain Ring Replacement,Customized Treatment,Damaged Collar Replacement,Darning,Deep Cleaning,Dry Cleaning & Laundry,Dry Cleaning Facility,Free Pickup,Handbag Dry Cleaning,Haute Couture Dry Cleaning,Heel Replacement,Inner Lining Replacement,Inner Sole Replacement,Jacket Dry Cleaning,Laces Replacement,Leather & Suede,Leather & Suede Shoes Dry Cleaning,Leather Bag Dry Cleaning,Leather Dry Cleaning,Lehenga & Bridal Wear Dry Cleaning,Packing,Re Coloring,Saree Dry Cleaning,Silk Sarees,Soft Toys Dry Cleaning,Sole Pasting,Sorting & Inspection,Sports Shoes Dry Cleaning,Stain Removal,Stain Treatment,Steam Iron,Steam Ironing,Whitening After Dry Cleaning,Women Kurta & Salwar Dry Cleaning,Woolen & Shawl Dry Cleaning,Woolen Garments,Woolens Dry Cleaning,Premium Laundry,Wash & Steam Ironing,Wash & fold service"
"Cleanovo - Dry cleaning & laundry,Yashodham Shopping Center, Goregoan(E)","099305 56355","Gokuldham Shopping Centre, Dindoshi Depo, 37 & 38, near Oberoi Mall, Yashodham, Goregaon, Mumbai, Maharashtra 400063","4.3","137","Services: Industrial laundry,Eco-friendly cleaning,Quilt cleaning,Ironing,Clothing alterations & repairs,Laundry wash and fold,Carpet and rug cleaning,Couches/sofas,Coat & jacket alterations,Special care fabric cleaning,Self-service laundry,Leather and suede cleaning,Jackets,Delivery,Online dry cleaner booking,Dry cleaning,Drapery & window cover cleaning,Alterations,General bedding cleaning,Laundry pick-up,Wedding gown preservation,App based dry cleaner,Bag Cleaning,Bed Linen,Cotton Saree,Designer Wear,Handbag Cleaning,Home Linen,Home Washing,KG laundry,Laundry,Leather Bags,Leather jacket cleaning,Online Laundry Service,Regular Cleaning,Roll Press,Shoe Cleaning,Shoes cleaning,Silk Saree,Sports shoe cleaning,Stain Removal,Steam Press,Washing Clothes,Washing Machines,Wet Cleaning,kilo laundry"
"Modern Laundry","022 2889 2866","WING D, WING D, Chinchowali Rd, Malad, Chincholi Phatak, Malad West, Mumbai, Maharashtra 400064","4.6","38","N/A"
"Tumbledry Dry Clean & Laundry Service","076772 50250","Shop No 1, AB Nair Rd, near Kalumal Estate, Jukarwadi, Juhu, Mumbai, Maharashtra 400049","4.3","111","Services: Ironing,Laundry wash and fold,Carpet and rug cleaning,Special care fabric cleaning,Self-service laundry,Leather and suede cleaning,Dry cleaning,Laundry pick-up,Art Dry Cleaning,Bag Cleaning,Blanket & Quilt Dry Cleaning,Canvas Shoes Dry Cleaning,Carpet Cleaning,Carpet Dry Cleaning,Coat & Blazer Dry Cleaning,Color Enhancement After Dry Cleaning,Curtain & Blinds Dry Cleaning,Curtain Dry Cleaning Service,Curtain Ring Replacement,Customized Treatment,Damaged Collar Replacement,Darning,Deep Cleaning,Dry Cleaning & Laundry,Dry Cleaning Facility,Free Pickup,Garment Care,Handbag Dry Cleaning,Haute Couture Dry Cleaning,Heel Replacement,Inner Lining Replacement,Inner Sole Replacement,Jacket Dry Cleaning,Laces Replacement,Leather & Suede,Leather & Suede Shoes Dry Cleaning,Leather Bag Dry Cleaning,Leather Dry Cleaning,Lehenga & Bridal Wear Dry Cleaning,Packing,Re Coloring,Saree Dry Cleaning,Shoe Cleaning,Shoe Laundry,Silk Sarees,Soft Toys Dry Cleaning,Sole Pasting,Sorting & Inspection,Sports Shoes Dry Cleaning,Stain Removal,Stain Removing,Stain Treatment,Steam Iron,Steam Ironing,Wash & Steam Iron,Whitening After Dry Cleaning,Women Kurta & Salwar Dry Cleaning,Woolen & Shawl Dry Cleaning,Woolen Garments,Woolens Dry Cleaning,Premium Laundry,Wash & Steam Ironing,Wash & fold service"
"UClean Laundry| Dry Cleaning| Shoe Cleaning","099997 59911","Shop 1, Viceroy Court, Kandivali, Dattani Park, Thakur Village, Kandivali ( E, Mumbai, Maharashtra 400101","4.5","61","Services: Quilt cleaning,Ironing,General clothes drying,Laundry wash and fold,Special care fabric cleaning,Self-service laundry,Leather and suede cleaning,Delivery,Dry cleaning,Drapery & window cover cleaning,Laundry pick-up,100% Sanitized Clothes,Bag Cleaning,Before Washing,Bulk Washing,Car Cleaning,Carpet Cleaning,Cleaning And Disinfecting,Cleaning Process,Cleaning Up,Clothes Cleaned,Curtain Cleaning,Custom Packaging Fold Or Hang,Doorstep Pick Up And Drop,Drapes Clean,Dry Cleaners,Emergency Service,Express Service,Green Certified Detergents,Home Cleaning,Ironing Clothes,Kg Wash,Laundry & Dry Cleaning,Laundry By Kg,Laundry By Kilo,Laundry Wash And Fold,Laundry Wash And Iron,Live Laundry,Normal Cleaning,On Demand Service Also Available,Personalized Care,Pickup & Drop,Premium Laundry Laundry,Quick Service,Shoe Cleaning,Sofa Cleaning,Special Cleaning,Stain Removal,Stain Treatment,Steam Sterilization,Vacuum Steam Iron,Wash My Clothes,Wash Your,Washing Machine"
"Laundry Near Me","N/A","12/1 Vijay Prakash Chawl, GD Ambekar Marg, Ambewadi, Kalachowki, Mumbai, Maharashtra 400033","3.6","60","N/A"
"Tumbledry Dry Clean & Laundry Service","076772 50250","Shop No 14, Ground Floor, Eastern Court, Parleshwar Rd, Navpada, Vile Parle East, Vile Parle, Mumbai, Maharashtra 400057","4.9","41","Services: Ironing,Laundry wash and fold,Leather and suede cleaning,Delivery,Online dry cleaner booking,Dry cleaning,Art Dry Cleaning,Bag Cleaning,Blanket & Quilt Dry Cleaning,Canvas Shoes Dry Cleaning,Carpet Cleaning,Carpet Dry Cleaning,Coat & Blazer Dry Cleaning,Color Enhancement After Dry Cleaning,Curtain & Blinds Dry Cleaning,Curtain Dry Cleaning Service,Curtain Ring Replacement,Customized Treatment,Damaged Collar Replacement,Darning,Deep Cleaning,Dry Cleaning & Laundry,Dry Cleaning Facility,Free Pickup,Handbag Dry Cleaning,Haute Couture Dry Cleaning,Heel Replacement,Inner Lining Replacement,Inner Sole Replacement,Jacket Dry Cleaning,Laces Replacement,Leather & Suede,Leather & Suede Shoes Dry Cleaning,Leather Bag Dry Cleaning,Leather Dry Cleaning,Lehenga & Bridal Wear Dry Cleaning,Packing,Re Coloring,Saree Dry Cleaning,Silk Sarees,Soft Toys Dry Cleaning,Sole Pasting,Sorting & Inspection,Sports Shoes Dry Cleaning,Stain Removal,Stain Treatment,Steam Iron,Steam Ironing,Whitening After Dry Cleaning,Women Kurta & Salwar Dry Cleaning,Woolen & Shawl Dry Cleaning,Woolen Garments,Woolens Dry Cleaning,Premium Laundry,Wash & Steam Ironing,Wash & fold service"
"Grand Laundry - The Dry Cleaning Expert # Best Dry Cleaning & laundry service in Mumbai","091525 28484","Shop no.9, MOHID HEIGHTS, RTO Rd, near Mhada Signal, Lokhandwala Complex, Andheri West, Mumbai, Maharashtra 400053","5.0","13","Services: Eco-friendly cleaning,Organic dry cleaning,Quilt cleaning,Clothes pressing,Ironing,Clothing alterations & repairs,Laundry wash and fold,Car wash,Carpet and rug cleaning,Couches/sofas,Coat & jacket alterations,Special care fabric cleaning,Leather and suede cleaning,Jackets,Hat cleaning,Delivery,Online dry cleaner booking,Dry cleaning,Drapery & window cover cleaning,Alterations,Laundry pick-up,Commercial service,Wedding gown preservation,Wedding dress cleaning,Blanket / Quilt Cleaning,Bungalow,Terrace,Parking Cleaning Service,Car Spa,Carpet Spa,Cleaning Treatment,Cleaning Wash,Curtain Spa,Curtains Cleaning,Dry Cleaning,Eco Friendly Washing,Floor Cleaning,Floor Polishing,Hand Bag Cleaning,Home Cleaning,Home Spa,Leather Products Cleaning,Mattress Spa,Office Spa,Organic Cleaning,Pest Control,Residential Cleaning Services,Shoe Cleaning,Sofa Spa,Soft Toys Cleaning,Steam Press,Tank Cleaning,Tank Spa,Upholstery Cleaning,Wash And Fold,Window Spa"
"Mini's Corner Laundry Service","096193 31868","A-47 Avillion Greenfields JVLR Opp Salaskar Udyan, Andheri East, Mumbai, Maharashtra 400093","4.8","22","N/A"
"Esquire Cleaners - Laundry & Dry Cleaners | Shoe Laundry | Dry Cleaning | Laundry in Kurla","098209 56056","159/A/4 Michael Chawl, Pipe Line Rd Buddha Colony, Brahmanwadi, beside King Bakery, Kurla West, Mumbai, Maharashtra 400070","4.9","42","Services: Industrial laundry,Eco-friendly cleaning,Organic dry cleaning,Quilt cleaning,Clothes pressing,Ironing,Carpet and rug cleaning,Self-service laundry,Hat cleaning,Delivery,Online dry cleaner booking,Dry cleaning,Alterations,Laundry pick-up,Wedding gown preservation,Wedding dress cleaning,Bag Laundry,Bag Laundry Services,Curtain Dry Cleaning,Curtain Dry Cleaning Services,Designer Wear,Dry Clean Shirts,Dry Cleaning Clothes,Dry Cleaning For Ladies,Dry Cleaning Home,Handbag Cleaning,Handbag Dry Cleaners,Home Delivery,Home Delivery Laundry Services,Jacket Dry Cleaners In,Ladies Clothes,Ladies Clothes Dry Clean,Leather Jacket Cleaning,Leather Jacket Dry,Party Wear,Roll Press,Saree Cleaning,Saree Dry Cleaning,Sherwani Dry Cleaning,Shoe Cleaning,Shoe Laundry,Shoes Cleaning,Sofa Cleaning,Starch Dry Cleaning,Steam Press,Suit Cleaning,Toys Cleaning,Woolen Clothes,Woolens Dry Cleaning"
"Star Laundry","072084 60166","Shiv Sai, Vaikunthlal Mehta Rd, Flying Club Shanty Town, Airport Area, Juhu, Mumbai, Maharashtra 400056","4.8","283","Services: Ironing,General clothes drying,Clothing alterations & repairs,Laundry wash and fold,Clothes dyeing,Special care fabric cleaning,Self-service laundry,Leather and suede cleaning,Delivery,Dry cleaning,Drapery & window cover cleaning,Party dress cleaning,Baby clothes cleaning,General bedding cleaning,Laundry pick-up,Wedding gown preservation,All types of CLOTHES, Curtains, pillow covers, Sofa cover, Cushions,Saree and Many more"
"Beauty Queen Laundry","087671 10763","A/06, Anand Vihar, Plot No. 39/40, Opp. Gurudwara, Shere Punjab, Mahakali Caves Road, Andheri East, Mumbai, Maharashtra 400093","4.6","28","Services: Ironing,Laundry wash and fold,Delivery,Dry cleaning,Laundry pick-up"
"Manmad laundry- Dry Cleaners in Byculla West | Laundry Services in Byculla West","091374 84205","Shop 1, makba building, mahaveer estate, NM Joshi Marg, marj, Byculla West, Chinchpokli, Mumbai, Maharashtra 400027","4.7","35","Services: Eco-friendly cleaning,Quilt cleaning,Ironing,Carpet and rug cleaning,Special care fabric cleaning,Leather and suede cleaning,Delivery,Dry cleaning,Wedding dress cleaning,Bag Laundry Services,Bag cleaning,Clean Laundry,Cleaning And Ironing,Curtain Dry Cleaning Services,Eco Friendly Shoe Laundry Services,Home Delivery Laundry Services,Ironed Clothes,Laundry And Dry,Laundry pick,Pickup & delivery,Residential Laundry Services,Shoes cleaning,Sofa cleaning (provide at home),Soft toys cleaning,Steam Iron,Steam ironing,Wash & Iron,Wash & fold,Wash & fold service,White"
"Soft Clean - Laundry and Dry Cleaning Service Mumbai","088808 27000","Shop 4, D-wing, Vibhavari CHS, Sangeetkar N Dutta Marg, Gharkul Society, Indira Nagar, Four Bungalows, Andheri West, Mumbai, Maharashtra 400053","4.8","12","Services: Ironing,General clothes drying,Clothing alterations & repairs,Laundry wash and fold,Special care fabric cleaning,Self-service laundry,Leather and suede cleaning,Delivery,Dry cleaning,General bedding cleaning,Canvas Shoes cleaning,Care Facilities,Carpet Cleaning,Cleaning Companies,Cleaning Items,Clothes Clean,Commercial Laundry,Commercial Washing Machine,Corporate Laundry,Curtain,Cut and loop carpets,Darning,Deep Cleaning,Double Bedsheet,Duvet Cover,Dyeing,Express Laundry Service,Fabric Softener,Fragrance Finish,Garment Care,Guest Laundry,Hair Salon,Hand Towels,House Cleaning,Janitorial Supplies,Kg Wash,Kids Clothes,Natural fibre carpets,Online Laundry Service,Party Wear,Party/Winter Wear,Personal Laundry,Premium Laundry Service,Premium Laundry Service - 1kg,Premium Wash,Quick Laundry,Regular,Regular Laundry Service - 1kg,Regular Size Clothes,Regular Wash,Shirts Washed,Shoe Repairs,Shoes Cleaning,Silk Sarees,Silk/Velvet/Designer/Embroidery,Single Bedsheet,Sofa Cleaning,Sofa Cover Cleaning in Mumbai,Sports and Casual Shoes cleaning,Stain Removal,Standard Wash,Steam Iron,T-Shirt,To Wash Your Clothes,Upholstery Cleaning,Wash & Iron,Wash Your,Washing Machines"
"Euroclean Dry Cleaning & Laundry Services, Khar Road","N/A","SHop No 5, Pooja apartments, 17th Rd, Khar, Ambedkar Nagar, Khar West, Mumbai, Maharashtra 400052","4.4","32","Services: Eco-friendly cleaning,Organic dry cleaning,Clothes pressing,Ironing,Clothing alterations & repairs,Laundry wash and fold,Carpet and rug cleaning,Coat & jacket alterations,Special care fabric cleaning,Leather and suede cleaning,Jackets,Hat cleaning,Delivery,Online dry cleaner booking,Dry cleaning,Laundry pick-up,Wedding dress cleaning,Carpet Cleaning,Curtain And Upholstery Cleaning,Dry Cleaners Laundry Services,Exceptional Dry Cleaning,Fabric Care,Pick And Delivery,Shoes & Handbag Cleaning,Sofa Cleaning,Steam Ironing"
"UClean Laundry| Dry Cleaning| Shoe Cleaning","098331 21300","Shop 10, Mulchand jhaverchand CSH, Near Bhakti Bhavan Kumbharwada, VN Purav Marg, Chembur, Mumbai, Maharashtra 400071","4.7","61","Services: Ironing,General clothes drying,Laundry wash and fold,Self-service laundry,Leather and suede cleaning,Dry cleaning,Drapery & window cover cleaning,100% Sanitized Clothes,Bag Cleaning,Bulk Washing,Car Cleaning,Carpet Cleaning,Cleaning And Disinfecting,Cleaning Process,Cleaning Up,Clothes Cleaned,Curtain Cleaning,Custom Packaging Fold Or Hang,Doorstep Pick Up And Drop,Drapes Clean,Dry Cleaners,Emergency Service,Express Service,Green Certified Detergents,Home Cleaning Services,Ironing Clothes,Kg Wash,Laundry & Dry Cleaning,Laundry By Kg,Laundry By Kilo,Laundry Process,Laundry Wash And Fold,Laundry Wash And Iron,Live Laundry,Normal Cleaning,On Demand Service Also Available,Personalized Care,Pickup & Drop,Premium Laundry,Quick Service,Safe Service,Shoe Cleaning,Sofa Cleaning,Stain Removal,Stain Treatment,Steam Sterilization,Vacuum Steam Iron,Wash My Clothes,Washing Machine,Washing Process,Water Cleaning"
"Laundry Craft","090750 75755","Gokuldham Shopping Centre, Shop no 9, Goregaon - Mulund Link Rd, Yashodham, Goregaon, Mumbai, Maharashtra 400063","4.6","29","Services: Ironing,Laundry wash and fold,Self-service laundry,Leather and suede cleaning,Delivery,Dry cleaning,Laundry pick-up,Wedding gown preservation,Carpet Cleaning,Cleaned Clothes,Cleaning Services,Curtain Cleaning,Customized Washing,Dry Cleaning Service For Cleaning,Eco Friendly Laundry,Ironed Clothes,Kg Wash,Next Day Delivery,Pickup And Delivery,Premium Washing,Sofa Cleaning,Steam Press,Wash And Fold,Wash And Iron,Washing And Dry Cleaning,Wet Cleaning"
"UClean Laundry| Dry Cleaning| Shoe Cleaning","099997 59911","Shop no.-4 Ground Floor, Shivam Paradise, Lal Bahadur Shastri Marg, behind Dena Bank, Valmik Nagar, Bhandup West, Mumbai, Maharashtra 400078","4.8","44","Services: Quilt cleaning,Ironing,General clothes drying,Laundry wash and fold,Special care fabric cleaning,Self-service laundry,Leather and suede cleaning,Delivery,Dry cleaning,Drapery & window cover cleaning,General bedding cleaning,Laundry pick-up,Wedding gown preservation,100% Sanitized Clothes,Bag Cleaning,Bulk Washing,Car Cleaning,Carpet Cleaning,Cleaning And Disinfecting,Cleaning Process,Cleaning Up,Clothes Cleaned,Curtain Cleaning,Custom Packaging Fold Or Hang,Doorstep Pick Up And Drop,Drapes Clean,Dry Cleaners,Emergency Service,Express Service,Green Certified Detergents,Home Cleaning Services,Ironing Clothes,Kg Wash,Laundry & Dry Cleaning,Laundry By Kg,Laundry By Kilo,Laundry Process,Laundry Wash And Fold,Laundry Wash And Iron,Live Laundry,Normal Cleaning,On Demand Service Also Available,Personalized Care,Pickup & Drop,Premium Laundry,Quick Service,Safe Service,Shoe Cleaning,Sofa Cleaning,Stain Removal,Stain Treatment,Steam Sterilization,Vacuum Steam Iron,Wash My Clothes,Washing Machine,Washing Process,Water Cleaning"
"Dr. Wash Laundry & dry cleaning Services","099877 24711","Room No. 1, Qazi Chawl, Aarey Colony Road, opp. Mehta Stores, Morarji Nagar, Powai, Mumbai, Maharashtra 400087","5.0","11","Services: Quilt cleaning,Ironing,General clothes drying,Clothing alterations & repairs,Laundry wash and fold,Special care fabric cleaning,Self-service laundry,Leather and suede cleaning,Delivery,Dry cleaning,Drapery & window cover cleaning,General bedding cleaning,Laundry pick-up,Wedding gown preservation"
"Smart Laundry Service in Airoli","075061 56111","H.S, Datta Meghe College Of Engineering, Row House No. 14, Shree Ram Krupa C, Road, Sector 2, Airoli, Navi Mumbai, Maharashtra 400708","4.8","152","Services: Quilt cleaning,Ironing,General clothes drying,Clothing alterations & repairs,Laundry wash and fold,Special care fabric cleaning,Self-service laundry,Leather and suede cleaning,Delivery,Dry cleaning,Drapery & window cover cleaning,General bedding cleaning,Laundry pick-up,Wedding gown preservation,Commercial Laundry,Guest Laundry Service,Laundromat,Laundry,Laundry Subscription,Laundry Wash,Linen Cleaning,Linen Laundry Cleaning,Premium Laundry Service,Roll Press,Same-day Laundry Delivery,Shoe Cleaning,Stain Removal,Steam Ironing,Wash Dry Fold,Wash Dry Steam Ironed,Wash and Fold service,Wash and Iron,Wash/Dry/Fold,Wash/Dry/Steam Iron,Whites Bleach Clean"
"GANGA CLEANERS","081086 06259","Building No. 9, Shop No. 17, near R.S. Mani Super Market, Tilak Nagar, Kurla, Mumbai, Maharashtra 400089","4.7","135","Services: Ironing,Laundry wash and fold,Delivery,Dry cleaning,Laundry pick-up,All clothes,Cleaning Services,Corporate Laundry,Laundry Services For Hotel,Maintenance Services,Pickup And Drop,Sofa Cleaning,Trusted Laundry Services"
"The French Laundry - 360 (Khar)","081081 02261","Shop No. 95, 3, Dr Ambedkar Rd, opp. Ambedkar Statue, Khar, Ambedkar Nagar, Khar West, Mumbai, Maharashtra 400052","4.8","71","Services: Ironing,General clothes drying,Clothing alterations & repairs,Laundry wash and fold,Clothes dyeing,Special care fabric cleaning,Self-service laundry,Leather and suede cleaning,Dry cleaning,Drapery & window cover cleaning,Party dress cleaning,Baby clothes cleaning,General bedding cleaning,Laundry pick-up,Wedding gown preservation,Bag cleaning,Curtian cleaning,shoe cleaning"
"Arun Laundry","022 3550 8988","Bhiku Niwas, Lady Jamshedji Rd, VSNL Colony, Matunga West, Mumbai, Maharashtra 400016","4.3","30","Services: Clothes dyeing,Delivery,Dry cleaning,Ironing,Party dress cleaning"
"Jai Bharat Laundry","N/A","Navketan Building, Railway Station, opp. Chembur Railway Station, Chembur West, east, Chembur, Mumbai, Maharashtra 400071","3.1","111","N/A"
"Elite Cleaners- drycleaning specialist","098190 49132","Linking Road near arya samaj, opposite veromoda showroom IN, Santacruz West, Mumbai, Maharashtra 400054","4.2","20","Services: Quilt cleaning,Clothes pressing,Ironing,Clothing alterations & repairs,Laundry wash and fold,Carpet and rug cleaning,Couches/sofas,Coat & jacket alterations,Special care fabric cleaning,Self-service laundry,Leather and suede cleaning,Jackets,Delivery,Dry cleaning,Alterations,Laundry pick-up,Commercial service,Wedding gown preservation,Wedding dress cleaning,Art Dry Cleaning,Bed Sheets,Clothes Clean,Clothes Make,Clothing Alterations,Cloths Cleaning,Dry Cleaning Laundry Services,Embroidery & Beadwork,Free Pickup,Free Pickup And Delivery,Garment Inspection,Garment Repair,Garments Cleaning,Home Furnishing,House Cleaning,Laundary Services,Laundry And Pressing,Laundry Detergent,Laundry Services Laundry,Laundry Work,Leather Cleaning,Leather Items,Minor Repairs,Pick And Drop,Premium Dry Cleaning,Premium Laundry Service,Quick Turnaround Service,Regular Washing,Repairs And Alterations,Steam Pressing,Wash Dry Cleaning,Washer And Dryer,Washing And Ironing,Washing Clothes,Washing Utensils,Wedding Dresses With Clean,Your Wedding Dress"
"Shree Ganesh Power Laundry","098214 30151","near by Fish market, opp. iit main Gate, Gokhale Nagar, Chaitanya Nagar, Tirandaz, Powai, Mumbai, Maharashtra 400076","5.0","25","Services: Ironing,Laundry wash and fold,Special care fabric cleaning,Self-service laundry,Delivery,Dry cleaning,General bedding cleaning,Laundry pick-up,Wedding gown preservation"
