"name","phoneNumber","address","rating","reviews","services"
"Smart Laundry & Dry Clean Service","075061 56111","Someshwar Tower, Diva Gaothan, Sector 8, Airoli, Navi Mumbai, Maharashtra 400708","4.9","29","Services: Quilt cleaning,Ironing,General clothes drying,Clothing alterations & repairs,Laundry wash and fold,Special care fabric cleaning,Self-service laundry,Leather and suede cleaning,Delivery,Dry cleaning,Drapery & window cover cleaning,General bedding cleaning,Laundry pick-up,Wedding gown preservation,Airoli Laundry,Apartment laundry,Bulk and Commercial Laundry,Car Cleaning,Carpet Cleaning,Children Item's,Cleaning Method,Clothes laundry,Coin op laundry machines,Contactless Payment,Cost of laundry service,Deep Cleaning,Drapery Cleaning,Drop off laundry,Dry Cleaners,Drying,Eco Friendly options,Fabric Softeners,Find laundry,Floor Cleaning,Fluff and fold laundry service,Folded Laundry,Folding Laundry Machine,Free Pickup,Home Cleaning,Home Washing,House Cleaning,Household Items,Individual Services,Ironing and Pressing,Launderette,Launderette near me,Laundromat,Laundromat near me,Laundry,Laundry & Dry Cleaning,Laundry Pickup,Laundry Service,Laundry Subscription,Laundry center,Laundry close by,Laundry close to me,Laundry commercials,Laundry machines,Laundry near me,Laundry parts,Laundry room clothes sorter,Laundry service near me,Laundry shop website,Laundry washing machines,Leather Cleaning,Live Laundry,Loyalty Programs,Near me Laundry,Online laundry,Pet Bed and Linen Laundry,Pick-up and Delivery,Pickup and Deliver,Pickup and Delivery,Premium Laundry,Quick Service,Quick Turnaround,Scented Laundry,Self laundry,Shoe Cleaning,Shoe Laundry,Special Garment Care,Spring Cleaning,Steam Ironing,Uniform Cleaning,Upholstery Cleaning,Wash & Fold,Wash & Iron,Wash and Dry Clean,Wash and Fold near me,Washing Service,Washing machines,places to do laundry near me"
"Black And White - Best Dry Cleaning & Laundry Services in Goregoan","N/A","Ground Floor, beside Gaurav Apartments, near Gokuldham Mandir, Gokuldham Colony, Goregaon, Mumbai, Maharashtra 400063","5.0","8","Services: General bedding cleaning,Carpet and rug cleaning,Clothes pressing,Laundry pick-up,Quilt cleaning,Couches/sofas,Delivery,Drapery & window cover cleaning,Dry cleaning,Eco-friendly cleaning,Industrial laundry,Ironing,Jackets,Leather and suede cleaning,Online dry cleaner booking,Organic dry cleaning,Self-service laundry,Special care fabric cleaning,Laundry wash and fold,Wedding dress cleaning,Wedding gown preservation,Shoe Cleaning,Bag Cleaning,Curtain Cleaning,Carpet Cleaning,Stain Removal,Laundry by kilo,Bulk Laundry,Cleaning And Pressing,Cleaning Solutions,Clothes Cleaned,Clothes Preservation,Curtain Cleaning Service,Dry / Wet Cleaning,Eco-Friendly Cleaning,Fabric Softeners,Free Pickup,Green Cleaning,Home Delivery,Kilo Laundry,Organic Cleaning,Pick Up And Deliver,Pickup And Delivery,Premium Laundry Services,Premium Washing,Shoe Cleaning Service,Sofa / Carpet Cleaning,Steam Press,Thorough Cleaning,Washing And Dry Cleaning,Window Coverings"
"Pressto Drycleaning & Laundry Pvt. Ltd","072089 72753","Shop No. 1A/03, Ground floor, Plot of BLASÉ B. CORREA, New Link Rd, near Chincholi Signal, next to Evershine Mall, Malad West, Mumbai, Maharashtra 400064","4.0","24","Services: Clothes pressing,Ironing,Clothing alterations & repairs,Coat & jacket alterations,Special care fabric cleaning,Leather and suede cleaning,Jackets,Dry cleaning,Alterations,Shoe Cleaning,Shoe Cobbler,Shoe Laundry,Shoe Repair,Steam Press,Upholstery cleaning"
"LaunderIT","083698 75876","2- Keer Chawl, Gulmohar Wadi Agar Bazar, Raobahadur SK Bole Rd, Dadar, Mumbai, Maharashtra 400028","4.2","10","Services: Ironing,Delivery,Dry cleaning,General bedding cleaning,Laundry pick-up,Carpet /Car Seat Covers/ Other Upholstery Cleaning,Carpets Shampooed,Curtain Cleaning,Dry Cleaning Of Bike Gears,Premium Laundry Service,Premium Wash,Shoe wash,Sport Shoes, Canvas Shoes And Soft Toys Cleaning,Steam Ironing,Wash Their Clothes"
"laundry room","099305 56355","Shop No.35, Building, No. 68, Evershine Phase 3, Evershine Millennium Paradise, Thakur Village, Kandivali East, Mumbai, Maharashtra 400101","3.5","36","N/A"
"Bharat Spin Laundry | Washers & Dry Cleaners, Laundry in Navi Mumbai","097692 41494","Santha Gyanaswar Marg, Sector 16A, Sanpada, Navi Mumbai, Maharashtra 400705","4.8","73","Services: Carpet and rug cleaning,Clothes pressing,Couches/sofas,Delivery,Drapery & window cover cleaning,Dry cleaning,Eco-friendly cleaning,General bedding cleaning,Hat cleaning,Industrial laundry,Ironing,Jackets,Laundry pick-up,Laundry wash and fold,Leather and suede cleaning,Online dry cleaner booking,Organic dry cleaning,Quilt cleaning,Special care fabric cleaning,Wedding dress cleaning,Wedding gown preservation,Area rug cleaning,Carpet steam cleaning,Drapes and curtain cleaning,General carpet cleaning,Leather cleaning,Mattress cleaning,Pet stain and odour removal"
"German Laundry","082911 00506","Shop No- 9, Ground Floor New Adarsh Nagar CHS Ltd Dheeraj Arcade Building, Pali Naka, Dr, Dr Ambedkar Rd, Bandra West, Mumbai, Maharashtra 400050","4.2","62","Services: Ironing,Clothing alterations & repairs,Laundry wash and fold,Carpet and rug cleaning,Couches/sofas,Coat & jacket alterations,Special care fabric cleaning,Self-service laundry,Leather and suede cleaning,Jackets,Delivery,Online dry cleaner booking,Dry cleaning,Drapery & window cover cleaning,Alterations,General bedding cleaning,Laundry pick-up,Commercial service,Wedding gown preservation,Business Services,Free Pickup & Drop,Home Services,Laundry & Dry Cleaning,Schedule Pick Up,curtain,Carpet cleaning,bag cleaning,bedsheet cleaning,bedsheet wash,carpet,carpet wash,curtain cleaning,curtain clenaing,curtain wash,handbag cleaning,jacket cleaning,linen cleaning,quilt cleaning,quilt washing,shoes cleaning,Area rug cleaning,General carpet cleaning,Upholstery cleaning,Drapes and curtain cleaning,Pet stain and odour removal"
"laxmi Laundry & Press","088989 39581","Rn44, SB Patil Rd, Shardha saburi soceity, New Gulab Nagar, Govind Nagar, Santacruz West, Mumbai, Maharashtra 400054","4.9","9","Services: Delivery,Drapery & window cover cleaning,Dry cleaning,General clothes drying,Ironing,Laundry pick-up,Laundry wash and fold,Shoe wash,Bag wash"
"GERMAN LAUNDRY PVT LTD","099201 55155","Shop no 10 (ground floor building, 125, Post Office, Hampton Court, Wodehouse Rd, near Colaba, Cuffe Parade, Mumbai, Maharashtra 400005","4.6","34","N/A"
"My Wash Laundrette","022 2593 3132","Shop No. C-10, Rameshwar Apts, Murar Rd, opp. Antriksh Tower, Chandraprabha Chs, Mulund, Mulund West, Mumbai, Maharashtra 400080","3.9","33","N/A"
"A To Z Laundry ️","098677 61110","Shop No.7, OM APARTMENT, Lokhandwala Rd, Sundervan Complex, Lokhandwala Complex, Andheri West, Mumbai, Maharashtra 400053","4.5","24","Services: Ironing,Delivery,Dry cleaning,Laundry pick-up,Wedding gown preservation,Steampress"
"Cleand The Laundry Spa Team","098702 75870","Shop no 2, Oberoi esquire, behind Oberoi Mall, Yashodham, Goregaon, Mumbai, Maharashtra 400063","5.0","3","N/A"
"Three Star Dyers & DryCleaners","084519 58323","Shop No, 754, Sangam Co-op Hsg., Soc, 4, 5th Rd, Khar West, Mumbai, Maharashtra 400052","3.9","33","N/A"
"Tumbledry Dry Clean & Laundry Service","076772 50250","Shop No 1, Manali Apartment, Lal Bahadur Shastri Marg, opposite Dena Bank, Bhandup West, Mumbai, Maharashtra 400078","4.4","7","Services: Ironing,Laundry wash and fold,Carpet and rug cleaning,Leather and suede cleaning,Dry cleaning,Laundry pick-up,Art Dry Cleaning,Bag Cleaning,Blanket & Quilt Dry Cleaning,Canvas Shoes Dry Cleaning,Carpet Cleaning,Carpet Dry Cleaning,Coat & Blazer Dry Cleaning,Color Enhancement After Dry Cleaning,Curtain & Blinds Dry Cleaning,Curtain Dry Cleaning Service,Curtain Ring Replacement,Customized Treatment,Damaged Collar Replacement,Darning,Deep Cleaning,Dry Cleaning & Laundry,Dry Cleaning Facility,Free Pickup,Handbag Dry Cleaning,Haute Couture Dry Cleaning,Heel Replacement,Inner Lining Replacement,Inner Sole Replacement,Jacket Dry Cleaning,Laces Replacement,Leather & Suede,Leather & Suede Shoes Dry Cleaning,Leather Bag Dry Cleaning,Leather Dry Cleaning,Lehenga & Bridal Wear Dry Cleaning,Packing,Re Coloring,Saree Dry Cleaning,Silk Sarees,Soft Toys Dry Cleaning,Sole Pasting,Sorting & Inspection,Sports Shoes Dry Cleaning,Stain Removal,Stain Treatment,Steam Iron,Steam Ironing,Whitening After Dry Cleaning,Women Kurta & Salwar Dry Cleaning,Woolen & Shawl Dry Cleaning,Woolen Garments,Woolens Dry Cleaning,Self-service laundry,Premium Laundry,Wash & Steam Ironing,Wash & fold service"
"Bombaywala Art Dyers & Cleaners","092246 37111","Ramakrishna Chemburkar Marg, next to Mono Rail Stn, next to Flyover, Chembur Gaothan, Chembur, Mumbai, Maharashtra 400071","4.2","10","Services: Clothing alterations & repairs,Drapery & window cover cleaning,Dry cleaning,General clothes drying,Laundry wash and fold,Leather and suede cleaning,Quilt cleaning,Self-service laundry,Special care fabric cleaning,Wedding gown preservation"
"GK Washers & Dry Cleaners","022 2445 7425","Shop No.2 Jai Hind Chawl, Gopi Tank Marg, behind city light cinema, Mumbai, Maharashtra 400016","4.7","6","Services: Ironing,Laundry wash and fold,Special care fabric cleaning,Leather and suede cleaning,Delivery,Dry cleaning,Drapery & window cover cleaning,Laundry pick-up,Wedding gown preservation,Car Seat covers, Sofa Covers.,Curtains and Saree Dry Cleaning."
"Persian Homi","022 2369 0853","Shop no.4, Chandralok, 97, nepeam Sea Road, Grant Road west, Mumbai, Maharashtra 400006","3.5","6","N/A"
"Atul Laundry and Dry clean","070452 46847","UG Hostel, Shulochana shetty marg, E) , Mumbai-22, Sion Hospital Colony, Sion, Maharashtra 400022","4.5","2","Services: Ironing,Laundry wash and fold,Self-service laundry,Delivery,Dry cleaning,Laundry pick-up"
"GERMAN LAUNDRY PVT LTD","099201 55155","Shop no 6, Ground Floor, Mamta Building – A, Appasaheb Marathe Marg, Mumbai, Maharashtra 400025","4.0","38","Services: Ironing,Clothing alterations & repairs,Laundry wash and fold,Carpet and rug cleaning,Couches/sofas,Coat & jacket alterations,Special care fabric cleaning,Self-service laundry,Leather and suede cleaning,Jackets,Delivery,Online dry cleaner booking,Dry cleaning,Drapery & window cover cleaning,Alterations,General bedding cleaning,Laundry pick-up,Commercial service,Wedding gown preservation,Laundry Services,Steam Press,Area rug cleaning,General carpet cleaning,Upholstery cleaning,Drapes and curtain cleaning,Pet stain and odour removal"
"Happy Laundries","N/A","Stall Number 1, Crawford Market, Street, opposite comfort mall, Lohar Chawl, Kalbadevi, Mumbai, Maharashtra 400002","N/A","N/A","Services: Self-service laundry,Dry cleaning,Laundry pick-up,Foldable Storage boxes and laundry bags"
"German Laundry","099201 55155","Shop no.12, Mahtru Ashish Building, Opp Russian counsulate, Nepean Sea Rd, Malabar Hill, Mumbai, Maharashtra 400036","4.7","15","Services: Industrial laundry,Eco-friendly cleaning,Organic dry cleaning,Quilt cleaning,Embroidery,Clothes pressing,Ironing,Clothing alterations & repairs,Laundry wash and fold,Car wash,Carpet and rug cleaning,Couches/sofas,Special care fabric cleaning,Self-service laundry,Leather and suede cleaning,Jackets,Hat cleaning,Delivery,Online dry cleaner booking,Dry cleaning,Drapery & window cover cleaning,Alterations,General bedding cleaning,Laundry pick-up,Commercial service,Wedding gown preservation,Wedding dress cleaning,Business Services,Free Pickup & Drop,Laundry & Dry Cleaning,Pick Up,dry cleaner near me,laundry near me"
"Majestic Laundry Service","099673 58725","Shop No 06, Kohinoor 1, Milat Nagar, Andheri West, Mumbai, Maharashtra 400053","3.6","5","Services: Ironing,General clothes drying,Clothing alterations & repairs,Laundry wash and fold,Clothes dyeing,Self-service laundry,Leather and suede cleaning,Delivery,Dry cleaning,Party dress cleaning,Baby clothes cleaning,General bedding cleaning,Laundry pick-up"
"Beauty Clean Mart","093214 90611","Shop No. 2, Parasmani CHSL, opp. Joggers Park Road, Chikoowadi, Borivali, Mumbai, Maharashtra 400092","5.0","2","Services: Alterations,Carpet and rug cleaning,Clothes pressing,Clothing alterations & repairs,Quilt cleaning"
"London Dry Clean Lokhandwala","091520 00120","Shop no 8, Marvel Apartments, 2nd lane, near six ten market, opp. punjab Singh dairy, Shastri Nagar, Andheri West, Mumbai, Maharashtra 400053","3.7","50","Services: Eco-friendly cleaning,Clothes pressing,Ironing,Laundry wash and fold,Couches/sofas,Special care fabric cleaning,Leather and suede cleaning,Delivery,Dry cleaning,Laundry pick-up,Wedding gown preservation,Wedding dress cleaning,Clothes Dry Clean,Custom Treatment,Drop Service,Dry Clean Laundry,Eco-Friendly Laundry,Fabric Care,Free Pickup,Garment Care,Handbag Cleaning,Handbag Laundry,Home Pickup And Delivery,Home Services,Individual Packing,Ironed Clothes,Ironing And Folding,Laundry Detergent,Pillow Covers,Preliminary Inspection,Premium Dry Cleaning,Quick Press Service,Shoe & Handbag Care,Shoe Cleaning,Shoe Dry Cleaning,Silk Sarees,Sofa & Carpet Cleaning,Sofa Cleaning,Stain Removal,Steam Ironing,Steam Press,Upholstery Cleaning,Upholstery Dry Cleaning Services,Washing,Wedding Outfits"
"Blue Laundry","088799 09951","Shop No. 2, Wing A2, Lokmanya Tilak Rd, Old Ashok Nagar, Ashok Nagar, Vazira, Borivali West, Mumbai, Maharashtra 400091","4.3","34","Services: Clothes pressing,Ironing,Clothing alterations & repairs,Laundry wash and fold,Car wash,Carpet and rug cleaning,Couches/sofas,Coat & jacket alterations,Special care fabric cleaning,Self-service laundry,Leather and suede cleaning,Jackets,Delivery,Online dry cleaner booking,Dry cleaning,Drapery & window cover cleaning,Alterations,General bedding cleaning,Laundry pick-up,Commercial service,Wedding gown preservation,Dry Cleaning,Pick up and Drop Service Available,Roll Press,Shoe Laundry"
"The french laundry-Shoe laundry (Mumbai)","N/A","Pali Hill Rd, opp. Ambedkar statue, Rizvi Complex, Khar West, Mumbai, Maharashtra 400052","4.4","7","Services: Industrial laundry,Clothes pressing,Ironing,Clothing alterations & repairs,Laundry wash and fold,Carpet and rug cleaning,Couches/sofas,Coat & jacket alterations,Special care fabric cleaning,Self-service laundry,Leather and suede cleaning,Jackets,Delivery,Online dry cleaner booking,Dry cleaning,Drapery & window cover cleaning,Alterations,General bedding cleaning,Laundry pick-up,Commercial service,Wedding gown preservation,shoe cleaning,Leather jacke t cleaning ,Travel bag cleaning,Sports gear cleaning"
"Cleanovo","086000 12351","Shop, Building No 19, Bhoomi Classic, New Link Rd, opp. Inorbit Mall, Malad, Sunder Nagar, Malad West, Mumbai, Maharashtra 400064","4.3","96","Services: Industrial laundry,Ironing,Clothing alterations & repairs,Carpet and rug cleaning,Couches/sofas,Coat & jacket alterations,Special care fabric cleaning,Self-service laundry,Leather and suede cleaning,Jackets,Delivery,Online dry cleaner booking,Dry cleaning,Drapery & window cover cleaning,Alterations,General bedding cleaning,Laundry pick-up,Commercial service,Wedding dress cleaning,Bed Linen,Bridal Dress,Cleaning & Ironing,Cotton Saree,Designer Wear,Dry Cleaned Clothes,Dry Cleaning & Laundry,Fabric Washed,Free Pick Up And Delivery,Garments Dry Cleaning,Handbag Cleaning,Home Linen,Home Washing,Italian Dry Clean,Jacket Dry Cleaning,Laundry And Ironing,Laundry Pick Up,Laundry Room,Laundry Wet Cleaning,Leather Bags,Leather Cleaned,Long Dress,Online Laundry Service,Pack & Delivery,Pick Up Call,Regular Cleaning,Shoe & Bag Cleaning,Silk Saree,Sofa Cleaning,Spot Cleaning,Stain Removing,Steam & Roll Pressing,Washing Clothes,Washing Machines,Wedding Dresses,Woollen Garments"
"Tumbledry","076772 50250","Shop 12, CHS Ltd, Raj Heights, Mahatma Gandhi Rd, opposite Anand Nagar, Gaothan, Pushp Heritage, Dahanukar Wadi, Kandivali West, Mumbai, Maharashtra 400067","4.1","50","Services: Laundry wash and fold,Delivery,Dry cleaning,Alterations,Art Dry Cleaning,Blanket & Quilt Dry Cleaning,Canvas Shoes Dry Cleaning,Carpet Cleaning,Carpet Dry Cleaning,Coat & Blazer Dry Cleaning,Color Enhancement After Dry Cleaning,Curtain & Blinds Dry Cleaning,Curtain Dry Cleaning Service,Curtain Ring Replacement,Customized Treatment,Damaged Collar Replacement,Darning,Deep Cleaning,Dry Cleaning & Laundry,Dry Cleaning Facility,Free Pickup,Handbag Dry Cleaning,Haute Couture Dry Cleaning,Heel Replacement,Inner Lining Replacement,Inner Sole Replacement,Jacket Dry Cleaning,Laces Replacement,Leather & Suede,Leather & Suede Shoes Dry Cleaning,Leather Bag Dry Cleaning,Leather Dry Cleaning,Leather Dry Cleaning And Repair,Lehenga & Bridal Wear Dry Cleaning,Packing,Re Coloring,Saree Dry Cleaning,Shoes, Bag Cleaning And Repair,Silk Sarees,Soft Toys Dry Cleaning,Sole Pasting,Sorting & Inspection,Sports Shoes Dry Cleaning,Stain Removal,Stain Treatment,Steam Iron,Steam Ironing,Strap Replacement,Whitening After Dry Cleaning,Women Kurta & Salwar Dry Cleaning,Woolen & Shawl Dry Cleaning,Woolen Garments,Woolens Dry Cleaning,Zip Replacement,Premium Laundry,Wash & Steam Ironing,Wash & fold"
"Shree Krishna Laundry","098192 21697","Shop No. 8, Pride of Kalina Co-op. HSG Soc. Ltd., B-wing, Sunder Nagar Rd, near Creative Industrial estate, Kolivery Village, Kunchi Kurve Nagar, Kalina, Santacruz East, Mumbai, Maharashtra 400098","4.9","21","Services: Quilt cleaning,Ironing,Clothing alterations & repairs,Carpet and rug cleaning,Dry cleaning,Drapery & window cover cleaning,General bedding cleaning,Wedding dress cleaning,Self-service laundry,Car Seat Cover Cleaning,Carpet Cleaning,Coats & Jackets Cleaning,Drapes & Curtains Cleaning,Sofa cover & Pillow cover cleaning,Soft Toys / Plush Toys Cleaning,Steam Ironing,Wash & Iron Service,Washing,Wedding garment cleaning & steam ironing"
"Shiv Laundry And Dry Cleaners","099201 72108","Shop No-75, Walbhat Rd, Bajrang Nagar, Cama Industrial Estate, Goregaon, Mumbai, Maharashtra 400063","3.2","5","Services: Quilt cleaning,Ironing,General clothes drying,Laundry wash and fold,Special care fabric cleaning,Self-service laundry,Delivery,Dry cleaning,Drapery & window cover cleaning,General bedding cleaning,Laundry pick-up,Wedding gown preservation,Roll press"
"UClean Laundry| Dry Cleaning| Shoe Cleaning","097699 62424","Shop No.1, Tirupati CHS, Seawoods West, Sector 44, Seawoods, Navi Mumbai, Maharashtra 400706","4.8","84","Services: Quilt cleaning,Ironing,General clothes drying,Laundry wash and fold,Special care fabric cleaning,Self-service laundry,Leather and suede cleaning,Delivery,Dry cleaning,Drapery & window cover cleaning,General bedding cleaning,Laundry pick-up,Wedding gown preservation,100% Sanitized Clothes,Bag Cleaning,Bags dry cleaning,Blazers cleaning,Bulk Washing,Car Cleaning,Carpet Cleaning,Cleaning And Disinfecting,Cleaning Process,Cleaning Up,Clothes Cleaned,Coat dry cleaning,Curtain Cleaning,Custom Packaging Fold Or Hang,Doorstep Pick Up And Drop,Drapes Clean,Dry Cleaners,Emergency Service,Express Service,Green Certified Detergents,Home Cleaning Services,Ironing Clothes,Kg Wash,Laundry & Dry Cleaning,Laundry By Kg,Laundry By Kilo,Laundry Process,Laundry Wash And Fold,Laundry Wash And Iron,Live Laundry,Normal Cleaning,On Demand Service Also Available,Personalized Care,Pickup & Drop,Premium Laundry,Quick Service,Safe Service,Saree dry cleaning,Sherwani dry cleaning,Shoe Cleaning,Shoe dry cleaning,Shoes cleaning,Sofa Cleaning,Stain Removal,Stain Treatment,Steam Sterilization,Trolly bags cleaning,Vacuum Steam Iron,Wash My Clothes,Washing Machine,Washing Process,Water Cleaning"
"Famous Laundry","N/A","Juhu Ln, Junaid Nagar, Juhu Lane, Yadav Nagar, Andheri West, Mumbai, Maharashtra 400058","5.0","2","N/A"
"Laundry","N/A","room no 10, Perry cross road kantwadi lucky villa b building, Mumbai, Maharashtra 400050","5.0","1","Services: Ironing,Laundry wash and fold,Self-service laundry,Delivery,Dry cleaning,Laundry pick-up"
"New Milan Laundry","098207 65823","Marol Pipeline Rd, near Pragati School, Mukund Nagar, Kadam Wadi, Marol, Andheri East, Mumbai, Maharashtra 400059","4.4","18","Services: Ironing,Dry cleaning"
"Super Spin Dry Cleaners & Washers","093241 78527","Damji Shamji Chowk, Vallabh Baug Ln, Sindhu Wadi, Ghatkopar East, Mumbai, Maharashtra 400077","4.3","16","Services: Eco-friendly cleaning,Quilt cleaning,Clothes pressing,Ironing,Clothing alterations & repairs,Laundry wash and fold,Carpet and rug cleaning,Couches/sofas,Special care fabric cleaning,Self-service laundry,Leather and suede cleaning,Delivery,Online dry cleaner booking,Dry cleaning,Drapery & window cover cleaning,Wedding dress cleaning,Cleaners & Washers,Designer Wear,Dry Cleaners & Washers,Dry Cleaning,Ironing,Laundry Services,Mending Services,Shoes,Specialised Treatment,Upholstery,Washing,Washing Ironing"
"GERMAN LAUNDRY PVT LTD","099201 55155","Shop no.5, ground floor, khimaji Nagji Building, Senapati Bapat Marg, Delisle Rd, Lower Parel, Mumbai, Maharashtra 400013","3.8","15","Services: Dry cleaning,General bedding cleaning,Laundry pick-up,Free Pickup,Home Linen,Home Services"
"Sai Samarth Laundry","077180 99756","Bldg No.04A, Devratna Nagar, Shop No.06, Swadeshi Mills Rd, near Mahada Police station, Chunabhatti, Mumbai, Maharashtra 400022","5.0","2","Services: Delivery,Drapery & window cover cleaning,Dry cleaning,Ironing,Laundry pick-up,Laundry wash and fold"
"EuroClean Dry Cleaning & Laundry Services, Goregaon East","099300 77710","Shop no 5, Sai Mahal, Yashodham, Goregaon, Mumbai, Maharashtra 400063","5.0","5","Services: Eco-friendly cleaning,Organic dry cleaning,Clothes pressing,Ironing,Carpet and rug cleaning,Special care fabric cleaning,Online dry cleaner booking,Dry cleaning,Wedding gown preservation,Wedding dress cleaning,Clean Garments,Curtain & Upholstery,Dry Cleaners Laundry Services,Exceptional Dry Cleaning,Fabric Care,Shoes & Handbag Cleaning,Sofa Cleaning,Steam Ironing,Tailored Suits,Upholstery Cleaning,Wedding Gowns"
"Deepak Laundry & Dry Cleaners","N/A","No:-4, 34/2, Jawahar Nagar Rd, Jawahar Nagar, Goregaon West, Mumbai, Maharashtra 400062","4.4","5","N/A"
"WiClean - Dry Cleaning & Laundry Services","091522 03509","Aashiya bldg, N S Rd Number 2, opp. UCO Bank, Navyug Society, JVPD Scheme, Vile Parle, W, Mumbai, Maharashtra 400056","3.0","2","Services: Quilt cleaning,Ironing,General clothes drying,Clothing alterations & repairs,Laundry wash and fold,Special care fabric cleaning,Self-service laundry,Leather and suede cleaning,Delivery,Dry cleaning,Drapery & window cover cleaning,General bedding cleaning,Laundry pick-up,Wedding gown preservation,All Type Of Laundry Services"
"Cleanovo - Dry Cleaning & Laundry,Worli Naka,Worli","099305 56355","Shop no.7A, Lodha Park Retail, Senapati Bapat Marg, next to standard chartered bank, Lower Parel West, Lower Parel, Mumbai, Maharashtra 400013","3.7","72","Services: Clothes pressing,Ironing,Clothing alterations & repairs,Laundry wash and fold,Carpet and rug cleaning,Couches/sofas,Coat & jacket alterations,Special care fabric cleaning,Self-service laundry,Leather and suede cleaning,Jackets,Delivery,Online dry cleaner booking,Dry cleaning,Drapery & window cover cleaning,Alterations,General bedding cleaning,Laundry pick-up,Commercial service,Wedding gown preservation,Wedding dress cleaning,Alterations Alterations & repairs Carpet & rug cleaning Clothing pick-up service Coats & jackets Couches/sofas Delivery,Bed Linen,Bridal Dress,Cleaning & Ironing,Cotton Saree,Designer Wear,Dry Clean & Laundry Service,Dry Cleaned Clothes,Home Linen,Laundry Pick Up,Laundry Room,Long Dress,Online Laundry Service,Pick Up & Delivery,Regular Home Washing,Roll Press,Roll Pressing,Shoes Cleaning,Silk Saree,Sofa Cleaning,Stain Removal,Steam Press,Washing Machines,Wet Cleaning,Woollen Garments,Work Wear"
"The New Sunlight Laundry","N/A","382, Swastik House, Dr. Bhadkamkar Marg, Shamrao Vittal Ln, Grant Road East, Bharat Nagar, Grant Rd, Mumbai, Maharashtra 400007","5.0","2","N/A"
"Sangeeta Laundry","022 2553 0805","Chembur Colony, RCF Colony, Chembur, Mumbai, Maharashtra 400074","4.4","8","N/A"
"Mycleaners.in Sanpada","091523 62059","shop no 6, Seawoods Garden, Plot No. 4, Palm Beach Rd, Palm Beach, Sanpada, Navi Mumbai, Maharashtra 400705","4.9","169","Services: Quilt cleaning,Ironing,Laundry wash and fold,Special care fabric cleaning,Leather and suede cleaning,Delivery,Dry cleaning,Laundry pick-up,Wedding gown preservation"
"New Maharashtra Power Laundry","098929 26514","Shop No 5 Jakeria Road, Malad West, Mumbai, Maharashtra 400064","5.0","1","N/A"
"Cleanovo The Laundry Room - Runwal","099305 56355","Parking P3 - 47 RUNWAL ELEGANTE lokhandwala Andheri P Tandon Marg Behind Infiniti Mall, Phase D, Lokhandwala Complex, Andheri West, Mumbai, Maharashtra 400058","5.0","1","Services: Clothes pressing,Ironing,Clothing alterations & repairs,Laundry wash and fold,Carpet and rug cleaning,Couches/sofas,Coat & jacket alterations,Special care fabric cleaning,Self-service laundry,Leather and suede cleaning,Jackets,Delivery,Online dry cleaner booking,Dry cleaning,Drapery & window cover cleaning,Alterations,General bedding cleaning,Laundry pick-up,Wedding gown preservation,390 any 10 garment,Alterations Alterations & repairs Carpet & rug cleaning Clothing pick-up service Coats & jackets Couches/sofas Delivery,Bag Cleaning,Bed Linen,Cotton Saree,Designer Wear,Handbag Cleaning,Home Linen,Home Washing,Laundry Room,Leather Bags,Online Laundry Service,Regular Cleaning,Roll Press,Shoe Cleaning,Silk Saree,Stain Removal,Steam Press,Washing Clothes,Washing Machines,Wet Cleaning"
"American Express Cleaners","N/A","87, Hill Rd, Ranwar, Bandra West, Mumbai, Maharashtra 400050","3.7","16","N/A"
