"name","phoneNumber","address","rating","reviews","services"
"Feel & Shine Laundry - Professional Laundry Service in Mulund","087881 31386","W, Shop no.18, Natraj building, Shiv Srishti Complex, Link Road, near Atmosphere Tower, Mulund West, Mumbai, Maharashtra 400080","4.9","308","Services: Quilt cleaning,Ironing,General clothes drying,Laundry wash and fold,Delivery,Dry cleaning,Laundry pick-up,Clean Laundry,Clean Laundry Service,Cleaning & Pressing,Cleaning And Ironing,Cleaning Services,Curtains Cleaning,Curtains cleaning,Dry Cleaning Services,Home Delivery,Laundry And Dry,Laundry Service For Washing,Pickup & Drop,Revive Your Beloved Bags: Professional Bag Cleaning in Mulund,Saree Drycleaning,Shoe Drycleaning,Shoe Laundry,Shoe laundry,Wash & Fold"
"Laundriz - Dry Cleaning & Laundry Service in Andheri, Mumbai","076780 01199","Laundry #7, S.N, Old Nagardas Rd, near Haveli temple, opp. Shiv Krupa Building, Andheri, Maharashtra 400069","4.6","54","Services: Quilt cleaning,Ironing,General clothes drying,Clothing alterations & repairs,Laundry wash and fold,Special care fabric cleaning,Self-service laundry,Leather and suede cleaning,Delivery,Dry cleaning,Drapery & window cover cleaning,General bedding cleaning,Laundry pick-up,Wedding gown preservation,Antiseptic Wash,Bed Sheet Wash,Bulk Laundry Services,Clean Clothes,Clean Items,Clean Your Clothes,Clean Your Laundry,Cleaned And Ironed,Cleaning Method,Cleaning Processes,Cleaning Services,Clothes Dryer,Clothes Washing,Coat Dry Cleaning,Commercial Laundry Services,Delivery Service,Dry Cleaners,Dry Cleaning & Laundry,Express Service,Fabric Conditioner,Fabric Softeners,Garment Laundry,Hand Washing,Home Laundry Service,Hotel Laundry Services,House Cleaning,House Laundry,House Washing,Ironed Clothes,Ironed Laundry,Ironing Per Piece,Kg Laundry,Kg Wash,Laundry Delivery,Laundry Machinery,Laundry Processes,Laundry near me,Packing Laundry,Pick Up & Drop,Premium Washing,Regular Laundry,Regular Laundry Service,Stain Removal,Standard Clothes,Standard Laundry,Steam Ironing,Suit Dry Cleaning,Wash & Fold,Wash & Iron,Wash & Steam Ironing,Washing & Ironing,Washing And Dry Cleaning,Washing Machine,Woolen Laundry"
"Spin N Press - Dry Cleaning and Laundry Services","098336 54903","Bandra Trilok Cooperative Housing Society, Shop No.3 Shahina, Pali Mala Rd, Bandra West, Mumbai, Maharashtra 400050","4.7","200","Services: Ironing,Laundry wash and fold,Carpet and rug cleaning,Coat & jacket alterations,Special care fabric cleaning,Self-service laundry,Leather and suede cleaning,Jackets,Delivery,Online dry cleaner booking,Dry cleaning,Drapery & window cover cleaning,Alterations,General bedding cleaning,Laundry pick-up,Wedding gown preservation,Bag Cleaning,Cleaning And Pressing,Cleaning Ironing,Cleaning Solutions,Clothes Dry Cleaned,Deep Cleaning,Drop Services,Dropping Off,Dry Cleaning & Laundry,Express Drycleaning,Express Ironing,Free Pickup,Free Pickup & Drop,Garment Care,Home Delivery,Kids Dress,Laundry Job,Leather Shoes,Long Dress,On Time Delivery,Party Dress,Personalised Service,Pickup And Delivery,Premier Dry Cleaning,Premium Dry Cleaning,Request Pickup,Roll Pressing,Saree Plain,Shoe Cleaning,Shoe Cleaning & Protection,Shoe Laundry,Shoes Dry Cleaning,Shoes Leather,Stain Removal,Sustainable Laundry,Wash & Fold,laundry,Ground delivery,Direct delivery"
"Abyad laundry","091378 35937","D3/61 society, svp nagar, Four Bungalows, Andheri West, Mumbai, Maharashtra 400053","5.0","423","Services: General clothes drying,Laundry wash and fold,Special care fabric cleaning,Self-service laundry,Dry cleaning,Drapery & window cover cleaning,Wedding gown preservation,Clean Your Clothes,Cloths Cleaner,Collected & Delivered,Costume Cleaner,Double Bedsheet,Dry Cleaning & Laundry,Free Delivery,Dry Cleaning Cleaning,Dyeing,Express laundry service,Laundry wash & iron,Online Laundry Services,Pickup Laundry Service,Regular laundry,Soft Wash,Steam press,Wash And Fold,Wash And Steam Iron,Washing And Steam Press"
"Fabricare","099204 51356","Shop No 2, Lumbini Palace, Tejpal Rd, Vishnu Prasad Society, Navpada, Vile Parle East, Vile Parle, Mumbai, Maharashtra 400057","4.6","118","Services: Ironing,General clothes drying,Clothing alterations & repairs,Laundry wash and fold,Clothes dyeing,Special care fabric cleaning,Self-service laundry,Leather and suede cleaning,Delivery,Dry cleaning,Drapery & window cover cleaning,Party dress cleaning,Baby clothes cleaning,Laundry pick-up,Bed Linens,Bed Sheet,Blanket Single,Bulk Laundry,Carpet And Sofa Cleaning,Carpet Cleaning,Carpet Cleaning Services,Cleaning Ironing,Clothes Dry,Clothes Ironing,Clothes Laundry,Clothes Washing,Collect & Deliver,Commercial Laundry Services,Curtain Cleaning,Curtain Laundry,Curtain Laundry Service,Curtain Washing,Curtain Washing Service,Daily Laundry,Darning,Deep Cleaning,Drop Services,Dry Cleaners Services,Drycleaning,Events contract for laundry service,Express Laundry,Express Service,Fabric Cleaning,Fabric Dyeing,Free Pick Up And Delivery,Free Pickup,Garment Dyeing,Home Laundry,Home Laundry Services,Home Services,Hospital Laundry,House Laundry,Laundry & Dry Cleaning,Laundry And Dry Cleaners,Laundry Services For Hotels,Laundry Services In Powai,Laundry service for events,Laundry service in vile parle,Online Laundry,Pick Up & Delivery,Pick- up & drop,Pickup And Delivery,Pillow Cover,Premium Service,Repairs Services,Roll Press,Rollpress,Shoe Cleaning,Shoe Dry Cleaning,Shoe Laundry,Sofa Cleaning,Special Care,Starching,Steam Clean,Steam Ironing,Steam Press,Steam Pressing,Thoroughly Cleaned,Total Cleaning,Upholstery Cleaning,Wash,Wash And Dry,Washing And Dry Cleaning,Washing Laundry,Wet Wash,Wet Washing Laundry,Wet_wash,Woollen Clothes"
"Spin N Press - Dry Cleaning and Laundry Services","079779 82569","Shop No. 25, Ground Floor, Mamta Co-op Housing Society Ltd, Appasaheb Marathe Marg, Prabhadevi, Mumbai, Maharashtra 400025","4.8","124","Services: Clothes pressing,Ironing,Laundry wash and fold,Carpet and rug cleaning,Couches/sofas,Coat & jacket alterations,Leather and suede cleaning,Jackets,Delivery,Dry cleaning,Alterations,General bedding cleaning,Laundry pick-up,Wedding gown preservation,Carpets Dry Cleaned,Cleaning And Pressing,Cleaning Ironing,Cleaning Solutions,Clothes Dry Cleaned,Deep Cleaning,Drop Services,Dropping Off,Dry Cleaning & Laundry,Express Drycleaning,Express Ironing,Free Pick Up & Drop,Free Pickup,Free Pickup And Delivery,Free Pickup And Drop,Garment Care,Home Delivery,Home Pick Up,Ironing Service,Kids Dress,Laundry Job,Leather Shoes,Long Dress,On Time Delivery,Party Dress,Personalised Service,Pick Up And Delivery,Pickup And Delivery,Premier Dry Cleaning,Premium Dry Cleaning,Request Pickup,Roll Pressing,Saree Plain,Shoe & Bag Cleaning,Shoe Cleaning & Protection,Shoe Laundry,Shoes Dry Cleaning,Shoes Leather,Stain Removal,Sustainable Laundry,Wash & Fold,Bag Cleaning,Shoe Cleaning"
"ASHA LAUNDRY & DRY CLEANERS","082684 36767","5th Floor, Shop No. 516, SRA Building, Road, Mahatma Phule Nagar, Nariman Point, Mumbai, Maharashtra 400021","4.8","133","Services: Quilt cleaning,Ironing,General clothes drying,Clothing alterations & repairs,Laundry wash and fold,Special care fabric cleaning,Self-service laundry,Leather and suede cleaning,Delivery,Dry cleaning,Drapery & window cover cleaning,General bedding cleaning,Laundry pick-up,Wedding gown preservation,Bag Cleaning,Carpet Cleaning,Cleaning Clothes,Cleaning Iron,Cleaning Process,Customer Support,Express Service,Finest Garment Care,Free Pick Up & Drop,Household Linens,Ironing Laundry,Ironing Washing,Laundry & Dry Cleaner,Laundry & Dry Cleaners Service,Laundry & Dry Cleaners Services,Pick Up & Drop,Pickup & Delivery,Pickup & Drop,Pickup And Delivery,Premium Dry Cleaning Services,Premium Laundry,Quick Service,Sofa Cleaning,Special Treatment,Stain Removal,Steam,Steam Ironing,Wash & Folding,Washing Dry Cleaning,Washing Pickup,Wedding Gown"
"AJ LAUNDRY SERVICES","097691 01092","25, Earth Pride, B wing, Sikka Nagar, Girgaon, Charni Road (E), Mumbai, Maharashtra 400004","4.8","44","Services: Ironing,Special care fabric cleaning,Self-service laundry,Leather and suede cleaning,Dry cleaning,Color Gaurd,Color Guard,Crispy Finishing,Dry Cleaning & Ironing,Iorning,Laundry & Dry Cleaning,Moth & Dust Mites Repellent,Online Laundry Service,Personalized Services,Premium Dry Cleaning,Rollpress,Shoes Cleaning,Special Care,Starching,Steam Iron,Steam Press Service,Washing And Dry Cleaning"
"Laundromania - Best Dry Cleaning & Laundry Services in Bandra/Khar","093726 85866","Shop no. 3, Rafi Mansion, 28th Rd, Bandra West, Mumbai, Maharashtra 400050","4.3","109","Services: Ironing,Laundry wash and fold,Carpet and rug cleaning,Special care fabric cleaning,Delivery,Alterations,Laundry pick-up,Alteration,Bag Cleaning,Cleaning Agents,Darning,Dry Cleaning Services,Express Dry,Fabric Washing,Free Pick Up,Free Pickup & Delivery,Free Pickup & Drop,Free pickup,Garments, Home Linen & Upholstery,Home Linen,Home pickup and delivery,Ironing Services,Laundry & Dry Cleaning,Laundry Services,Leather Cleaning Services,Pick Up And Drop,Shoe Cleaning Services,Shoes, Bags And Leather,Stain Removal,Steam Pressing,Sustainable Packing"
"Muqaddar laundry","090825 93545","Shop No-25, BAZMUSSALAM, MASJID LANE Near SEVEN HILLS HOSPITAL MILITARY ROAD JUNCTION, Marol, Andheri, Mumbai, Maharashtra 400059","5.0","248","Services: Special care fabric cleaning,Dry cleaning,Drapery & window cover cleaning,Laundry pick-up,Wedding gown preservation,Cleaner Company,Cloths Cleaner,Cloths Cleaning,Home Services,Laundry Care,Regular Laundry,Soft Wash,Steam Press,Washing & Steam Press"
"CLEAN WEEN LAUNDRY","092246 13717","Shop no.2, La View Tower, Bapurao Jagtap Marg, Kasturba Quarters, Jacob Circle, Mumbai, Maharashtra 400011","4.9","165","Services: Ironing,Clothing alterations & repairs,Carpet and rug cleaning,Couches/sofas,Coat & jacket alterations,Special care fabric cleaning,Leather and suede cleaning,Jackets,Delivery,Online dry cleaner booking,Dry cleaning,General bedding cleaning,Laundry pick-up,Commercial service,Wedding gown preservation,Wedding dress cleaning,Petrol washing,Party dress cleaning,Baby clothes cleaning,Shoe and leather bag cleaning is done"
"Spin N Press - Dry Cleaning and Laundry Services","075060 91467","New Mahavir Building, 37A, No.6, Ridge Rd, Teen Batti, Malabar Hill, Mumbai, Maharashtra 400006","4.9","175","Services: Clothes pressing,Ironing,Laundry wash and fold,Carpet and rug cleaning,Couches/sofas,Coat & jacket alterations,Special care fabric cleaning,Self-service laundry,Leather and suede cleaning,Jackets,Delivery,Online dry cleaner booking,Dry cleaning,Drapery & window cover cleaning,General bedding cleaning,Laundry pick-up,Wedding gown preservation,Carpets Dry Cleaned,Cleaning And Pressing,Cleaning Ironing,Cleaning Solutions,Clothes Dry Cleaned,Drop Services,Dropping Off,Dry Cleaning & Laundry,Express Drycleaning,Free Pick Up & Drop,Free Pickup,Free Pickup And Delivery,Free Pickup And Drop,Garment Care,Home Pick Up,Ironing Service,Party Dress,Pick Up And Delivery,Pickup And Deliver,Pickup And Delivery,Premier Dry Cleaning,Premium Dry Cleaning,Request Pickup,Roll Pressing,Saree Plain,Shoe & Bag Cleaning,Shoe Laundry,Shoes Dry Cleaning,Shoes Leather,Stain Removal,Sustainable Laundry,Wash And Fold Service"
"Dk laundry service & Dry Cleaners","077384 17417","Sagar kutir sangh, JP Rd, Aram Nagar, Seven Bunglow, Andheri West, Mumbai, Maharashtra 400061","4.9","166","Services: Quilt cleaning,Ironing,General clothes drying,Laundry wash and fold,Special care fabric cleaning,Leather and suede cleaning,Delivery,Dry cleaning,Drapery & window cover cleaning,Laundry pick-up,Wedding gown preservation"
"Sai Siddhi power laundry","098701 50632","Khairani Rd, Ladur Gomes Compound, Pereira Wadi, Saki Naka, Mumbai, Maharashtra 400072","4.8","93","Services: Ironing,Laundry wash and fold,Delivery,Dry cleaning,General bedding cleaning,Laundry pick-up,Wedding gown preservation"
"The Dry Clean Company","077770 12344","Shop No : 167/4, SAWANT CHAWL, VN Purav Marg, MHADA Colony, Chunabhatti, Sion, Mumbai, Maharashtra 400022","4.9","169","Services: Industrial laundry,Eco-friendly cleaning,Organic dry cleaning,Quilt cleaning,Clothes pressing,Ironing,Clothing alterations & repairs,Laundry wash and fold,Carpet and rug cleaning,Couches/sofas,Special care fabric cleaning,Leather and suede cleaning,Jackets,Hat cleaning,Delivery,Online dry cleaner booking,Dry cleaning,Drapery & window cover cleaning,General bedding cleaning,Laundry pick-up,Wedding gown preservation,Wedding dress cleaning,Alterations & Repairs,Bag And Shoes Cleaning,Bank Transfer,Bed Cover Single,Bed Sheet Double,Bed Sheet Single,Bedding Dry Cleaning,Blanket Double,Blanket Service,Blanket Single,Carpet Cleaning,Clothing Care,Collection & Delivery,Commercial Laundry Service,Curtains Service,Darning Services,Deep Cleaning,Dry Cleaning & Laundry,Free Delivery,Dry Cleaning Cleaning,Express Delivery,Free Home Pickup,Free Pick Up And Delivery,Free Pickup & Delivery,Home Linen,Home Pickup,Iron And Fold,Ironing Dress,Jump Suit,Laundry Services Laundry,On Time Delivery,Party Wear,Pick Up And Delivery,Pickup And Deliver,Premium Dry Cleaning,Quilt Double,Quilt Single,Shirts Service,Shoe Repairs,Silk Saree,Sofa Cover,Stain Removal,Steam Iron,Trusted Laundry Service,Wash And Fold Laundry Service"
"Laundromania - Best Dry Cleaning & Laundry Services in Andheri/Oshiwara/Lokhandwala","093726 85866","Shop No. 2, Building No. 13, Andheri MHADA, Utsav CHS Ltd, New Link Rd, Andheri West, Mumbai, Maharashtra 400053","4.3","28","Services: Ironing,Clothing alterations & repairs,Laundry wash and fold,Special care fabric cleaning,Leather and suede cleaning,Dry cleaning,Laundry pick-up,Alteration,Bag Cleaning,Cleaning Agents,Cleaning Process,Darning,Fabric Washing,Free Pickup & Delivery,Free Pickup & Drop,Garments, Home Linen & Upholstery,Instant Service,Ironing Services,Laundry & Dry Cleaning,Leather Cleaning,Our Cleaning Service,Pick Up,Quick Wash,Shoe Cleaning Services,Shoes, Bags And Leather,Stain Removal,Steam Pressing,We Clean The Clothes,We Clean The Garments"
"Laundromania: Best Dry Cleaning & Laundry Services in Mahim/Dadar/Matunga","093726 85866","Shop no. 20, Udyog mandir gate, 1, Bhagoji Keer Marg, Mahim West, Mumbai, Maharashtra 400016","4.8","56","Services: Ironing,Clothing alterations & repairs,Laundry wash and fold,Carpet and rug cleaning,Couches/sofas,Coat & jacket alterations,Special care fabric cleaning,Leather and suede cleaning,Delivery,Dry cleaning,Alterations,General bedding cleaning,Laundry pick-up,Wedding gown preservation,Alteration,Bag Cleaning,Customized Care,Darning,Darning, sofa cleaning, carpet cleaning, laundry, wash & fold, wash & iron,Express Dry,Fabric Washing,Free Pick Up,Free Pick Up And Drop,Free Pickup & Delivery,Free Pickup & Drop,Garments, Home Linen & Upholstery,Home Linen,Ironing Services,Laundry & Dry Cleaning,Leather Cleaning Services,Shoe Cleaning Services,Shoe cleaning,Shoes, Bags And Leather,Stain Removal,Steam Press,Steam Pressing,Sustainable Packing,Wash Care"
"Spin N Press - Dry Cleaning and Laundry Services","075060 91467","Shop no. 5, Ground Floor, Dilkoosha Apartments, Altamount Road Besides Roman Stores, Gowalia Tank, Cumballa Hill, Tardeo, Mumbai, Maharashtra 400026","4.6","63","Services: Clothes pressing,Ironing,Laundry wash and fold,Carpet and rug cleaning,Self-service laundry,Leather and suede cleaning,Jackets,Delivery,Online dry cleaner booking,Dry cleaning,Laundry pick-up,Bag Cleaning,Carpets Dry Cleaned,Cleaning And Pressing,Cleaning Ironing,Cleaning Services,Cleaning Solutions,Clothes Dry Cleaned,Deep Cleaning,Drop Services,Dropping Off,Dry Cleaning & Laundry,Express Dry Cleaning,Express Ironing,Free Pick Up & Drop,Free Pickup,Free Pickup And Delivery,Free Pickup And Drop,Garment Care,Home Delivery,Home Pick Up,Ironing Service,Kids Dress,Laundry Job,Laundry Services,Leather Shoes,Long Dress,On Time Delivery,Party Dress,Personalised Service,Pick Up And Delivery,Premier Dry Cleaning,Premium Dry Cleaning,Request Pickup,Roll Pressing,Saree Plain,Shoe & Bag Cleaning,Shoe Cleaning & Protection,Shoe Laundry,Shoes Dry Cleaning,Shoes Leather,Stain Removal,Sustainable Laundry,Wash & Fold"
"Closet Care Drycleaners","084510 00181","Shop No. 7, Madhurima CHS LTD, Bldg -1, Old D N Nagar, Andheri West, Mumbai, Maharashtra 400053","4.6","196","Services: Carpet and rug cleaning,Couches/sofas,Coat & jacket alterations,Special care fabric cleaning,Jackets,Delivery,Online dry cleaner booking,Drapery & window cover cleaning,Alterations,General bedding cleaning,Laundry pick-up,Wedding gown preservation,Baggage Cleaning,Bed Sheet Single,Carpet Cleaning,Clothes Laundry,Cotton Saree,Curtain Cleaning,Doorstep Delivery,Dry Clean Laundry,Drycleaning Laundry,Garment Treatment,Home Services,Ironing Of Clothes,Laundry (Wash & Fold),Laundry (Wash+Iron),Leather Shoe Cleaning,Pick Up & Delivery,Retail Services,Shoe Laundry,Silk Saree,Sofa Cleaning,Sport Shoe Cleaning,Stain Removals,Steam Ironing"
"Tumbledry Dry Clean & Laundry Service","076772 50250","Shop No-3, Ground Floor, Vaibhav Mahim CHS, Plot-220/222, Swatantryaveer Savarkar Rd, near Hinduja Hospital, Mahim (W), Asavari, Mahim, Mumbai, Maharashtra 400016","5.0","81","N/A"
"The Laundry Hub","N/A","Malad, Ambewadi, Malad East, Mumbai, Maharashtra 400097","4.7","103","Services: Quilt cleaning,Ironing,General clothes drying,Laundry wash and fold,Special care fabric cleaning,Self-service laundry,Leather and suede cleaning,Delivery,Dry cleaning,Laundry pick-up,Carpet cleaning,Cleaning Products,Clothes Clean,Commercial Laundry,Deep Cleaning,Express Laundry,Express Service,Home Services,House Hold,Kg Wash,Laundry & Dry Cleaning Service,Laundry Pickup,Laundry Wash & Iron,Leather Shoes,Mens Clothes,Non Wearables,Pickup And Delivery,Premium Laundry,Pressing Services,Regular Washing,Saree Ironing,Shoe Cleaning,Shoe Laundry,Shoe Washing,Shoes Clean,Shoes Laundry,Specialized Cleaning,Stain Removal,Trusted Laundry Service,Wash & Fold,Wash & Iron,Wash And Iron,Washing Clothes,We Clean Your Clothes,Woolen Clothes"
"German Laundry Express Clean","022 2352 2255","007, “A” Wing, Poornima Apartments, 23rd, Pedder Rd, IT Colony, Tardeo, Mumbai, Maharashtra 400026","4.7","42","Services: Ironing,Clothing alterations & repairs,Laundry wash and fold,Special care fabric cleaning,Self-service laundry,Leather and suede cleaning,Delivery,Dry cleaning,Drapery & window cover cleaning,General bedding cleaning,Laundry pick-up,Wedding gown preservation,Stain Removal,Steam Press,Wet Cleaning,Area rug cleaning,General carpet cleaning,Upholstery cleaning,Drapes and curtain cleaning,Pet stain and odour removal"
"Krishna Power Laundry.","098212 56124","Shop No.5,Building No:17/B, Sai Vaishali Apartment, Haji Zahoor Qureshi Marg, Vaishali Nagar, Jogeshwari West, Mumbai, Maharashtra 400102","4.8","71","Services: Industrial laundry,Quilt cleaning,Clothes pressing,Ironing,Carpet and rug cleaning,Couches/sofas,Special care fabric cleaning,Leather and suede cleaning,Jackets,Hat cleaning,Delivery,Dry cleaning,Drapery & window cover cleaning,General bedding cleaning,Laundry pick-up,Wedding dress cleaning,General clothes drying,Shoes"
"Dhobi Ghar Tak","074001 55190","Room:1 Chawl:14, Dr Baba Saheb Ambedkar Rd, Matunga Labour Camp, Mumbai, Maharashtra 400019","4.9","54","Services: Quilt cleaning,Ironing,General clothes drying,Laundry wash and fold,Special care fabric cleaning,Self-service laundry,Leather and suede cleaning,Delivery,Dry cleaning,Drapery & window cover cleaning,General bedding cleaning,Laundry pick-up,Wedding gown preservation,B2b Services,Carpet Cleaning,Clothes Dry Cleaning,Color Dyeing,Commercial Laundry Service,Dry Cleaning & Laundry Dry Cleaning,Dry Cleaning Washing,Easy Life Solutions,Express Laundry,Garments Washed,German Eco Friendly Cleaning Solutions,Hand Washing,Health Care,Home Linen,Hospital Laundry,Iron Clothes,Kg Washing,Laundry Clothes,Laundry Wash & Fold,Laundry Wash & Iron,Pick & Drop,Pickup And Drop,Premium Iron Ironing,Shoes Cleaning,Special Care,Stain Removal,Washing Clothes,airport laundry services,blazer dryclean,carpet cleaning,commercial laundry service,curtain dry cleaning,express delivery laundry service,factory laundry services,guest laundry services,home delivery laundry service,home laundry services,hospital laundry services,hostel laundry services,hotel laundry services,premium dry clean services,restaurant laundry services,same day laundry,shirt laundry,shoe cleaning,Party dress cleaning,Baby clothes cleaning,laundry services for gym"
"Santosh Laundry","098206 66470","Shop No - 1, Opp Green Court Building, C.D Barfiwala Marg, Juhu Ln, Andheri West, Mumbai, Maharashtra 400058","4.8","62","Services: Clothing alterations & repairs,Quilt cleaning,Delivery,Drapery & window cover cleaning,Dry cleaning,General bedding cleaning"
"Babulal Power Laundry & Dry Cleaner","087887 32833","Shops . no.1, Shah Colony Rd, Saikrupa Society, Indira Nagar, Gilbert Colony, Kanjurmarg East, Mumbai, Maharashtra 400042","4.9","64","Services: Laundry pick-up,Delivery,Dry cleaning,Ironing,Special care fabric cleaning,Laundry wash and fold,Roll press,Wash & Fold,Wash & iron services,Laundry by kg,Laundry by kilo,Curtain cleaning,Steam Ironing,Self-service laundry"
"Blue Angel Dry Cleaners & Dyers","022 6633 4421","No. 5/ 7, Sonawala Buildings, Talmakiwadi, Tardeo, Mumbai, Maharashtra 400007","4.3","93","Services: Organic dry cleaning,Quilt cleaning,Clothes pressing,Ironing,Carpet and rug cleaning,Special care fabric cleaning,Leather and suede cleaning,Delivery,Online dry cleaner booking,Dry cleaning,Drapery & window cover cleaning,General bedding cleaning,Laundry pick-up,Wedding gown preservation,Wedding dress cleaning,Antique Chinese Gharas & Zari Polishing,Ball Gown,Curtains, Carpets And Upholstery Cleaning,Designer Clothes,Designer Wear Drycleaning,Dry Cleaning Process,Dyeing Services,Free Pick Up And Delivery,Indian Ethnic Wear Ofexclusive & Designer Labels,Kids Wear & Soft Toys,Laundering Services,Leather Items,Ourservices,Personalised Dry Cleaning,Pickup And Delivery,Shoes, Bags & Leather Care,Specialist Cleaning Service,Stain Removal,Steam Press,Thorough Cleaning,Wedding Outfit,Whitening & Starching"
"IRON & SHINE Laundry","086575 99754","Shop No. 1710, Dr, Sadhu Vaswani Marg, Babasaheb Ambedkar Nagar, Cuffe Parade, Mumbai, Maharashtra 400005","4.8","155","Services: Quilt cleaning,Ironing,General clothes drying,Clothing alterations & repairs,Laundry wash and fold,Special care fabric cleaning,Self-service laundry,Leather and suede cleaning,Delivery,Dry cleaning,Drapery & window cover cleaning,General bedding cleaning,Laundry pick-up,Wedding gown preservation,Cleaned And Ironed,Clothes Washed,Curtain Cleaning Service,Curtains & Home Linens,Express Service,Fabric Care,Free drop,Free pickup,Garment Care,Hand Wash,Handbag & Shoe Cleaning,Industry Dry Cleaning,Leather Care,Luxury Services,Pick And Drop,Pick Up Service,Premium Service,Press/Iron Only,Repair & Alteration,Stain Removal,Standard Service,Thorough Cleaning,Wedding Outfit Cleaning,Wet Cleaning"
"Rachana Laundry","098190 17674","Shop No.1, UNO Shelter, Match Factory Ln, opposite to Omkar Meridia, BMC Colony, Kurla West, Kurla, Mumbai, Maharashtra 400070","4.9","111","Services: Clothing alterations & repairs,Dry cleaning,Ironing,Leather and suede cleaning,Self-service laundry,Special care fabric cleaning,Laundry wash and fold,Washing,Shoe Cleaning,Industrial Laundry,Rafoo,Dyeing,Petrol Wash,Roll Press,Steam Press,Heavy Boiler Steam Ironing,Soft Toys and Bags Washing,Carpets & Curtains"
"Spin N Press - Dry Cleaning and Laundry Services","075060 91467","Shop 18/19, Ground Floor, NM Joshi Marg, opp. Deepak Cinema, Elphinstone (W), Saidham Nagar, Lower Parel, Mumbai, Maharashtra 400013","4.9","66","Services: Clothes pressing,Ironing,Laundry wash and fold,Carpet and rug cleaning,Special care fabric cleaning,Self-service laundry,Leather and suede cleaning,Delivery,Dry cleaning,Laundry pick-up,Wedding dress cleaning,Cleaning And Pressing,Cleaning Apparel,Cleaning Ironing,Clothes Dry Cleaned,Dry Cleaning & Laundry,Express Drycleaning,Free Pickup,Garment Care,Home Pick Up,Leather Bag,Leather Shoes,Party Dress,Pick Up And Delivery,Pick Up And Drop,Pickup And Deliver,Request Pickup,Saree Plain,Shoe & Bag Cleaning,Shoe Laundry,Stain Removal,Sustainable Laundry"
"PRINCE WASHING & DRY CLEANERS","070210 79331","Rangwala Building, Dhobi Ghat, Babu Kamlakant Marg, Saat Rasta, Jacob Circle, Mumbai, Maharashtra 400011","4.7","213","Services: Clothes pressing,Ironing,Clothing alterations & repairs,Laundry wash and fold,Car wash,Carpet and rug cleaning,Couches/sofas,Coat & jacket alterations,Special care fabric cleaning,Leather and suede cleaning,Delivery,Dry cleaning,Alterations,Laundry pick-up,Commercial service,Wedding gown preservation,All types of dry clean services in affordable rates in past 88 year"
"Euroclean Dry Cleaning & Laundry Services Malad West","N/A","Shop No.7, Bhoomi Castle, New Link Rd, opposite Goregaon Sports Club, Malad, Mindspace, Malad West, Mumbai, Maharashtra 400064","4.5","167","Services: Quilt cleaning,Laundry wash and fold,Self-service laundry,Leather and suede cleaning,Dry cleaning,General bedding cleaning,Wedding gown preservation,Bed sheets,Comforters,Curtains,Designer wear,Embellished wedding wear,Expensive Leather shoes,Fixing tears,Hand Bags,Hanging/Folded Press,Hotel Laundry,House hold Laundry,Leather Jackets,Shoes Cleaning,Silks,Sneakers,Specialised Teflon shoe Iron,Suedes,Suits,Upholstery Cleaning,Wet Cleaning,Zippers,seams"
